ID,Headword,FirstAttestationDate,FirstAttestationExampleMD,Etymology,WClass,Credits,DateOfCreation,DateOfUpdate
26,gema,sXV,"CUNHA, Antônio Geraldo da. Índice do vocabulário do português medieval. Rio de Janeiro: Fundação Casa de Rui Barbosa. v. 1. (A), 1986; v. 2 (B-C) 1988; v. 3 (D) 1994; suplemento (A-C) [informado pelo Dicionário Houaiss]<br><b>1788</b>: “<i>Cerastium viscosum, Senecio viscosus</i>. <i>Gemmae</i> os gomos, ou <i>gemas</i> das folhas principalmente das plantas rezinosas. <i>Populus nigra</i>.” (Extraído de: Diccionario dos termos technicos de Historia Natural, 1788, p. 238)<br>“_ <i>Perennis</i>. Perenne, a qual com a producçaõ de novas <i>gemmas</i>, ou gomos em cada anno produz nova herva.” (Extraído de: Diccionario dos termos technicos de Historia Natural, 1788, p. 194)","O étimo é o latim <i>gemma,ae</i>; a acepção da Botânica (""broto da videira"") já é atestada no latim clássico (conforme informa o Oxford Latin Dictionary <i>s.v.</i> ""gemma"") e, portanto, ao contrário do que parece sugerir o Dicionário Houaiss, não deriva da acepção latina de ""pedra preciosa""; pelo contrário, é a acepção de ""pedra preciosa"" que provavelmente se derivou da de ""broto da videira"", como afirma o Dictionnaire Étymologique de la Langue Latine (<i>s.v</i>. ""gemma""). Assim, a acepção de ""gema do ovo"" pode ter surgido pelo fato de tanto a gema do ovo quanto a da planta terem a função de gerar um novo ser vivo (que é a explicação que dá Corominas, <i>s.v</i>. ""yema"").<br>O verbete <i>gemma</i> no dicionário de Vandelli é referido no índice alfabético ao final, como o verbete de número 166; no entanto, esse verbete não existe de fato (a numeração acaba no 164), o que leva à conclusão de que a obra foi impressa inacabada.<br>A datação informada pelo Dicionário Houaiss é possivelmente referente à acepção de ""gema do ovo"". A acepção da Botânica não foi encontrada em textos anteriores à obra de Vandelli, o que parece indicar que essa acepção “ressuscitou” a partir dos textos em latim científico do século XVIII. O glossário quinhentista de Jerônimo Cardoso emprega a glosa “olho, ou gomo da videira” para a palavra latina “gemma”, o que parece indicar que, de fato, essa acepção não era empregada no século XVI, e o termo equivalente na época seria “olho” ou “gomo”.",substantivo feminino,Bruno Maroneze,28 Feb 2022,14 Jun 2022
27,gomo,1548,"HOLANDA, Francisco de. Da pintura antigua. [1548]. Livro 1: Parte theorica. Livro 2: Dialogos de Roma. Edição completa d’esta celebre obra commentada por Joaquim de Vasconcellos. 2. ed. Porto: Renascença Portuguesa, 1930. [informado pelo Dicionário Houaiss]<br><b>1788</b>: “<i>Stoloniferus.</i> Diz-se daquelle caule, cujos ramos, que tem gomos, ou <i>gemas,</i> descendo até á terra lançaõ nella novas raizes, e destas nascem novas hastes. <i>Ajuga reptans, Viola odorata.</i>” (Extraído de: Diccionario dos termos technicos de Historia Natural, 1788, p. 201)","De acordo com o Dicionário Houaiss, o termo tem origem obscura. Vandelli o emprega sem recurso ao itálico, o que indica que não era sentido como um neologismo. Também não é claro se Vandelli o emprega na mesma acepção definida pelo Houaiss (“a parte compreendida entre dois nós de gramíneas”), visto que o termo “gomo” em Vandelli é apresentado como um sinônimo de <i>gema</i>.",substantivo masculino,Bruno Maroneze,28 Feb 2022,14 Jun 2022
28,hermafrodita,a1566,"STUDIA: revista semestral. Lisboa: Centro de Estudos Históricos Ultramarinos, n. 23. [informado pelo Dicionário Houaiss s.v. ""hermafrodito""]<br>(1649-1666): MELO, Francisco Manuel de. Apologos dialogaes. [1649-1666]. Reprodução fiel do texto da edição de 1721, anotados e precedidos de um esboço bio-bibliográfico do autor por Fernando Nery. Rio de Janeiro: [A.J. de Castilho], 1920. [informado pelo Dicionário Houaiss s.v. ""hermafrodita""]<br><b>1788</b>: “As Flores todas saõ hermaphroditas, e os estames com os pistillos estaõ na mesma flor.” (Extraído de: Diccionario dos termos technicos de Historia Natural, 1788, p. 189)<br>23. <i>POLYGAMIA</i>. Flores hermaphroditos, e machos, ou femeas na mesma planta. (Extraído de: Diccionario dos termos technicos de Historia Natural, 1788, p. 190)<br>3. <i>Frustranea</i>, quando os flosculos hermaphroditos do disco daõ sementes, e as femeas do raio, ou da margem por falta de <i>estigma</i> naõ daõ sementes. (Extraído de: Diccionario dos termos technicos de Historia Natural, 1788, p. 191)","Conforme informa o Dicionário Houaiss, o étimo é o latim <i>hermaphroditus,a,um</i>, já atestado no latim clássico (cf. dicionário de Gaffiot) no sentido de ""andrógino, de ambos os sexos"", por sua vez derivado do grego <i>Hermaphróditos,ou</i> no sentido de ""Hermafrodito, filho de Hermes e Afrodite"".<br>O Dicionário Houaiss indica que o emprego como adjetivo biforme (<i>hermafrodito</i> m, <i>hermafrodita</i> f) é anterior ao emprego como uniforme (<i>hermafrodita</i> m, f). Vandelli parece empregá-lo como biforme, a julgar pelas expressões “flores hermaphroditos” (com “flores” no masculino, possivelmente por influência do italiano) e “flosculos hermaphroditos”. Todas as ocorrências da forma <i>hermaphrodita</i> em Vandelli são com substantivos femininos.",adjetivo,Bruno Maroneze,28 Feb 2022,14 Jun 2022
29,jardim botânico,1718: “Jardim Real Botanico”,"“O Duque Regente naõ querendo encarregar-se da nomeaçaõ de outro, deyxou a eleyçaõ ao Duque de Maine, & Marechal de Ville-Roy, & Duqueza de Ventadour, os quaes nomearaõ a Mons. Dodart, que foy Medico do Duque de Borgonha, & dos Principes seus filhos, & agora o era da Princeza viuva de Conti; & como este emprego tem de renda 54U. libras, reservou S. A. Real para o seu Medico Mons. Chivax a direcçaõ do Jardim Real Botanico, ou das plantas medicinaes exquisitas, que rende seis mil florins. (Extraído de: Gazeta de Lisboa Occidental, n. 19, maio de 1718, p. 151. Disponível em: http://hemerotecadigital.cm-lisboa.pt/Periodicos/GazetadeLisboa/1718/Maio/Maio_item1/P15.html)<br><b>1735<b>: “<i>A morte dos enemigos de</i> Arcagathus<i>, a inefficacia dos</i> encantos magicos<i>, as honras que havia feito á Faculdade</i> Attalus<i>, o ultimo Rey de</i> Pergamus<i>, o qual fez a o</i> Povo Romano <i>seu herdeiro, e foy tam grande promotor da Sciencia Medica, que chegou a cultivar hum</i> jardim botanico <i>em seu proprio palacio, para fazer experiencias nos condenados por criminozos, para beneficio do resto de seus Vassalos</i> (Extraído de: Jacob de Castro Sarmento, Materia Medica Physico-Historico-Mechanica, Reyno Mineral, 1735, p. xi. Disponível em: https://books.google.pt/books?id=B1fi4PvVN8wC)<br><b>1788</b>: “O primeiro conhecimento adquire-se com o estudo da botanica, o segundo com experiencias e reflexões fisicas, o terceiro, e quarto com hum jardim botanico, no qual he necessario cultivar os vegetaes de todos os climas, e terrenos.” (Extraído de: Diccionario dos termos technicos de Historia Natural, 1788, p. 294)","O Dicionário Houaiss data essa expressão do ano de 1852, mas não informa a fonte. A expressão é bem mais antiga, como mostra o contexto de 1735. Em 1718, a expressão que aparece é “Jardim Real Botanico”, com o elemento “Real” intercalado, o que revela que a expressão ainda estava em vias de se consolidar na forma que tem nos dias atuais.<br>É possível que essa expressão seja um decalque de uma expressão semelhante de outra língua europeia. O francês <i>jardin botanique</i> já aparece em 1673 (“Recherche des Antiquités et Curiosités de la ville de Lyon”, disponível em https://books.google.pt/books?id=btFTAAAAcAAJ), ainda que a data indicada pelo Trésor de la Langue Française seja 1732. O latim <i>hortus botanicus</i> é ainda mais antigo, aparecendo na obra “Critica Sacra”, de Edward Legh, 1639 (disponível em https://books.google.pt/books?id=0IRmAAAAcAAJ). Dessa forma, é razoável supor que a expressão portuguesa tenha sido uma tradução de uma expressão equivalente em outra língua.",substantivo masculino,Bruno Maroneze,28 Feb 2022,14 Jun 2022
30,lacínia,1783,"“Lacin-ia, ete; <i>L.: orla, banda</i>.” (Extraído de: BACELLAR, Bernardo de Lima e Mello. Diccionario da lingua portugueza. Lisboa: Aquino Bulhoens, 1783. Disponível em: https://books.google.pt/books?id=55ICAAAAQAAJ).<br><b>1788</b>: “<i>Bifidum. fig. 16.</i> He a folha superiormente dividida em duas partes, ou lacinias, ficando as margens interiores rectas.” (Extraído de: Diccionario dos termos technicos de Historia Natural, 1788, p. 217)","Conforme informa o Dicionário Houaiss, o étimo é o latim </i>lacinia,ae</i>, que no latim da Antiguidade significava ""borda, extremidade, orla"". Foi empregada na acepção da Botânica no latim científico do século XVIII, conforme atesta a própria obra de Vandelli.",substantivo feminino,Bruno Maroneze,28 Feb 2022,26 Jan 2023
31,longitudinal,1788,"“<i>Orbiculatum. fig. 1.</i> Tendo o diametro longitudinal igual ao transversal, formando deste modo huma figura circular. <i>Geranium sanguineum.</i>” (Extraído de: Diccionario dos termos technicos de Historia Natural, 1788, p. 213)<br>“— <i>Striatum.</i> Sendo as linhas da folha longitudinaes, e algum tanto profundas, e parallelas. <i>Aloe retusa.</i>” (Extraído de: Diccionario dos termos technicos de Historia Natural, 1788, p. 223)<br><b>1858</b>: SILVA, Antonio de Morais. Diccionario da lingua portugueza: composto pelo padre d. Rafael Bluteau, reformado, e accrescentado por Antonio de Moraes Silva. Lisboa: Off. S.T. Ferreira, 6. ed.,1858. [informado pelo Dicionário Houaiss]","O Dicionário Houaiss afirma que a palavra formou-se por derivação sufixal a partir do radical latino <i>longitudine</i>, juntamente com o sufixo <i>-al</i>; no entanto, o adjetivo latino <i>longitudinalis</i> já é atestado no século XIII, segundo o Trésor de la Langue Française (<i>s.v.</i> ""longitudinal""), e o francês <i>longitudinal</i> é atestado no século XIV (segundo o mesmo dicionário); assim, é mais razoável considerar que a palavra é um empréstimo do latim medieval ou do francês, não tendo sido formado em português.",adjetivo,Bruno Maroneze,28 Feb 2022,14 Jun 2022
32,medular,1739,"“Desta substancia oleosa, e medullar necessitaõ os ossos, porque saindo dos seus pòros, tempéra com sua untuosidade as particulas do sangue, que devem nutrir os mesmos ossos, e tambem serve para os conservar no seu temperamento, lubrificando, e impedindo, que pela muita sequidaõ não se quebrem facilmente.” (Extraído de: Anatomia do Corpo Humano, 1739, p. 247)<br><b>1789</b>: “MEDULLAR, adj. da natureza da medulla <i>v. g.,, a sustancia medullar</i>.” (Extraído de: SILVA, Antonio de Morais. Diccionario da lingua portugueza: composto pelo padre d. Rafael Bluteau, reformado, e accrescentado por Antonio de Moraes Silva. Lisboa: Off. S.T. Ferreira, 1789. 2 v)","O Dicionário Houaiss afirma que se trata de uma derivação sufixal a partir de <i>medula</i> com o acréscimo do sufixo <i>-ar</i>, e também remete ao adjetivo latino <i>medullaris,e</i>, que significa ""que penetra a medula dos ossos"". Como já se encontra o mesmo adjetivo no latim científico do século XVIII com o sentido de ""relativo à medula"" (como na obra “De Atonia Nervorum”, de Johann Christoph von Steinen, 1749, disponível em https://books.google.pt/books?id=Ubav7mRfZ\_cC), é razoável supor que o termo entrou na língua portuguesa como um empréstimo, e não como um derivado sufixal.",adjetivo,Bruno Maroneze,28 Feb 2022,27 Jan 2023
33,membranáceo,1788,"“<i>Scariosum</i>. As escamas na sua margem saõ membranaceas, seccas, e sonoras.” (Extraído de: Diccionario dos termos technicos de Historia Natural, 1788, p. 252)<br><b>1873</b>: “MEMBRANACEO, A, <i>adj</i>. Termo de Historia Natural. Que tem membrana.” (Extraído de: VIEIRA, Domingos. Grande diccionario portuguez ou Thesouro da lingua portugueza. Porto: E. Chardron e B.H. de Moraes; Rio de Janeiro: A.A. da Cruz Coutinho; Pará: A.R. Quelhas, 1871-1874)","Conforme informa o Dicionário Houaiss, o étimo é o latim <i>membranaceus,a,um</i>, que significa ""feito de uma membrana, formado de uma membrana; liso como uma membrana"", já empregado no latim científico, conforme atesta a obra de Vandelli. O sinônimo “membranoso” também ocorre em Vandelli, na parte reservada à Zoologia.",adjetivo,Bruno Maroneze,28 Feb 2022,14 Jun 2022
34,oblongo,1757,"BIDERMAN, Maria Tereza Camargo; MURAKAWA, Clotilde de Almeida Azevedo (Coord.). Dicionário histórico do português do Brasil: séculos XVI, XVII e XVIII. Araraquara: Unesp, Laboratório de Lexicografia. 19 v. [informado pelo Dicionário Houaiss]<br><b>1788</b>: “<i>\_ Panduriforme.</i> He huma folha oblonga (39); mais larga superiormente, com o apice, e a base elevada; o apice alguma cousa connivente, e inferiormente mais larga, e nos lados apertada.” (Extraído de: Diccionario dos termos technicos de Historia Natural, 1788, p. 217)","O étimo é o latim <i>oblongus,a,um</i>, com o mesmo sentido, já empregado na Botânica no século XVIII, como atesta o próprio dicionário de Vandelli (por exemplo, à p. 214). Entrou na língua portuguesa como um empréstimo, provavelmente do latim científico. A atestação mais antiga informada pelo Dicionário Houaiss é possivelmente para outra acepção.",adjetivo,Bruno Maroneze,28 Feb 2022,14 Jun 2022
35,papilionáceo,1788,"“2.) <i>Alae.</i> Azas se dizem os petalos das flores papilionaceas, entre o <i>Vexillo,</i> e a <i>Carina.</i>” (Extraído de: Diccionario dos termos technicos de Historia Natural, 1788, p. 196)<br><b>1788</b>: “<i>— Papillionacea</i>. À semelhança quasi de borboleta: esta <i>corolla</i> consta de quatro <i>petalos</i> irregulares, ou desiguaes. <i>Pisum</i>. <i>Lathyrus</i>.” (Extraído de: Diccionario dos termos technicos de Historia Natural, 1788, p. 260)<b>1789</b>: “PAPILIONACEO, adj. da Botan. <i>v. g. „flor —</i>, que tem feição de borboleta.” (Extraído de: SILVA, Antonio de Morais. Diccionario da lingua portugueza: composto pelo padre d. Rafael Bluteau, reformado, e accrescentado por Antonio de Moraes Silva. Lisboa: Off. S.T. Ferreira, 1789)</i>","O étimo é o latim científico <i>papilionaceus,a,um</i> (também grafado <i>papillionaceus</i> com dois LL), atestado na própria obra de Vandelli, derivado do latim clássico <i>papilio,onis</i>, que significa “borboleta”. O Dicionário Houaiss informa que o adjetivo <i>papilionáceo</i> deriva do substantivo feminino <i>papilionácea</i>, “com troca de sufixo”; porém, a datação informada para o substantivo é 1899, enquanto a datação do adjetivo é 1788 (Vandelli) e 1789 (Moraes Silva). Dessa forma, os dados não corroboram essa descrição do Dicionário Houaiss.",adjetivo,Bruno Maroneze,28 Feb 2022,14 Jun 2022
36,parasítico,1788,"“Quando está pois pegada á outra planta, e naõ á terra, então chama-se a <i>planta parasitica</i> como <i>Epidendrum</i>, <i>Viscum</i>.” (Extraído de: Diccionario dos termos technicos de Historia Natural, 1788, p. 193)<br><b>1789</b>: “PARASITICO adj. de parasito. § <i>Planta parasitica</i>, a que se cria no tronco de outra, e se nutre de sua sustancia.” (SILVA, Antonio de Morais. Diccionario da lingua portugueza: composto pelo padre d. Rafael Bluteau, reformado, e accrescentado por Antonio de Moraes Silva. Lisboa: Off. S.T. Ferreira, 1789. 2 v)</i>","O Dicionário Houaiss propõe que o termo é uma derivação sufixal (<i>parasita</i> + <i>-ico</i>). Como o dicionário de Vandelli não registra uma forma latina equivalente, não há evidência de que tenha sido um decalque do latim científico.Tanto Vandelli quanto Moraes Silva registram a expressão <i>planta parasitica</i>, o que leva a crer que o adjetivo pode ter tido o seu primeiro emprego como parte dessa expressão, e apenas depois tem seu emprego estendido para outros tipos de parasitas.",adjetivo,Bruno Maroneze,28 Feb 2022,14 Jun 2022
37,pecíolo,1788,"“<i>Petiolus.</i> Pésinho, ou  <i>peciolo</i> he huma especie de tronco, que une, e eleva a folha, e naõ a fructificaçaõ.” (Extraído de: Diccionario dos termos technicos de Historia Natural, 1788, p. 232)<br><b>1797</b>: BIDERMAN, Maria Tereza Camargo; MURAKAWA, Clotilde de Almeida Azevedo (Coord.). Dicionário histórico do português do Brasil: séculos XVI, XVII e XVIII. Araraquara: Unesp, Laboratório de Lexicografia. 19 v. (No prelo.) [informado pelo Dicionário Houaiss]","Conforme informa o Dicionário Houaiss, o étimo é o latim <i>petiolus,i</i>, que desde a Antiguidade tem o sentido de ""pé pequeno; pé dos frutos, pecíolo"". No entanto, a forma da palavra indica que não se trata de palavra herdada, mas de um empréstimo do latim científico. Vandelli emprega tanto a forma adaptada <i>peciolo</i> quanto a forma traduzida <i>pésinho</i> (também grafada <i>pesinho</i> ou <i>pezinho</i>) para traduzir o termo latino <i>petiolus</i>, conforme se observa no trecho transcrito. A forma <i>pezinho</i> também é empregada pelo autor para traduzir o termo <i>pedunculus</i>.",substantivo masculino,Bruno Maroneze,28 Feb 2022,14 Jun 2022
38,pedúnculo,1788,"“88. <i>Pedunculus.</i> He hum tronco parcial, que levanta a frutificaçaõ, e naõ as folhas.<br>I.<i>Partialis, Sive pedicellus. fig.</i> 132. 149. 145. Que sustenta quasi sempre huma só frutificação. <i>fig.</i> 135. <i>b.</i> ou que sahe de outro <i>pedunculo</i> comum.” (Extraído de: Diccionario dos termos technicos de Historia Natural, 1788, p. 240)<br><b>1789</b>: “PEDUNCULO, s. m. da Botan. o pésinho que une certas folhas aos ramos, e assim varias frutas.” (Extraído de: SILVA, Antonio de Morais. Diccionario da lingua portugueza: composto pelo padre d. Rafael Bluteau, reformado, e accrescentado por Antonio de Moraes Silva. Lisboa: Off. S.T. Ferreira, 1789. 2 v)","Conforme explica o Dicionário Houaiss, o étimo é o latim <i>pedunculus,i</i>, diminutivo de <i>pes,pedis</i> (que significa ""pé""). O dicionário de Gaffiot informa que <i>pedunculus</i> ou <i>pediculus</i> já na Antiguidade era empregado com o sentido de ""pedúnculo, haste de uma folha"", mas o étimo do termo português é, evidentemente, o latim científico, visto que a palavra não é herdada. Vandelli distingue (embora nem sempre com muita clareza) os conceitos de <i>pedúnculo</i> (haste da frutificação), <i>pecíolo</i> (haste da folha) e <i>pedicelo</i> (ramo de um pedúnculo). Já a definição de Morais Silva não é tão clara, aparentemente confundindo os conceitos.",substantivo masculino,Bruno Maroneze,28 Feb 2022,14 Jun 2022
39,perene,1583,"BIDERMAN, Maria Tereza Camargo; MURAKAWA, Clotilde de Almeida Azevedo (Coord.). Dicionário histórico do português do Brasil: séculos XVI, XVII e XVIII. Araraquara: Unesp, Laboratório de Lexicografia. 19 v. (No prelo.) [informado pelo Dicionário Houaiss]<br><b>1788</b>:“<i>Perennis.</i> Perenne, a qual com a producçaõ de novas <i>gemmas,</i> ou gomos em cada anno produz nova herva. <i>Glechoma bederacea</i>, <i>Viola odorata</i>” (Extraído de: Diccionario dos termos technicos de Historia Natural, 1788, p. 194)","Conforme informa o Dicionário Houaiss, o étimo é o latim <i>perennis,e</i>, com o sentido de ""que dura, sólido, durável, duradouro"". A forma da palavra não permite identificar se é uma palavra herdada ou um empréstimo erudito. A datação informada pelo Dicionário Houaiss é possivelmente para outras acepções fora do âmbito da Botânica.",adjetivo,Bruno Maroneze,28 Feb 2022,14 Jun 2022
40,piloso,1788,"“<i>Nudum.</i> Sendo a folha destituida de excrescencias pilosas, verrucosas &c. <i>Daphne cneorum, Mentha vulgaris</i>.” (Extraído de: Diccionario dos termos technicos de Historia Natural, 1788, p. 222)<br><b>1823</b>: “PLÒSO, adj. Cabelludo, abundante de pello.” (Extraído de: SILVA, Antonio de Morais. Diccionario da lingua portugueza: composto pelo padre d. Rafael Bluteau, reformado, e accrescentado por Antonio de Moraes Silva. Lisboa: Off. S.T. Ferreira, 3. ed., 1823.)","O étimo é o latim científico <i>pilosus,a,um</i>, com o mesmo sentido, conforme atesta o próprio dicionário de Vandelli. A palavra latina já era usada na Antiguidade com o sentido de “peludo, coberto de pelos” (conforme se lê no dicionário de Gaffiot), mas o termo português é claramente um empréstimo do latim científico, e não uma palavra herdada.",adjetivo,Bruno Maroneze,28 Feb 2022,14 Jun 2022
41,pimpolho,1188-1230,"MACHADO, José Pedro. Dicionário etimológico da língua portuguesa. 1. ed. Lisboa: [Horizonte]: 1952-1959. 2 v.; 2. ed. Lisboa: Confluência, 1967-1973. 3 v.; 3. ed., 1977. 5 v. [informado pelo Dicionário Houaiss]<br><b>1788</b>: “<i>Stolones</i>. Pimpolhos, que nascem do pé do caule, ou da raiz, que arrancados se plantaõ. <i>Cornus, Sorbus, Ficus</i>.” (Extraído de: Diccionario dos termos technicos de Historia Natural, 1788, p. 201)","O Dicionário Houaiss afirma que a palavra é resultado da composição da raiz <i>pino</i> (derivado do latim <i>pinus</i> no sentido de ""pinho"") com a raiz <i>pollo</i> (derivado do latim <i>pullus,i</i> no sentido de ""vegetal ou animal jovem""). Vandelli não emprega itálico, indicando que de fato não era sentido como neológico. No entanto, ao contrário do que afirma o Dicionário Houaiss, Vandelli emprega o termo para se referir a qualquer broto, não apenas o da videira.<br>A acepção contemporânea de “criança” é provavelmente posterior à obra de Vandelli, como afirma o próprio Dicionário Houaiss.",substantivo masculino,Bruno Maroneze,28 Feb 2022,14 Jun 2022
42,pistilo,1782,"CUNHA, Antônio Geraldo da. Dicionário etimológico Nova Fronteira da língua portuguesa. Rio de Janeiro, 1982. 2. ed., 1986. [informado pelo Dicionário Houaiss]<br><b>1788</b>: “1. As ordens <i>Polygamia æqualis</i> consta de muitas flores pequenas com estames, e pistillos.” (Extraído de: Diccionario dos termos technicos de Historia Natural, 1788, p. 191)<br>“133. <i>Pistillum</i>. <i>fig</i>. 143. 149. <i>d</i>. 150. <i>a</i>. 152. He huma parte da flor posta o meio, pela qual entra o <i>pollen</i>, ou a aura seminal no <i>germe</i>, ou ovario para a fecundaçaõ; està cercado dos <i>filamentos</i>, e está posto geralmente entre as <i>antheras</i>, e consta de <i>germe</i>, <i>stilo</i> e <i>estigma</i>.Os pistilos saõ differentes.” (Extraído de: Diccionario dos termos technicos de Historia Natural, 1788, p. 267-8)","O Dicionário Houaiss informa que a palavra derivaria do “lat. <i>pistillum</i> ou <i>pistillus,i</i> no sentido de ‘mão de pilão’”; no entanto, é pouco provável que seja uma palavra herdada, visto que a datação é tardia. Assim, não se pode falar que o sentido latino de “mão de pilão” tenha se transformado no sentido de “parte da flor” em português. O emprego da forma latina <i>pistillum</i> no latim científico (como atesta o dicionário de Vandelli) deixa claro que o étimo da forma portuguesa é o latim científico, já no sentido corrente de “parte da flor”, e a alteração de sentido se deve a um emprego metafórico já ocorrido no latim científico.",substantivo masculino,Bruno Maroneze,28 Feb 2022,14 Jun 2022
43,receptáculo,1597,"COUTO, Diogo do. Cinco livros da decada doze da historia da India... 4-5, 1597; 6, 1599; 7, 1603; 8-9, 1600; 10, 1614; 11-12, 1645. [Informado pelo Dicionário Houaiss]<br><b>1788</b>: “155. <i>Receptaculum</i>. He o leito, ou placenta, ou base, em que estaõ pegadas as partes da frutificaçaõ (104). O <i>receptaculo</i> cêrca internamente as paredes do <i>caliz</i> na classe <i>Icosandria</i>, e em algumas outras plantas; e assim a <i>corolla</i>, e os <i>filamentos</i> estaõ pegados ao <i>caliz</i>.” (Extraído de: Diccionario dos termos technicos de Historia Natural, 1788, p. 281)","O étimo é o latim <i>receptaculum,i</i>, que já no século XVIII era empregado com a acepção da Botânica. A data informada pelo Dicionário Houaiss é provavelmente para outra acepção. A data de 1788 para essa acepção é possivelmente a obra de Brotero. Consultas a especialistas são necessárias para verificar quais são de fato as diferenças entre as três acepções da Botânica e se de fato ocorre essa polissemia.",substantivo masculino,Bruno Maroneze,28 Feb 2022,14 Jun 2022
44,repente,1788,"“12.\_ <i>b.) Sarmentosus. fig.</i> 131. He hum caule quasi nú, <i>repente</i>, sem raizes lateraes, ou caule delgado, e de igual grossura, com nós, que lançaõ raizes. <i>Vitis vinifera. Clematis vitalba.</i> \_ <i>Radicans. fig.</i> 112. Lançando dos ramos varias raizes, com as quaes se eleva a grande altura. <i>Hedera helix.</i> \_ <i>Repens.</i> Caule, que lança varias raizes extendendo-se horizontalmente sobre a terra. <i>Potentilla anserina. Lysimachia nummularia.</i>” (Extraído de: Diccionario dos termos technicos de Historia Natural, 1788, p. 201)","Conforme informa o Dicionário Houaiss, o étimo é o latim <i>repens,entis</i>, particípio presente do verbo <i>repere</i>, que significa “arrastar-se”. Esse adjetivo já era empregado no latim científico, conforme atesta o próprio dicionário de Vandelli. O Dicionário Houaiss registra esse verbete como o homônimo 2 e não traz datação.",adjetivo,Bruno Maroneze,28 Feb 2022,14 Jun 2022
