ID,Headword,FirstAttestationDate,FirstAttestationExampleMD,Etymology,WClass,Credits,DateOfCreation,DateOfUpdate
45,romboidal,1788,"“<i>Deltoideum, fig. 58.</i> Por alguma semelhança; que tem com a letra grega Delta. A folha he romboidal, e os dous angulos lateraes menos se afastaõ da base da folha. <i>Populus nigra.</i>” (Extraído de: Diccionario dos termos technicos de Historia Natural, 1788, p. 216)<br><b>1801</b>: TELLES, Vicente Coelho de Seabra Silva. Nomenclatura chimica portugueza, franceza, e latina á que se ajunta o systema de characteres chimicos adaptados a esta nomenclatura por Haffenfratz, e Adet. Lisboa: Typ. Chalcographica Typoplastica e Litteraria do Arco do Cego, 1801. [informado pelo Dicionário Houaiss]","O Dicionário Houaiss afirma se tratar de uma derivação sufixal a partir do substantivo <i>romboide</i>, com o acréscimo do sufixo <i>-al</i>. O Trésor de la Langue Française afirma que o francês <i>rhomboïdal</i> é atestado desde 1671, forma essa que pode ter influenciado a forma portuguesa.",adjetivo,Bruno Maroneze,28 Feb 2022,14 Jun 2022
46,sexual,1788,"“As classes das plantas no sistema sexual de Linneo” (Extraído de: Diccionario dos termos technicos de Historia Natural, 1788, p. 189)<br><b>1789</b>: “SEXUAL, adj. que respeita ao sexo <i>v. g.</i> ,, <i>differença</i> — § <i>system</i> —, o dos Botanicos, que attribuem ás plantas diversidade de sexo.” (Extraído de: MORAES SILVA, Antônio de. Diccionario da Lingua Portugueza…. Lisboa: na officina de Simão Thaddeo Ferreira. 1789, <i>s.v.</i> ""sexual"").","O étimo é o latim científico <i>sexualis, -e</i>, adjetivo já empregado no contexto da Botânica, conforme atesta, por exemplo, o título da obra “Examen epicriseos in Systema Plantarum sexuale Cl. Linnaei”, de Siegesbeck, publicado em 1737 (disponível em https://books.google.pt/books?id=8h0OhDnDIvcC). O Dicionário Houaiss informa que esse mesmo adjetivo já era empregado em latim tardio com o sentido de ""do sexo feminino, feminil, de mulher""; no entanto, esse emprego provavelmente desapareceu e ressurgiu no latim científico, de onde passou ao português.",adjetivo,Bruno Maroneze,28 Feb 2022,14 Jun 2022
47,síliqua,1735,"COELHO, Manoel Rodrigues. Pharmacopea Tubalense, chimico-galenica. Lisboa, 1735. [informado pelo Dicionário Houaiss]<br><b>1788</b>: “<i>Siliculosa.</i> Com pequenas siliquas.” (Extraído de: Diccionario dos termos technicos de Historia Natural, 1788, p. 191)<br>“140. <i>b</i>.) <i>Siliqua fig</i>. 155. He hum <i>pericarpio</i> de duas <i>valvas</i>, concavo, cujas sementes, estaõ pegadas ao comprimento de ambas as suturas, ou unioens das duas <i>valvas</i>. Diz-se <i>siliqua</i> quando o comprimento excede muito á largura.” (Extraído de: Diccionario dos termos technicos de Historia Natural, 1788, p. 274)","O étimo é o latim <i>siliqua,ae</i> ""vagem"", empregado desde a Antiguidade (como atesta o dicionário de Gaffiot), mas que no latim científico adquire uma acepção mais precisa no âmbito da Botânica e, assim, passa ao português.",substantivo feminino,Bruno Maroneze,28 Feb 2022,14 Jun 2022
48,sucoso,1663,"VASCONCELLOS, Simão de. Chronica da Companhia de Jesu do Estado do Brasil e do que obrarão seus filhos nesta parte do Novo Mundo: ... e alguãs noticias antecedentes curiosas, & necessarias das cousas daquelle Estado. Lisboa: Off. de Henrique Valente de Oliveira, 1663. [informado pelo Dicionário Houaiss]<br>(1788): “<i>Scapus. fig. 113.</i> He hum tronco universal sucoso, que sustenta taõ sómente a fructificaçaõ.” (Extraído de: Diccionario dos termos technicos de Historia Natural, 1788, p. 197)<b>1788</b>: “<i>Bulbosa</i>. O Bulbo, quando a raiz he mais grossa, que o tronco. <i>fig</i>. 125; e a raiz bulbosa he de huma substancia mais molle, succosa; ou esta he <i>tunicata</i>.” (Extraído de: Diccionario dos termos technicos de Historia Natural, 1788, p. 196)","O Dicionário Houaiss informa que o étimo é o latim <i>sucosus,a,um</i>, significando ""que contém suco"". A ausência da transformação do <i>c</i> intervocálico para <i>g</i> revela que a palavra não é herdada. A não-ocorrência da forma latina na obra de Vandelli pode indicar que o termo não entrou na língua portuguesa pelo latim científico e pode ter sido criado por derivação sufixal, e não por empréstimo.Ambas as grafias <i>sucoso</i> e <i>succoso</i> ocorrem na obra de Vandelli.",adjetivo,Bruno Maroneze,28 Feb 2022,14 Jun 2022
49,túnica,959,"MACHADO, José Pedro. Dicionário etimológico da língua portuguesa. 1. ed. Lisboa: [Horizonte]: 1952-1959. 2 v.; 2. ed. Lisboa: Confluência, 1967-1973. 3 v.; 3. ed., 1977. 5 v. [informado pelo Dicionário Houaiss]<br><b>1788</b>: “<i>\_ Tunicata.</i> Quando a raiz está envolvida em membrana. <i>Allium sativum.</i> \_ <i>Nuda.</i> Destituida de tunica.” (Extraído de: Diccionario dos termos technicos de Historia Natural, 1788, p. 196)“<i>Rostellum</i>. He a parte fimples do <i>corculo</i> descendente, ou a base da <i>plumula</i>, que, forma a raiz, formando a <i>plumula</i> o tronco, ou <i>caule</i>.O ser, ou essencia da semente. Consiste no <i>corculo</i>, o qual está pegado ao <i>cotyledon</i>, e he cuberto pelo mesmo, e depois he todo cuberto com huma membrana, ou tunica.” (Extraído de: Diccionario dos termos technicos de Historia Natural, 1788, p. 278)</i>","Conforme informa o Dicionário Houaiss, o étimo é o latim <i>tunica,ae</i>, que já na Antiguidade significava ""vestimenta inferior usada pelos romanos de ambos os sexos"". A acepção da Botânica ocorre também no latim científico (como se observa, por exemplo, na obra “De radicum in plantis ortu et directione”, de Gottlob Bose, 1754, p. 7, disponível em https://books.google.pt/books?id=VK1JAAAAcAAJ).",substantivo feminino,Bruno Maroneze,28 Feb 2022,28 Jan 2023
50,vilo,1788,"“<i>Villus.</i> Villo he huma excrescencia pillosa, porém muito mais tenra.” (Extraído de: Diccionario dos termos technicos de Historia Natural, 1788, p. 237)","O étimo é o latim científico <i>villus,i</i>, empregado no século XVIII com o mesmo sentido, como mostra o próprio dicionário de Vandelli. Segundo o dicionário de Gaffiot, no latim da Antiguidade essa palavra designava pelos de animais, mas também poderia se referir ao musgo.Esse termo não é registrado no Dicionário Houaiss nem nos dicionários Aulete ou Michaelis. É possivelmente um termo que desapareceu da língua portuguesa.",substantivo masculino,Bruno Maroneze,28 Feb 2022,28 Jan 2023
51,verrucoso,1788,"“<i>Nudum</i>. Sendo a folha destituida de excrescencias pilosas, verrucosas &c. <i>Daphne cneorum, Mentha vulgaris</i>.” (Extraído de: Diccionario dos termos technicos de Historia Natural, 1788, p. 222)","O étimo é o latim <i>verrucosus,a,um</i>, que significa “que tem verrugas”, atestado desde a Antiguidade (conforme atesta o Oxford Latin Dictionary). O sentido de “semelhante a uma verruga”, que é o encontrado em Vandelli (1788), é possivelmente do latim científico.",adjetivo,Bruno Maroneze,13 May 2022,14 Jun 2022
52,resina,1223-1279,"MACHADO, José Pedro. Dicionário etimológico da língua portuguesa. 1. ed. Lisboa: [Horizonte]: 1952-1959. 2 v.; 2. ed. Lisboa: Confluência, 1967-1973. 3 v.; 3. ed., 1977. 5 v. [informado pelo Dicionário Houaiss]<br><b>1788</b>: “Resina. A rezina he dissoluvel no espirito de vinho, arde no fogo. <i>Therebinthina</i>.” (Extraído de: Diccionario dos termos technicos de Historia Natural, 1788, p. 239)","O étimo é a forma latina <i>resīna,ae</i> (com o mesmo sentido), atestada desde a Antiguidade, segundo o Oxford Latin Dictionary. A julgar pela permanência do -n- intervocálico na forma portuguesa, a palavra deve ser considerada erudita (ainda que atestada desde a Idade Média, segundo o dicionário Houaiss), ou, talvez, uma reconstituição erudita posterior (visto que o mesmo dicionário informa que a forma medieval é <i>resia</i>).",substantivo feminino,Bruno Maroneze,24 May 2022,14 Jun 2022
53,resinoso,1783,"[informado pelo dicionário Houaiss]<br>“<b>1788</b>:<i>Cerastium viscosum, Senecio viscosus</i>. <i>Gemmae</i> os gomos, ou <i>gemas</i> das folhas principalmente das plantas rezinosas. <i>Populus nigra</i>.” (Extraído de: Diccionario dos termos technicos de Historia Natural, 1788, p. 239)","O Dicionário Houaiss informa que o termo é formado por derivação sufixal a partir do substantivo <i>resina</i>. No entanto, a forma latina <i>resinosus, a, um</i> (com o sentido de “cheio de resina”) já é atestada na Antiguidade, como informa o Oxford Latin Dictionary. Dessa forma, é possível supor que o étimo seja a forma latina.",adjetivo,Bruno Maroneze,24 May 2022,14 Jun 2022
54,hipogástrio,1739,"""No abdomen se consideraõ tres regioens; a primeira, e suprema, se chama epigastrica, a qual acaba dous dedos pouco mais, ou menos sobre o embigo. A segunda, e media, se diz umbilical, que termina abaixo do embigo, dous dedos pouco mais, ou menos. A terceira, e inferior às outras, he a que chamaõ <Hypogastrio>."" (Extraído de: Anatomia do corpo humano, 1739, pp. 8-9)","O étimo é o latim científico hypogastrium, empregado em textos em latim científico do século XVI (cf., por exemplo, “Opera Chirurgica” de Ambrosius Paraeus: https://www.google.com.br/books/edition/Opera_chirurgica_Ambrosii_Paraei_Galliar/hVpJAAAAcAAJ?hl=pt-BR&gbpv=0); este, por sua vez, é uma adaptação da palavra grega hypogástrion (ὑπογάστριον), registrada no dicionário LSJ com o significado de “baixo ventre”. O dicionário Houaiss dá como étimo o adjetivo hupogástrios,os,on, mas este adjetivo tem, no LSJ, apenas o sentido de “sexual”.",substantivo masculino,Raissa Silveira Buss; Bruno Maroneze,20 Jun 2022,20 Jun 2022
55,epigástrio,1739,"""10 No abdomen se consideraõ tres regioens; a primeira, e suprema, se chama epigastrica, a qual acaba dous dedos pouco mais, ou menos sobre o embigo. A segunda, e media, se diz umbilical, que termina abaixo do embigo, dous dedos pouco mais, ou menos. A terceira, e inferior às outras, he a que chamaõ Hypogastrio. fig. 1. 3.<br><b>1739</b>11 As partes do Epigastrio lateraes, e superiores, saõ os hypocondrios, ou vasios, hum da parte direita, e outro da parte esquerda."" (Extraído de: Anatomia do corpo humano, 1739, pp. 8-9)","O étimo é o latim científico <i>Epigastrium</i>, atestado já no século XVI (por exemplo, em “A dictionary in Latine and English”, de John Veron, 1575 - https://www.google.com.br/books/edition/A_Dictionary_in_Latine_and_English_corre/H85lAAAAcAAJ). Por não estar registrado nem no Oxford Latin Dictionary nem no dicionário de Gaffiot, supõe-se que não era empregado em latim na Antiguidade; mas o dicionário LSJ registra a forma <i>epigástrion</i>) (ἐπιγάστριον), ora com o sentido de “abdômen”, ora com o sentido de “parte do abdômen acima do umbigo”. Assim, a forma latina, provavelmente medieval ou renascentista, foi cunhada a partir do grego.",substantivo masculino,Raissa Silveira Buss; Bruno Maroneze,25 Jul 2022,25 Jul 2022
56,diafragma,1713,"“O diafragma, he hum paniculo, ou membrana musculosa que atravessando o peito, divide, & separa os membros vitaes, a saber, o coraçaõ, & os bofes dos membros naturaes, a saber, o baço, & intestinos.” (BLUTEAU, Raphael. Vocabulario Portuguez e Latino. Coimbra: Collegio das Artes da Companhia de JESU, 1713. https://www.google.com.br/books/edition/Vocabulario_Portuguez_E_Latino/ZMZKAAAAcAAJ?hl=en&gbpv=0)","O étimo é o latim <i>diaphragma</i>, que, segundo o dicionário de Gaffiot, é atestado na obra de Célio Aureliano (século V d.C), já designando o mesmo músculo; em latim, por sua vez, a palavra é um empréstimo do grego, significando “divisão” ou “barreira”, mas já designando o mesmo músculo em Platão e em Galeno (conforme informa o dicionário de Liddell, Scott e Jones). Em português, trata-se certamente de um latinismo que entrou provavelmente por meio do latim científico.",substantivo masculino,Raissa Silveira Buss; Bruno Maroneze,26 Jul 2022,28 Jan 2023
57,glândula,1677,"MORÃO, Simão Pinheiro. Queixas repetidas em ecos dos arrecifes de Pernambuco. [c1677]. Leitura, explicação e nótulas de Jaime Walter. Lisboa: [s.n.], 1965. [Informado pelo dicionário Houaiss]<br><b>1713</b>: “EMUNCTORIOS, ou Emuntorios. (Termo de Cirurgião) Glandulas espõjosas para a descarga dos humores das partes nobres.” (BLUTEAU, Raphael. Vocabulario Portuguez e Latino. Coimbra: Collegio das Artes da Companhia de JESU, 1713. https://www.google.com.br/books/edition/Vocabulario_Portuguez_E_Latino/ZMZKAAAAcAAJ?hl=en&gbpv=0)","O étimo é o latim <i>glandula</i>, atestado desde a Antiguidade, conforme informam os dicionários de Gaffiot e o OLD. Em Celso (segundo os mesmos dicionários), parece ter o sentido ora de “glândula”, ora de “amídala”. Em português, é certamente um latinismo, provavelmente originário do latim científico.",substantivo feminino,Raissa Silveira Buss; Bruno Maroneze,26 Jul 2022,26 Jul 2022
58,esôfago,1601,"CRUZ, António da. Recopilação da Cirurgia. [informado pelo Dicionário Houaiss];<br><b>1720</b>: “RUMIDOURO. Bolso nos animaes, que rumião ou aquella capacidade, & officina abayxo do Isophago, do qual tornão à boca o pasto, & de novo o mastigão” (BLUTEAU, Raphael. VOCABULARIO PORTUGUEZ, & LATINO, AULICO, ANATOMICO, ARCHITECTONICO. Lisboa: Officina de Pascoal da Sylva, 1720. https://www.google.com.br/books/edition/VOCABULARIO_PORTUGUEZ_LATINO_AULICO_ANAT/tMESsATvdyEC?hl=en&gbpv=0&kptab=overview);<br><b>1739</b>: 1 Das fauces começa hum canal, que vay seguido até o cesso. [...]2 Tres saõ as principaes partes deste canal. O isophago, o ventriculo, e os intestinos. (Extraído de: Anatomia do corpo humano, 1739, pp. 24-25).","O étimo é o latim científico <i>oesophagus</i>, atestado já no século XVI (por exemplo, em “De Anima”, 1542, https://www.google.com.br/books/edition/De_anima_commentarius_Philippi_Mel_Cum_I/tQ22hca_94oC). Por estar ausente dos dicionários de Gaffiot e OLD, supõe-se que não existia no latim da Antiguidade. Em latim, é empréstimo do grego οἰσοφάγος, atestado em Hipócrates, Aristóteles e Galeno com o sentido de “goela, esôfago” (segundo o dicionário de Liddell, Scott e Jones).",substantivo masculino,Raissa Silveira Buss; Bruno Maroneze,26 Jul 2022,26 Jul 2022
59,miologia,1739,"“LIVRO TERCEIRO DA MYOLOGIA, OU DOS MUSCULOS, e dos movimentos, ou acçaõ dos musculos.” (Extraído de: Santucci, ""Anatomia do corpo humano"", 1739, p. 323)","Trata-se de um cultismo formado pelos elementos de composição de origem grega <i>mi(o)-</i> (do grego <i>mûs, muós</i> - μῦς, μυός -, “rato”, “músculo”) e <i>-logia</i> (indicativo de “ciência”, “arte”, “tratado”). A forma “myologia” é atestada em latim científico desde pelo menos o século XVII (como se observa na obra de Jean Riolan, o Velho, de 1611, disponível em https://www.google.com.br/books/edition/Ioannis_Riolani_Ambiani_medici_Parisiens/zeo7G2IC3iEC). A palavra provavelmente se disseminou a partir do latim científico para as demais línguas europeias.",substantivo feminino,Rafaela Lima Domingos; Bruno Maroneze,23 Aug 2022,23 Aug 2022
60,masseter,1739,"“Quando o ventre do musculo he hum só, e consta sómente de dous tendoens, chama-se simples o musculo; quando saõ muitos os ventres, e cada hum tem dous tendoens, chama-se composto. Do primeiro genero saõ os flexores dos Artus, e dos membros. Do segundo genero saõ os chamados masseter, e Deltoydes, dos quaes o primeiro serve para mover o queixo inferior, o outro para levantar o hombro.” (Extraído de: Santucci, “Anatomia do corpo humano”, p. 327-8)","O étimo é certamente o latim científico <i>masseter</i>, já em referência ao músculo, atestado pelo menos desde o século XVI (por exemplo, na obra de Vesalius, de 1543, disponível em https://www.google.com.br/books/edition/Andreae_Vesalii_Brvxellensis_Scholae_med/DqAtzTRY5foC). Em latim, é empréstimo do grego μασητήρ, ῆρος “mastigador”, já atestado em Hipócrates e Galeno (conforme informa o dicionário LSJ). Assim, parece pouco provável que seja um empréstimo do francês, como afirma o dicionário Houaiss, visto que já circulava em textos médicos em latim científico.",substantivo masculino,Rafaela Lima Domingos; Bruno Maroneze,23 Aug 2022,24 Aug 2022
61,órbita,1739,"“As capellas se movem, mediante dous musculos, hum he commum, o outro he proprio. O commum se chama Orbicular, porque vay rodeando externamente a circumferencia da Orbita, apegandose à dita Orbita com as suas fibras.” (Extraído de: Santucci, “Anatomia do corpo humano”, p. 336)","O étimo parece ser o latim científico “orbita”, já empregado com o sentido de “cavidade dos olhos” no século XVI (por exemplo, na obra de Jacopo Berengario, de 1521, disponível em https://www.google.com.br/books/edition/Carpi_Commentaria_cum_amplissimis_additi/MvTxTsQ8E04C). Na Antiguidade, conforme informa o dicionário OLD, o latim “orbita” tem apenas as acepções de “caminho traçado por uma roda”, “movimento dos astros” e “prática regular, rotina”. A acepção da Anatomia, até onde foi possível identificar, surge no período do Renascimento.",substantivo feminino,Rafaela Lima Domingos; Bruno Maroneze,23 Aug 2022,23 Aug 2022
62,ócciput,1739,"“O craneo he composto de oito ossos: seis saõ os proprios, e outros comuns ao queixo superior. Aquelles que pertecem ao craneo saõ os seguintes: o osso da testa, dous do synciput, ou moleira; hum do occiput, ou toutiço; e dous das fontes.” (Extraído de: Santucci, “Anatomia do corpo humano”, p. 255)","Trata-se de um empréstimo direto do latim, atestado desde a Antiguidade: o dicionário OLD registra as formas sinônimas <i>occipicium</i> e <i>occiput</i>, já com o sentido de “parte posterior da cabeça”. O dicionário Houaiss registra como sinônimas as formas “occipício”, “occipúcio”, “occipital” e “ócciput”, mas definidas em referência à parte da cabeça, não exatamente ao osso. Também em Santucci se observa oscilação no emprego da palavra: ora refere-se à parte da cabeça, ora ao osso presente nessa parte. A forma “toutiço”, apontada como sinônima por Santucci, parece apresentar essa mesma ambiguidade, ora como a parte da cabeça, ora como o osso ali presente.",substantivo masculino,Rafaela Lima Domingos; Bruno Maroneze,23 Aug 2022,23 Aug 2022
63,inseto,1788,"“Esta obra divide-se em Terminologia 1. dos Mammaes. 2. das Aves. 3. dos Peixes 4. dos Amphibios. 5. dos Insectos. 6. dos Vermes. 7. da Botanica. 8.e da Mineralogia.” (Extraído de: Diccionario dos termos technicos de Historia Natural, 1788, p. V)","O étimo é a forma latina <i>insectum, i</i>, atestada já em Plínio, o Velho (portanto, século I d.C.), segundo o Oxford Latin Dictionary. No entanto, a palavra não é herdada em português (como fica evidente pela ausência da transformação ct > it), mas provavelmente derivada do emprego em latim científico, atestado pelo menos desde o século XVI (cf., por exemplo, a obra “Historiae Animalium”, de Conrad Gessner, publicada entre os anos 1551 e 1558, disponível em https://www.google.com.br/books/edition/Conradi_Gesneri_medici_Tigurini_Historia/J2IQTOBA_tYC). O substantivo <i>insectum, i</i>, em latim, é o particípio do verbo <i>inseco, are</i> (“cortar, fazer uma incisão”) e significa, literalmente, “cortado, dividido” (ou seja, de corpo segmentado).<br>Para Vandelli (e outros, como o já mencionado Gessner), o conceito de “inseto” engloba também animais como aranhas, escorpiões, caranguejos e lagostas; ou seja, refere-se ao grupo conhecido atualmente como “artrópodes”. O conceito atual de “inseto” é provavelmente do século XIX.",substantivo masculino,Bruno Maroneze,21 Nov 2022,21 Nov 2022
64,pericarpo,1758,"“Pericarpo, termo Botanico. he huma pellicula, ou membrana que cobre o fruto, ou semente da planta.” (MARQUES, José. Nouveau dictionnaire des langues françoise et portugaise. Lisboa: José da Costa Coimbra, 1758. https://www.google.com.br/books/edition/Nouveau_dictionnaire_des_langues_fran%C3%A7o/wQRRcsHwzdsC?hl=en&gbpv=0)","A existência de duas variantes, uma terminada em <i>-pio</i> e a outra em <i>-po</i>, aponta para a possibilidade de ter havido uma fusão de dois étimos. O étimo da forma variante <i>pericárpio</i> é certamente o latim científico <i>pericarpium</i>, atestado em Vandelli (1788), por sua vez derivado do grego περικάρπιον (<i>perikárpion</i>), atestado já na Antiguidade (segundo o dicionário LSJ) com o sentido de “invólucro de um fruto ou semente” – formado pelo prefixo περί (<i>perí</i>) “ao redor” e pelo substantivo καρπός (<i>karpós</i>) “fruto, semente”, na forma diminutiva καρπίον (<i>karpíon</i>). Por não ter sofrido as transformações fonéticas esperadas (em especial pela manutenção do [c] intervocálico), a forma portuguesa é certamente erudita, tendo vindo diretamente do latim científico.<br>Já para explicar a forma variante <i>pericarpo</i>, é preciso inicialmente observar que também existe a forma latina <i>pericarpum</i>, que, segundo o Oxford Latin Dictionary, é atestada na obra “História Natural” de Plínio, o Velho, referindo-se a uma espécie de bulbo. No entanto, essa forma parece não ter sido empregada por nenhum outro autor e tampouco foi encontrada em textos em latim científico.<br>Parece haver, assim, três hipóteses etimológicas possíveis (e não necessariamente conflitantes ou concorrentes) para a variante em <i>-po</i>:<br>a) Essa forma teria sido decalcada diretamente da forma latina <i>pericarpum</i>, talvez por algum autor que conhecesse a obra de Plínio, o Velho;<br>b) Essa forma teria surgido da forma latina <i>pericarpium</i> com a perda do -i- (influenciada ou não pela forma <i>pericarpum</i> de Plínio, o Velho);<br>c) Essa forma teria sido construída em português a partir dos elementos de origem grega <i>perí-</i> e <i>-carpo</i> (hipótese que parece estar implicada na descrição etimológica apresentada pelo dicionário Houaiss), com possível influência da forma latina <i>pericarpium</i>.<br>As duas variantes ocorrem já no século XVIII. Vandelli prefere a forma em <i>-pio</i>, que é mais próxima do latim científico; já Brotero prefere a forma em <i>-po</i>, apresentando-a como o equivalente português do termo latino <i>pericarpium</i>.",substantivo masculino,Raissa Silveira Buss; Bruno Maroneze,21 Dec 2022,21 Dec 2022
65,semente,sXIII,"CUNHA, Antônio Geraldo da. Dicionário etimológico Nova Fronteira da língua portuguesa. Rio de Janeiro, 1982. 2. ed., 1986. [informado pelo Dicionário Houaiss]","O étimo, segundo informa o dicionário Houaiss, é o latim <i>sementis</i> (mais bem representado pela forma do acusativo <i>semente(m)</i>), que significa “semeadura”, “período de semeadura” (conforme apresenta o Oxford Latin Dictionary). O estudo dos cognatos em outras línguas românicas pode apontar para o momento em que houve a mudança de significado de “semeadura” para “semente”. O Romanisches Etymologisches Wörterbuch traz os seguintes cognatos: italiano <i>semente, sementa</i>, catalão <i>sement</i>, espanhol <i>simiente</i>. Desses, apenas o italiano <i>semente</i> não significa “semente”, mas sim o conjunto de sementes usadas na semeadura.",substantivo feminino,Ana Carolina Menegassi Rocha; Bruno Maroneze,22 Out 2023,22 Out 2023
66,aurícula,1788,"BIAURITUS. Diz-se do coraçaõ, que tem duas auriculas. (Vandelli, 1788, p. 2)","O étimo é o latim <i>auricula</i>, diminutivo de <i>auris</i>, que na Antiguidade era empregado para se referir à orelha (conforme afirma o Oxford Latin Dictionary). É sabido que a forma <i>auricula</i> é também o étimo da forma herdada “orelha”; dessa forma, “orelha” e “aurícula” são, etimologicamente, formas <i>doublets</i>.<br>O emprego de “aurícula” para designar as cavidades superiores do coração (chamadas de “átrio” pela Medicina do século XXI) já ocorre no latim científico desde pelo menos o século XVII (como, por exemplo, em “Anatome Animalium” de Gerard Blasius, 1681 - https://www.google.com.br/books/edition/Gerardi_Blasii_Anatome_animalium_terrest/Bx1fAGulTCQC), mas em língua portuguesa o primeiro emprego parece mesmo ter sido na obra de Vandelli. Bernardo Santucci, na “Anatomia do Corpo Humano” (1739), à p. 125, fala em “orelhas do coraçaõ” em vez de “aurículas”. ",substantivo feminino,Ana Carolina Menegassi Rocha; Bruno Maroneze,27 Nov 2023,27 Nov 2023
67,concameração,1788,"SIPHUNCULUS. Tubo articulado, que passa pelas concameraçoens do Nautilus. (Vandelli, 1788, p. 153)","O étimo é o latim <i>concameratio</i>, atestado desde a Antiguidade, porém com o sentido de “abóbada”, “arcada” (conforme informa o Oxford Latin Dictionary). O sentido empregado por Vandelli parece já ocorrer em textos anteriores em latim científico, como, por exemplo, na obra “Tentamen Methodi Ostracologicae” de Jacob Theodor Klein, 1753 (https://www.google.com.br/books/edition/Tentamen_methodi_ostracologicae/D-hAAAAAcAAJ). O termo parece não ser mais empregado na Biologia no século XXI.",substantivo feminino,Ana Carolina Menegassi Rocha; Bruno Maroneze,06 Nov 2023,06 Nov 2023
