ID,Headword,FirstAttestationDate,FirstAttestationExampleMD,Etymology,WClass,Credits,DateOfCreation,DateOfUpdate
68,cibário,1788,"""Os dentes, são os elementos cibarios, osseos, postos nas mandibulas."" (VANDELLI, 1788, p. 4)","O étimo é o adjetivo latino <i>cibarius, a, um</i>, atestado desde a Antiguidade (conforme apontam os dicionários Oxford Latin Dictionary e Gaffiot) com o sentido de “relativo aos alimentos” (derivado do latim <i>cibus, i</i>, “alimento”). O termo em português é certamente um latinismo erudito, derivado possivelmente do latim científico.",adjetivo,Ana Carolina Menegassi Rocha; Bruno Maroneze,19 May 2023,19 May 2023
71,raiz,1091,"MACHADO, José Pedro. Dicionário Etimológico da Língua Portuguesa. 3. ed. Lisboa: Confluência, 1977. [informado pelo Dicionário Houaiss]","É palavra herdada, cujo étimo é o latim <i>radicem</i> (nominativo <i>radix</i>), que já apresentava o sentido de ""órgão de sustentação da planta"" desde a Antiguidade (conforme informa o Oxford Latin Dictionary). Em português, é atestado desde o período medieval (conforme informa o Dicionário Houaiss).<br>Tanto Vandelli quanto Brotero afirmam que a raiz se situa, geralmente, embaixo da terra: ""a raiz está na terra, e cresce debaixo della"" (VANDELLI, 1788, p. 193); ""A Raiz he hum organo nutritivo apegado a terra"" (BROTERO, 1788, p. 12). Ambos também mencionam a função de nutrição, características ainda hoje consideradas centrais ao conceito de ""raiz"", conforme se lê na definição Glossário de Termos Botânicos da Universidade de Coimbra (https://www.uc.pt/herbario_digital/learn_botany/glossario): ""Raiz (radix). Órgão geralmente subterrâneo através do qual são absorvidos sais minerais e água e que fixa a planta ao solo.""",substantivo feminino,Dannielly Victória Rodrigues da Silva; Bruno Maroneze,03 Apr 2023,03 Apr 2023
72,folha,Século XIII,"Fichário do Índice do Vocabulário do Português Medieval, de Antônio Geraldo da Cunha [informado pelo Dicionário Houaiss]","O étimo é a forma latina <i>folia</i>, neutro plural de <i>folium</i>, que foi reanalisada como um feminino singular. Segundo o dicionário Houaiss, é atestada em português desde a Idade Média.<br>Tanto Vandelli (p. 208) quanto Brotero (p. 38) definem ""folha"" como o órgão responsável pelo movimento da planta. Brotero também menciona a função de absorção de nutrientes, numa interessante analogia com a pele dos animais: ""As folhas absorbem como a pelle dos animaes, e em muitas plantas a maior parte da substancia nutritiva lhes entra pelas folhas; segundo alguns physiologistas os vegetaes em geral nutremse de dia pela via das folhas e de noyte pelas raizes, e no inverno aquellas plantas que nelle perdem inteiramente as suas folhas so se nutrem pela raiz"" (BROTERO, 1788, p. 6). Atualmente, a ideia de ""movimento"" não é mais entendida como inerente ao conceito de ""folha"".",substantivo feminino,Dannielly Victória Rodrigues da Silva; Bruno Maroneze,09 Apr 2023,09 Apr 2023
73,tronco,Século XIII,"CUNHA, Antônio Geraldo da. Dicionário etimológico Nova Fronteira da língua portuguesa. Rio de Janeiro, 1982. 2. ed., 1986. [informado pelo Dicionário Houaiss]","É certamente palavra herdada, tendo como étimo o latim <i>truncus</i> (pela forma do acusativo <i>truncum</i>), que já na Antiguidade tinha tanto o sentido de ""tronco de uma árvore"" quanto de ""tronco do corpo humano"" (conforme se lê no Oxford Latin Dictionary). Em latim, é provavelmente a substantivação do adjetivo <i>truncus, -a, -um</i> ""cortado, mutilado, truncado"".<br>Sobre a diferença entre ""caule"" e ""tronco"", Brotero afirma: ""Os antigos davaõ o nome de tronco (truncus) ao troço ascendente das plantas lenhosas, e o de caule ou talo (caulis) ao das herbaceas; mas hoje a palavra tronco está adoptada por hum termo geral de que o caule he huma especie, de maneira que se pode dizer com igual propriedade de termo, que o choupo tem hum caule lenhoso, como se pode dizer, que a alface tem hum caule herbaceo."" (BROTERO, 1788, vol. 1, p. 20). Esse trecho é obscuro; por um lado, parece dizer que ""tronco"" é o termo genérico, mas nos exemplos, é ""caule"" que é empregado como genérico. Atualmente, emprega-se ""caule"" como termo genérico (hiperônimo), do qual ""tronco"" é um subtipo (hipônimo).",substantivo masculino,Dannielly Victória Rodrigues da Silva; Bruno Maroneze,14 Jun 2023,14 Jun 2023
75,papila,1739,"Sahem da mesma cute huns corpos pequeninos longos de substancia nervosa, e de figura pyramidal, a que Malpighio dà o nome de papillas. (SANTUCCI, 1739, p. ","O étimo é o latim <i>papilla</i>, que significava, na Antiguidade, “mamilo, bico do seio” (conforme informa o Oxford Latin Dictionary). A forma portuguesa entrou por via erudita, como se percebe pela conservação do -p- intervocálico.<br>O emprego da palavra no latim científico, com sentido diferente do original, é atribuído a Berengario da Carpi e a Marcello Malpighi (segundo o “Dicionário de Etimologia Médico” - https://dicimedico.com/papila/).",substantivo feminino,Matheus Stein Casarin; Bruno Maroneze,30 Out 2023,30 Out 2023
76,tubérculo,1668,"AZEVEDO, F. Manoel de. Correcçam de abusos, introduzidos contra o verdadeiro methodo da medicina. Lisboa, 1668. [informado pelo dicionário Houaiss]","Tubérculo: O étimo é o substantivo latino <i>tuberculum, i</i>, que, segundo o Oxford Latin Dictionary, tinha na Antiguidade o sentido de “pequena protuberância ou excescência”. É com esse sentido que a palavra “tubérculo” está presente nos autores do século XVIII, seja referindo-se a estruturas animais (na pele ou na superfície de órgãos internos), seja referindo-se a protuberâncias e rugosidades em vegetais e fungos (que eram considerados vegetais). O sentido de “caule espessado que armazena nutrientes” não foi encontrado nos autores que estudamos (ainda que o dicionário Houaiss date essa acepção em 1788).<br>A palavra certamente entrou na língua portuguesa por via erudita, por meio do latim científico. O sentido de “protuberância” é frequente em textos médicos do século XVII (como, por exemplo, no texto “De ingressu ad infirmos” de Júlio César Claudino, 1617 - https://www.google.com.br/books/edition/Iulii_C%C3%A6saris_Claudini_De_ingressu_ad_i/iPcZtI8R6o8C).",substantivo masculino,Matheus Stein Casarin; Adriane Maria de Oliveira Queiroz; Bruno Maroneze,15 sep 2023,15 sep 2023
77,polpa,1563,"BARROS, João de. Décadas: I. Asia de Ioam de Barros dos fectos que os portugueses fizeram no descobrimento & conquista dos mares & terras do Oriente. Lisboa, 1552; II. Segunda decada da Asia... Lisboa, 1553; III. Terceira decada da Asia... Lisboa, 1563; IV Quarta decada da Asia... Madrid: Impressão Real, 1615. [informado pelo dicionário Houaiss]","O étimo é o substantivo latino <i>pulpa, ae</i>, que, no latim da Antiguidade, significava “parte carnosa do corpo” e, por extensão, “parte carnosa de um fruto” (segundo o Oxford Latin Dictionary). A alternância -u- para -o- sugere tratar-se de palavra herdada, ainda que sua atestação seja tardia (século XVI, segundo o dicionário Houaiss). Nos textos de Vandelli e Brotero, “polpa” se refere não só à parte carnosa dos frutos, mas também de outras estruturas vegetais, como certas folhas de plantas suculentas.",substantivo feminino,Matheus Stein Casarin; Adriane Maria de Oliveira Queiroz; Bruno Maroneze,21 sep 2023,21 sep 2023
78,carúncula,1788,"CARUNCULA. He huma substancia carnosa, nua, molle, que cobre, ou a cabeça, ou collo de algumas Aves, ou as sobrancelhas no Tretrao, Meleagris, Parra, e tambem no Gallo se observa a mesma caruncula, a que o povo erradamente dá o nome de Crista, quando naõ he se naõ pennacea. Phasianus Gallus. (Vandelli, 1788, p. 15)","O étimo é o latim <i>caruncula</i>, que tinha, na Antiguidade, o sentido de “pequeno pedaço de carne”, mas já aparece, em Celso (“De Medicina” 6.8.2.A, citado pelo Oxford Language Dictionary), com o sentido de “protuberância” (especificamente dentro das narinas). A palavra entrou em português pela via erudita (como fica evidenciado pela conservação do -u- postônico). No latim científico, <i>caruncula</i> parece ter sido empregada para nomear diversas estruturas anatômicas. Por exemplo, a expressão “caruncula lacrymalis” é empregada para nomear as estruturas que produzem as lágrimas no “Treatise of the human eye” de Peter Degravers (1780 - https://www.google.com.br/books/edition/A_complete_physico_medical_and_chirurgic/0Q1eAAAAcAAJ); na obra “An Anatomical Exposition of the Structure of the Human Body”, de James Benignus Winslow (1756 - https://www.google.com.br/books/edition/An_Anatomical_Exposition_of_the_Structur/vq-wTrSjhGQC), <i>caruncula</i> designa uma estrutura presente na próstata. Assim, Vandelli provavelmente buscou esse termo no latim científico para designar diversas estruturas anatômicas animais.",substantivo feminino,Matheus Stein Casarin; Bruno Maroneze,13 Nov 2023,13 Nov 2023
79,setáceo,1788,"""Setaceas (setacea), saõ lineares, curtas muito, estreitas, mas contudo hum pouco mais largas do que huma seda (o espargo hortense): se saõ finas como fios ou cabellos chamaõ-lhes filiformes ou capillares (filiformia, s. capillaria); saõ mais compridas do que as setaceas."" (BROTERO, 1788, p. 53)","O étimo é o adjetivo latino <i>setaceus, a, um</i>. Não está registrado nos dicionários de latim da Antiguidade e, portanto, é seguramente criação do latim científico. Está registrado no próprio dicionário de Vandelli. Em latim, é formado pelo substantivo <i>seta, ae</i> (também ocorrendo na variante <i>saeta, ae</i>), com o significado de “pelo de animal, especialmente grosseiro ou rígido”, acrescido do sufixo adjetivador <i>-aceus</i>, com o significado de “semelhante a” (informações extraídas do Oxford Latin Dictionary). Assim, embora não atestado na Antiguidade, parece ser bem-formado de acordo com a morfologia latina.<br>A associação com a seda pode já ter acontecido durante a Idade Média, visto que <i>saeta</i> é o étimo de “seda” nas línguas românicas em geral, por via herdada. Assim, o adjetivo <i>setáceo</i> adquiriu tanto o sentido de “semelhante a pelos de animal” (sentido mais próximo do latim da Antiguidade) quanto de “semelhante a seda”.<br>O dicionário Houaiss descreve a etimologia da palavra como sendo “seta + áceo”, implicando que a palavra foi formada em português; no entanto, a existência de <i>setaceus, a, um</i> no latim científico demonstra que essa descrição é imprecisa.",adjetivo,Matheus Stein Casarin; Adriane Maria de Oliveira Queiroz; Bruno Maroneze,21 sep 2023,21 sep 2023
80,Botânica,1771,"""A Botanica conduz o Medico a estes conhecimentos, instruindo-o na Historia Natural do reino vegetavel, donde a Medicina tira grandes soccorros para formar os remedios, ou medicamentos."" (UNIVERSIDADE DE COIMBRA. Compendio historico do estado da Universidade de Coimbra. Lisboa: Regia Officina Typografica, 1771. https://www.google.com.br/books/edition/Compendio_historica_do_estado_da_Univers/Xp1eAAAAcAAJ?hl=en&gbpv=0)","O étimo é, certamente, o latim científico <i>Botanica</i>, já empregado com o sentido de ""ciência dos vegetais"" desde o século XVII (cf., por exemplo, a obra ""Institutio Philosophica..."", disponível em https://www.google.com.br/books/edition/Institutio_philosophica_ad_faciliorem_ve/fk4KQkeAgUsC, onde se lê, à p. 291, ""Botanica, seu plantarum scientia"").<br>O emprego em latim científico deriva da forma feminina do adjetivo grego βοτανικός (<i>botanikós</i>) ""relativo às ervas"", atestado desde a Antiguidade (conforme informa o dicionário de Liddell, Scott e Jones).",substantivo feminino,Raissa Silveira Buss; Bruno Maroneze,16 Feb 2023,14 Jun 2023
82,planta,Século XIV,"CUNHA, Antônio Geraldo da. Índice do Vocabulário do Português Medieval. Rio de Janeiro: Fundação Casa de Rui Barbosa. Confluência Revista do Instituto de Língua Portuguesa e do Liceu Literário Português, n. 3, separata, 1992. [informado pelo Dicionário Houaiss]","Segundo o dicionário de Gaffiot, o substantivo latino <i>planta, ae</i> na Antiguidade tinha o sentido de “rebento” (ramo de uma planta extraído para propagação), mas também poderia ter o sentido mais geral de “vegetal”, sentido esse que passou ao português. A conservação do encontro consonantal pl- inicial aponta para a entrada na língua por via erudita, ainda que a palavra seja datada da Idade Média.",substantivo feminino,Raissa Silveira Buss; Bruno Maroneze,15 Sep 2023,15 Sep 2023
83,suculento,1784,"“CONSOMMÉ f. m. Caldo muito Substancial, muito succulento que se tira huma vianda muito cozida, e se reduz a gelea depois de fria.” (COSTA, Joaquim José da. NOUVEAU DICTIONNAIRE FRANÇOIS PORTUGAIS. Lisboa: Chez Borel Borel & Compagnie. 1784. https://www.google.com.br/books/edition/Nouveau_dictionnaire_fran%C3%A7ois_portugais/R6taAAAAcAAJ?hl=en&gbpv=0)","O étimo é o adjetivo latino <i>suculentus, a, um</i>, que já no latim da Antiguidade tinha o sentido de “cheio de suco, suculento”. Segundo o dicionário de Gaffiot, já em latim havia as variantes com -c- (<i>suculentus</i>) e com -cc- (<i>succulentus</i>). A palavra ingressou na língua portuguesa pela via do latim científico, visto que já era empregada em textos de Botânica em latim (como, por exemplo, o <i>De Orchide</i> de Gustav Christian von Handtwig, de 1747 - https://www.google.com.br/books/edition/De_Orchide_Dissertatio_Inavgvralis_Botan/RjNbAAAAcAAJ). No entanto, o contexto mais antigo que encontramos em português até o momento, de 1784, não se refere à Botânica, antecedendo em quatro anos o emprego da palavra em Brotero.",adjetivo,Raissa Silveira Buss; Bruno Maroneze,14 Sep 2023,14 Sep 2023
84,cirro,1788,"Cirrhosum, cirrhatum. fig. 72. 73. Terminando em cirrhos no apice, isto he, em varios filamentos, por meio dos quaes sobem por outros corpos. (VANDELLI, 1788, p. 222)","O étimo é o latim <i>cirrus</i>, que no latim da Antiguidade significava “mecha de cabelo cacheado, cacho de cabelo”, mas também “excrescência em forma de tufo numa planta”, conforme informa o Oxford Latin Dictionary. Aparentemente, o latim científico especializou a grafia <i>cirrhus</i> para a acepção da Botânica (“gavinha”) e a grafia <i>cirrus</i> para a acepção da Zoologia (apêndice de certos animais). É possível observar isso, por exemplo, no “A Botanical Dictionary”, de Colin Milne (1770 - disponível em https://www.google.com.br/books/edition/A_Botanical_Dictionary_Or_Elements_of_Sy/jbZgAAAAcAAJ), que registra apenas <i>cirrhus</i>, e no “Zoophylacium Gronovianum”, de Laurens Theodorus Gronovius (1763 - disponível em https://www.google.com.br/books/edition/Zoophylacium_Gronovianum_exhibens_animal/aUxnAAAAcAAJ), que registra apenas <i>cirrus</i>. Ainda que haja duas grafias, o mais provável é que o étimo latino seja o mesmo. <br>No dicionário de Vandelli, a forma latina aparece grafada ora como <i>cirrus</i>, ora como <i>cirrhus</i>, tanto no sentido do apêndice dos animais quanto do das plantas. Porém, o equivalente português em Vandelli é sempre grafado <i>cirro</i> ao se referir ao apêndice animal, e <i>cirrho</i> ao se referir ao apêndice vegetal (com uma única exceção à p. 236). Já Brotero não emprega esse termo em português, preferindo o equivalente vernáculo <i>gavinha</i>.",substantivo masculino,Bruno Maroneze,20 Nov 2023,20 Nov 2023
85,músculo,Século XIV,"CUNHA, Antônio Geraldo da. Dicionário etimológico Nova Fronteira da língua portuguesa. Rio de Janeiro: Nova Fronteira, 1982. [informado pelo Dicionário Houaiss]","O étimo é o latim <i>musculus</i>, que já apresentava o sentido de 'músculo' na Antiguidade, conforme atesta o  Oxford Latin Dictionary (com abonações de Celso, Lucrécio, Apuleio e outros). Como o sentido inicial da palavra seria ‘rato pequeno', 'ratinho' (por ser o diminutivo de <i>mus</i> no sentido de 'rato', 'camundongo'), a mudança semântica ocorreu ainda na língua latina. Segundo o dicionário Houaiss, a mudança se deu pela semelhança que apresentam alguns músculos, ao se contraírem, com o movimento rápido do rato.<br>A palavra, ainda que de atestação bem recuada (século XIV, conforme o dicionário Houaiss), entrou na língua portuguesa por via erudita, como atesta o acento proparoxítono e a preservação do -l- intervocálico, por exemplo.",substantivo masculino,Adriane Maria de Oliveira Queiroz; Bruno Maroneze,6 Mar 2023,6 Mar 2023
88,árvore,984,"MACHADO, José Pedro. Dicionário etimológico da língua portuguesa. 3. ed. Lisboa: Confluência, 1977. [informado pelo dicionário Houaiss]","O étimo é o substantivo latino <i>arbor, oris</i> (com o mesmo significado de “planta de tronco alto e grosso”), pelo acusativo <i>arborem</i>, visto ser palavra herdada. É atestada desde a Idade Média e, a julgar pela data informada pelo dicionário Houaiss (984), é uma das palavras mais antigamente atestadas na língua portuguesa.",substantivo feminino,Adriane Maria de Oliveira Queiroz; Bruno Maroneze,18 Sep 2023,18 Sep 2023
92,desenvolução,1788,"""Considerada a folha em quanto á sua desenvoluçaõ, ou expençaõ."" (VANDELLI, 1788, p. 226)","A ausência de cognatos em latim ou em outras línguas românicas parece indicar que se trata de criação portuguesa. A existência prévia de <i>desenvolver</i> (datado do século XIV, segundo o dicionário Houaiss), mas não de <i>*envolução</i>, leva a crer que se trata, morfológica e etimologicamente, de uma derivação sufixal a partir do verbo <i>desenvolver</i>, sob o modelo de <i>revolução</i>, <i>evolução</i> etc.<br>O termo caiu em desuso em favor da forma <i>desenvolvimento</i>, mais antiga (século XV, segundo o dicionário Houaiss) e mais frequente.",substantivo feminino,Bruno Maroneze,26 Mar 2023,26 Mar 2023
93,lanceolado,1788,"""<i>Acinaciforme</i>. fig. 56. folha carnosa lanceolada, comprimida nos lados, com hum lado convexo, e apertado, e outro mais direito, e mais grosso á maneira de alfange. <i>Mesymbryanthemum</i>."" (VANDELLI, 1788, p. 228)","<i>Lanceolado</i> tem como étimo o latim <i>lanceolatus</i> (atestado desde a Antiguidade, conforme se observa em Gaffiot); sendo assim, <i>lanceolado</i> é um decalque advindo do latim. Poder-se-ia considerar o substantivo lança como sendo a base morfológica; mas a forma em -<i>eol</i>- indica a recuperação da forma latina <i>lanceola</i> (diminutivo de <i>lancea</i>, “lança”). Dessa forma, em português não parece ser possível estabelecer uma relação de base e derivado entre <i>lança</i> e <i>lanceolado</i>.",adjetivo,Kamila da Silva Barbosa,15 Set 2023,15 Set 2023
94,falcado,1788,"""<i>Raptorii</i>. Quando o femur anterior he canaliculado, e recebe a tibia falcada, ou arqueada. Nepa."" (VANDELLI, 1788, p. 107)","<i>Falcado</i> tem como étimo o latim <i>falcatus</i>, sendo caracterizado como um decalque advindo do latim. Apesar de ter uma base morfológica (substantivo <i>foice</i>, já atestada no séc. XIV), não podemos classificar <i>falcado</i> também como derivação, visto que, o que resultaria de <i>foice</i> quando anexado ao sufixo -<i>ado</i> seria uma forma diferente da que temos aqui representada - “<i>foiçado</i>” -, portanto,  é mais provável que Vandelli tenha recuperado a forma latina (<i>falcatus</i>) como base para a forma em língua portuguesa. Isto acontece porque o substantivo <i>foice</i> é uma palavra herdada e passou por diversas mudanças desde sua forma do latim <i>falx</i> para <i>foice</i>.  ",adjetivo,Kamila da Silva Barbosa,15 Set 2023,15 Set 2023
95,vibrissa,1788,"""VIBRISSATUS. Com vibrissas, ou pellos rijos, os quaes existem em alguns Mammaes."" (VANDELLI, 1788, p. 12)","O étimo é, sem dúvida, o latim <i>vibrissae, -arum</i>, registrado em diversos dicionários latinos (como o dicionário de Gaffiot, 1934) com a acepção de “pelos do nariz”. Curiosamente, os dicionários remetem sempre ao mesmo contexto, a obra de Festo “De verborum significatione” (datada do século II d.C.), que parece ser a única ocorrência desta palavra num texto da Antiguidade. A edição de Lindsay, 1913 (https://babel.hathitrust.org/cgi/pt?id=njp.32101077773990), traz a forma <i>vibracae</i> em vez de <i>vibrissae</i>, o que leva a crer que se trata de uma forma duvidosa, possivelmente um hápax. Isso, aliado ao fato de que “vibrissa” não tem características de palavra herdada, indica que a palavra provavelmente deixou de ser usada e foi retomada, na sua acepção corrente (“pelos rijos da face dos mamíferos”), no século XVIII. Lineu já o emprega com a nova acepção no <i>Systema Naturae</i> (décima edição, de 1758, e possivelmente em edições anteriores). O autor que primeiro a empregou em latim nessa nova acepção (possivelmente o próprio Lineu) certamente teve acesso a uma cópia do texto de Festo que empregava a forma <i>vibrissae</i>, em vez de <i>vibracae</i>, esta última preferida na leitura de Lindsay.",substantivo feminino,Bruno Maroneze,15 May 2023,15 May 2023
96,placenta,1721,"""Vide. Intestino pequeno, membranoso, tortuoso, do comprimento de huma vara, pouco mais, ou menos, da largura de hũ dedo. Sahe do meyo do Abdormẽ, ou barriga da criança, & do pescoço della, dando volta pelo toutiço se estẽde pela testa, & vay baixando até o que os Anatomicos chamão Placenta da madre."" (Bluteau, Vocabulario Portuguez e Latino, vol. 8, 1721, verbete ""vide"")","O étimo é o latim científico <i>placenta</i>, empregado pela primeira vez com esse sentido pelo médico italiano Gabriele Falloppio (na obra <i>Observationes anatomicae</i>, de 1562). Em latim clássico, <i>placenta</i> designa uma espécie de torta ou bolo achatado, cuja semelhança com o órgão da gravidez foi mencionada, pela primeira vez, por Realdo Colombo (na obra <i>De Re Anatomica</i>, de 1559). O termo se inseriu na língua portuguesa, já com o sentido atual, provavelmente por meio da expressão <i>placenta da madre</i>, atestada na obra de Bluteau (<i>Vocabulario Portuguez e Latino</i>, no volume de 1721), e aparece pela primeira vez como verbete de um dicionário na obra de Moraes Silva (<i>Diccionario da Lingua Portugueza</i> de 1789).",substantivo feminino,Luana da Silva Borges; Bruno Maroneze,21 Aug 2023,"21 Aug 2023
"
97,ocelado,1788,"""<i>Pupillatæ</i>. São as mesmas ocelladas, ou com malhas á maneira de olho com hum ponto no meio da dita malha. <i>Papilio</i>."" (VANDELLI, 1788, p. 80)","<i>Ocelado</i> tem como étimo o latim <i>ocellatus</i>. O termo <i>ocelado</i> é considerado um decalque advindo do latim, pois, apesar de ter uma base morfológica na língua portuguesa, a datação encontrada para ela é de 1881, ou seja, uma datação posterior a escrita do dicionário de Vandelli (1788). Portanto, no momento da elaboração do dicionário, Vandelli não teria a possibilidade de utilizar o substantivo ocelo para formar uma derivação com o sufixo -<i>ado</i>, tendo em vista que essa palavra ainda não fazia parte do vocabulário da língua portuguesa.",adjetivo,Kamila da Silva Barbosa,15 Set 2023,15 Set 2023
98,angulado,1788,"""<i>Subangulatus.</i> Quasi angulado."" (VANDELLI, 1788, p. 121)","Duas são as possibilidades de descrição do étimo: 1 - <i>angulado</i> pode ter como étimo o latim <i>angŭlātus</i> (atestado na Antiguidade, conforme registrado nos dicionários de Gaffiot e Oxford Latin Dictionary), constituindo-se, dessa forma, como um decalque da língua latina; ou 2 - <i>angulado</i> pode ser analisado como derivado do substantivo <i>ângulo</i> com o sufixo -<i>ado</i>, visto que o substantivo <i>ângulo</i> teve, segundo o Dicionário Houaiss, sua primeira atestação no século XIV; portanto, no momento da elaboração do dicionário de Vandelli, há a possibilidade de o autor ter utilizado o recurso da própria língua portuguesa para introduzir a palavra na língua através do processo de derivação.",adjetivo,Kamila da Silva Barbosa; Bruno Maroneze,15 Set 2023,29 Set 2023
99,canaliculado,1788,"""<i>PENNA.</i> Consta de huma base cylindrica, concava, que se extende pelo <i>Rachis</i>. (V. <i>Rachis</i>) arqueada para a parte inferior, liza superiormente, quasi canaliculada na parte inferior, pinnata, com raios parallelos, cada hum dos quaes he quasi pinnato..."" (VANDELLI, 1788, p. 21)","O étimo é certamente o latim  <i>cănālĭcŭlātus</i>, atestado desde a Antiguidade (conforme registro no Oxford Latin Dictionary). No entanto, o termo não ingressou na língua portuguesa por via herdada (visto não ter sofrido as mutações fonéticas, como a queda do -l- intervocálico, por exemplo), sendo, portanto, um decalque advindo do latim científico. Seria possível analisá-lo como um derivado sufixal a partir de <i>canalículo</i>, mas essa análise fica comprometida pelo fato de que a datação disponível para <i>canalículo</i> é de 1873 (segundo o dicionário Houaiss), ou seja, uma datação posterior à data que encontramos para <i>canaliculado</i>.",adjetivo,Kamila da Silva Barbosa; Bruno Maroneze,22 Set 2023,29 Set 2023
