"","doc_id","sentence_id","sentence","token_id","token","lemma","misc","orth","sensenumber"
"1610","Compendio1deBrotero.txt",1798,"O estigma existe na flor ao mesmo tempo que os <b>estames</b> , e o seu estado de vigor he quando a anthera se rompe , e vibra o po fecundante. (BROTERO, Felix Avellar, 1788)","13","estames","estame","plural","estames","1"
"1611","Compendio1deBrotero.txt",1798,"O estigma existe na flor ao mesmo tempo que os estames , e o seu estado de vigor he quando a <b>anthera</b> se rompe , e vibra o po fecundante. (BROTERO, Felix Avellar, 1788)","24","anthera","antera","singular","antera","1"
"1612","Compendio1deBrotero.txt",1799,"Nalgumas fores da syngenesia, em que falta o <b>estigma</b> , o germe aborta , e o mesmo succede se o cortamos de proposito pela operaçaõ , a que os sexualistas daõ o nome de castraçaõ (castratio ) (a). (BROTERO, Felix Avellar, 1788)","12","estigma","estigma",NA,"estigma","1"
"1613","Compendio1deBrotero.txt",1800,"Quando o estylete he nullo , o <b>estigma</b> he por conseguinte rente (sessile), como v. g. na papoila, tulipa , e aristolochia. (BROTERO, Felix Avellar, 1788)","8","estigma","estigma",NA,"estigma","1"
"1614","Compendio1deBrotero.txt",1803,"Quando os <b>estigmas</b> saõ rentes os sexualistas costumaõ por elles contar o numero dos pistillos. (BROTERO, Felix Avellar, 1788)","3","estigmas","estigma","plural","estigmas","1"
"1615","Compendio1deBrotero.txt",1803,"Quando os estigmas saõ rentes os sexualistas costumaõ por elles contar o numero dos <b>pistillos</b>. (BROTERO, Felix Avellar, 1788)","16","pistillos","pistilo","plural","pistilos","1"
"1616","Compendio1deBrotero.txt",1807,"Elles daõ o mesmo nome de castraçaõ ao còrte das <b>anteras</b>. (BROTERO, Felix Avellar, 1788)","13","anteras","antera","plural","anteras","1"
"1617","Compendio1deBrotero.txt",1816,"Diz-se ser : fendido em duas, tres , quatro, cinco, seis ou muitas <b>lacinias</b> ( bi- tri- quadri- quinque- sex- multifidum ) segundo o numero dos pequenos ( a ) ramos em que he dividido. (BROTERO, Felix Avellar, 1788)","18","lacinias","lacínia","plural","lacínias","1"
"1618","Compendio1deBrotero.txt",1825,"Cada hum destes raminhos ou <b>lacinias</b> ( quando saõ filiformes ) be hum estigma , e por conseguinte estes termos parecem so competir com propriedade ao estylete. (BROTERO, Felix Avellar, 1788)","7","lacinias","lacínia","plural","lacínias","1"
"1619","Compendio1deBrotero.txt",1825,"Cada hum destes raminhos ou lacinias ( quando saõ filiformes ) be hum <b>estigma</b> , e por conseguinte estes termos parecem so competir com propriedade ao estylete. (BROTERO, Felix Avellar, 1788)","15","estigma","estigma",NA,"estigma","1"
"1620","Compendio1deBrotero.txt",1833,"Este mesmo <b>estigma</b> diz-se taõbem as vezes ser rayado ou estriado ( radiatum , sive striatum ) , quando tem rayos ou estrias , que partem do centro para a circumferencia , como se vè nas predictas duas plantas. (BROTERO, Felix Avellar, 1788)","3","estigma","estigma",NA,"estigma","1"
"1621","Compendio1deBrotero.txt",1837,"Cruciforme (cruciforme ) , se tem quatro <b>lacinias</b> encruzadas ( o choupo , e penaea ). (BROTERO, Felix Avellar, 1788)","9","lacinias","lacínia","plural","lacínias","1"
"1622","Compendio1deBrotero.txt",1843,", se consta de duas laminas <b>longitudinaes</b> (o gergelim ). (BROTERO, Felix Avellar, 1788)","7","longitudinaes","longitudinal","plural","longitudinais","1"
"1623","Compendio1deBrotero.txt",1851,"Os <b>estigmas</b> saõ comparados , ou com o estylete quando este existe na flor , ou com o germe quando saõ rentes; assim dizem-se ser : iguaes ao estylete ou do seu comprimento , como na beldroega ; mais compridos ou mais curtos do que elle , curtissimos ou summamente pequenos; compridissimos ou summamente grandes; mais largos do que o germe, &c. As vezes saõ taõbem comparados huns com os outros , na mesma ffor , como v. g. os dois da ajuga , na qual se diz, que o inferior he mais curto do que o superior. (BROTERO, Felix Avellar, 1788)","2","estigmas","estigma","plural","estigmas","1"
"1624","Compendio1deBrotero.txt",1853,"Os <b>estigmas</b> em hum grande numero de flores , passada a fiorecencia, cahem ou juntamente com os estyletes ou da superficie do germe ; as vezes saõ murchosos ( marcescentia ), ficando juntamente com os estyletes apegados ao novo fructo fecundado, durante algum tempo ; outras vezes saõ persistentes ( persistentia ), ficando athe à madureza do fructo , como na papoila. (BROTERO, Felix Avellar, 1788)","2","estigmas","estigma","plural","estigmas","1"
"1625","Compendio1deBrotero.txt",1857,"O fructo (fructus ) , consiste em huma ou mais sementes fecundadas , e nutridas sobre o seu proprio <b>receptaculo</b> athe ao estado de plena madureza , quer sejaõ cobertas quer descobertas. (BROTERO, Felix Avellar, 1788)","21","receptaculo","receptáculo","singular","receptáculo","1"
"1626","Compendio1deBrotero.txt",1859,"No primeiro cazo o fructo tem alem das sementes hum <b>pericarpo</b> , e no segundo as sementes saõ nuas , e o pericarpo he nullo ( pericarpium nallum ). (BROTERO, Felix Avellar, 1788)","13","pericarpo","pericarpo",NA,"pericarpo","1"
"1627","Compendio1deBrotero.txt",1859,"No primeiro cazo o fructo tem alem das sementes hum <b>pericarpo</b> , e no segundo as sementes saõ nuas , e o pericarpo he nullo ( pericarpium nallum ). (BROTERO, Felix Avellar, 1788)","26","pericarpo","pericarpo",NA,"pericarpo","1"
"1628","Compendio1deBrotero.txt",1860,"Mas definir o que he rigorosamente hum <b>pericarpo</b>, assignar regras para o reconhecer , e para o distinguir sempre dos tegumentos proprios das sementes, dizer quando elle he nullo , ou quando as sementes saõ nuas , naõ he taõ facil como ordinariamente o daõ a entender as obras elementares de Botanica. (BROTERO, Felix Avellar, 1788)","8","pericarpo","pericarpo","SpaceAfter=No","pericarpo","1"
"1629","Compendio1deBrotero.txt",1868,"O <b>pericarpo</b> ( pericarpium ) , he considerado pelos Botanicos , como hum tegumento accessivo , em que se achaõ envolvidas as sementes que delle devem sãhir depois do estado de plena madureza ; e segundo os Sexualistas he (a) huma viscera ou o ovario fecundado. (BROTERO, Felix Avellar, 1788)","2","pericarpo","pericarpo",NA,"pericarpo","1"
"1630","Compendio1deBrotero.txt",1869,"Deve-se contudo notar que as suas principaes propriedades consistem naõ sò em ser hum tegumento accessivo das sementes , isto he, em ser hum tegumento , que se pode separar sem lesaõ da substancia interna das sementes , nem impedir a sua germinaçaõ , ou tornar a vegetaçaõ futura imperfeita ; mas consistem ainda em se achar innato às sementes no tempo da sua fecundaçaõ , fazendo parte do germe do <b>pistillo</b> da fior; em ser naturalmente fechado athe à madureza das sementes ( excepto na reseda , datisca, e parnassia ) (b); e em se abrir ordinariamente, corromper-se (c), ou alterar-se depois madureza das sementes. (BROTERO, Felix Avellar, 1788)","82","pistillo","pistilo","singular","pistilo","1"
"1631","Compendio1deBrotero.txt",1870,"O <b>pericarpo</b> naõ constitue jamais o primeiro tegumento vesicular immediato às cotyledones da semente ; taõbem naõ he o tegumento secundario das sementes ( desacompanhado de outro terceiro ) quando o dicto tegumento naõ se abre determinada e espontaneamente athe ao tempo da germinaçaõ , nem se pode abrir sem impedila ou lesala ; por esta (BROTERO, Felix Avellar, 1788)","2","pericarpo","pericarpo",NA,"pericarpo","1"
"1632","Compendio1deBrotero.txt",1870,"O pericarpo naõ constitue jamais o primeiro tegumento vesicular immediato às <b>cotyledones</b> da semente ; taõbem naõ he o tegumento secundario das sementes ( desacompanhado de outro terceiro ) quando o dicto tegumento naõ se abre determinada e espontaneamente athe ao tempo da germinaçaõ , nem se pode abrir sem impedila ou lesala ; por esta (BROTERO, Felix Avellar, 1788)","13","cotyledones","cotilédone","plural","cotilédones","1"
"1633","Compendio1deBrotero.txt",1872,"Alguns daõ taõbem o nome de ovario fecundado ao <b>receptaculo</b> das sementes nuas , como das labiadas , compostas, &c. (BROTERO, Felix Avellar, 1788)","11","receptaculo","receptáculo","singular","receptáculo","1"
"1634","Compendio1deBrotero.txt",1876,"Esta circumstancia naõ deixa de ser sujeita a algumas excepçoẽs ; os <b>pericarpos</b> das sementes do xanthium , coqueiro, e outros semelhantes naõ se abrem nem corrompem senaõ no tempo , em que começa a germinaçaõ; mas elles poderaõ reconhecer-se por pericarpos pela razaõ de serem hum terceiro tegumento da semente ( como he bem visivel) e de se poderem abrir sem impedir a germinaçaõ. (BROTERO, Felix Avellar, 1788)","13","pericarpos","pericarpo","plural","pericarpos","1"
"1635","Compendio1deBrotero.txt",1876,"Esta circumstancia naõ deixa de ser sujeita a algumas excepçoẽs ; os <b>pericarpos</b> das sementes do xanthium , coqueiro, e outros semelhantes naõ se abrem nem corrompem senaõ no tempo , em que começa a germinaçaõ; mas elles poderaõ reconhecer-se por pericarpos pela razaõ de serem hum terceiro tegumento da semente ( como he bem visivel) e de se poderem abrir sem impedir a germinaçaõ. (BROTERO, Felix Avellar, 1788)","48","pericarpos","pericarpo","plural","pericarpos","1"
"1636","Compendio1deBrotero.txt",1880,"razaõ se costuma dizer que o <b>pericarpo</b> he nullo no milho (a), nas umbrelladas (b), labiadas gymnospermas , asperifolias , compostas , e outras semelhantes; mas quando este mesmo tegumento se abre lateralmente, e sempre pelo mesmo dugar antes da germinaçaõ, como v. g. nalgumas malvaceas, deve per considerado como hum verdadeiro pericarpo. (BROTERO, Felix Avellar, 1788)","7","pericarpo","pericarpo",NA,"pericarpo","1"
"1637","Compendio1deBrotero.txt",1880,"razaõ se costuma dizer que o <b>pericarpo</b> he nullo no milho (a), nas umbrelladas (b), labiadas gymnospermas , asperifolias , compostas , e outras semelhantes; mas quando este mesmo tegumento se abre lateralmente, e sempre pelo mesmo dugar antes da germinaçaõ, como v. g. nalgumas malvaceas, deve per considerado como hum verdadeiro pericarpo. (BROTERO, Felix Avellar, 1788)","68","pericarpo","pericarpo","SpaceAfter=No","pericarpo","1"
"1638","Compendio1deBrotero.txt",1883,"Na cevada , coix , e outras gramas , que tem as valvulas dos tegumentos da flor apegadas à semente no estado de madureza , so se podem admittir <b>pericarpos</b> bastardos ( spuria ) , porque as dictas valvulas ou tegumentos no tempo da fecundaçaõ das sementes estavaõ desapegados dellas , e naõ faziaõ parte do germe do pistillo ; o mesmo se deve dizer do nectario da mirabilis , e do tubo da corolla do poterium que vem somente a ser pericarpos bastardos. (BROTERO, Felix Avellar, 1788)","35","pericarpos","pericarpo","plural","pericarpos","1"
"1639","Compendio1deBrotero.txt",1883,"Na cevada , coix , e outras gramas , que tem as valvulas dos tegumentos da flor apegadas à semente no estado de madureza , so se podem admittir pericarpos bastardos ( spuria ) , porque as dictas valvulas ou tegumentos no tempo da fecundaçaõ das sementes estavaõ desapegados dellas , e naõ faziaõ parte do germe do <b>pistillo</b> ; o mesmo se deve dizer do nectario da mirabilis , e do tubo da corolla do poterium que vem somente a ser pericarpos bastardos. (BROTERO, Felix Avellar, 1788)","69","pistillo","pistilo","singular","pistilo","1"
"1640","Compendio1deBrotero.txt",1883,"Na cevada , coix , e outras gramas , que tem as valvulas dos tegumentos da flor apegadas à semente no estado de madureza , so se podem admittir <b>pericarpos</b> bastardos ( spuria ) , porque as dictas valvulas ou tegumentos no tempo da fecundaçaõ das sementes estavaõ desapegados dellas , e naõ faziaõ parte do germe do pistillo ; o mesmo se deve dizer do nectario da mirabilis , e do tubo da corolla do poterium que vem somente a ser pericarpos bastardos. (BROTERO, Felix Avellar, 1788)","98","pericarpos","pericarpo","plural","pericarpos","1"
"1641","Compendio1deBrotero.txt",1885,"Nas umbrelladas o fructo he bipartivel (bipartibilis ), isto he costuma no estado da madureza separar-se facilmente em duas sementes nuas , as quaes athe esse tempo estavaõ approximadas ou pareciaõ adunadas , como no coentro , salsa, &c. Linneo aindaque naõ indicou o <b>pericarpo</b> nullo nos generos de ferula , cachrys , caucalis , tordylium astrantia , e eryngium , isto parece ter somente sido por esquecimento, porque semelhantes plantas todas tem sementes nuas. (BROTERO, Felix Avellar, 1788)","53","pericarpo","pericarpo",NA,"pericarpo","1"
"1642","Compendio1deBrotero.txt",1886,"Nas labiadas taõbem parece ter havido o mesmo esquecimento a respeito da perilla, que tem sementes nuas : mas quanto ao prasium que he da mesma familia , naõ sei como se possa conciliar dar-lhe quatro sementes nuas , e assignar-lhe ao mesmo tempo por <b>pericarpos</b> quatro bagas monospermas e unicellulares ; as razoẽs de analogia dictaõ que nesta planta o pericarpo he nullo , e que as sementes tem o tegumento proprio secundario hum tanto succulento. (BROTERO, Felix Avellar, 1788)","54","pericarpos","pericarpo","plural","pericarpos","1"
"1643","Compendio1deBrotero.txt",1886,"Nas labiadas taõbem parece ter havido o mesmo esquecimento a respeito da perilla, que tem sementes nuas : mas quanto ao prasium que he da mesma familia , naõ sei como se possa conciliar dar-lhe quatro sementes nuas , e assignar-lhe ao mesmo tempo por <b>pericarpo</b>s quatro bagas monospermas e unicellulares ; as razoẽs de analogia dictaõ que nesta planta o pericarpo he nullo , e que as sementes tem o tegumento proprio secundario hum tanto succulento. (BROTERO, Felix Avellar, 1788)","71","pericarpo","pericarpo",NA,"pericarpo","1"
"1644","Compendio1deBrotero.txt",1888,"A analogia dos fructos dos generos da mesma familia poderá em cazo de duvida fazer reconhecer este terceiro tegumento , e porisso se assignaõ <b>pericarpos</b> ao myagrum , bunias , peltaria , crambe , trevos , fumaria , securidaca borbonia , anthyllis , ebenus , psoralea , geoffrova , Etc. (BROTERO, Felix Avellar, 1788)","28","pericarpos","pericarpo","plural","pericarpos","1"
"1645","Compendio1deBrotero.txt",1890,"abrir sem lesar nem impedir a germinaçaõ , deve ser considerado como hum verdadeiro <b>pericarpo</b> ( como no cocco , e xanthium ) (BROTERO, Felix Avellar, 1788)","15","pericarpo","pericarpo",NA,"pericarpo","1"
"1646","Compendio1deBrotero.txt",1891,": se dentro deste terceiro tegumento houverem sementes , cujo tegumento secundario for valvulado , e se abrir espontanea , e determinadamente depois da sua madureza ou antes da germinaçaõ, deve ser considerado como <b>pericarpo</b> , e neste cazo a semente, ficará guarnecida de dois pericarpos, se elles forem desadunados ou separaveis hum outro; mas se o dicto tegumento secundario for Ienhoso , e persistente athe á germinaçaõ , aindaque tenha valvulas , naõ deve ser tido por pericarpo , mas taõ somente por tegumento proprio da semente como saõ todas as nozes ou caroços das drupas , e de algumas bagas. (BROTERO, Felix Avellar, 1788)","39","pericarpo","pericarpo",NA,"pericarpo","1"
"1647","Compendio1deBrotero.txt",1891,": se dentro deste terceiro tegumento houverem sementes , cujo tegumento secundario for valvulado , e se abrir espontanea , e determinadamente depois da sua madureza ou antes da germinaçaõ, deve ser considerado como pericarpo , e neste cazo a semente, ficará guarnecida de dois <b>pericarpos</b>, se elles forem desadunados ou separaveis hum outro; mas se o dicto tegumento secundario for Ienhoso , e persistente athe á germinaçaõ , aindaque tenha valvulas , naõ deve ser tido por pericarpo , mas taõ somente por tegumento proprio da semente como saõ todas as nozes ou caroços das drupas , e de algumas bagas. (BROTERO, Felix Avellar, 1788)","52","pericarpos","pericarpo","plural","pericarpos","1"
"1648","Compendio1deBrotero.txt",1891,": se dentro deste terceiro tegumento houverem sementes , cujo tegumento secundario for valvulado , e se abrir espontanea , e determinadamente depois da sua madureza ou antes da germinaçaõ, deve ser considerado como <b>pericarpo</b> , e neste cazo a semente, ficará guarnecida de dois pericarpos, se elles forem desadunados ou separaveis hum outro; mas se o dicto tegumento secundario for Ienhoso , e persistente athe á germinaçaõ , aindaque tenha valvulas , naõ deve ser tido por pericarpo , mas taõ somente por tegumento proprio da semente como saõ todas as nozes ou caroços das drupas , e de algumas bagas. (BROTERO, Felix Avellar, 1788)","87","pericarpo","pericarpo",NA,"pericarpo","1"
"1649","Compendio1deBrotero.txt",1892,"Linneo naõ admitte <b>pericarpo</b> que conste ou seja recheado de pericarpos menores , e diz que quando parece haver muitos pericarpos reclusos em hum pericarpo exterior , este so deve ser considerado como hum receptaculo commum ( a ); mas attendendo aos exemplos que cita (b); (BROTERO, Felix Avellar, 1788)","4","pericarpo","pericarpo",NA,"pericarpo","1"
"1650","Compendio1deBrotero.txt",1892,"Linneo naõ admitte pericarpo que conste ou seja recheado de <b>pericarpos</b> menores , e diz que quando parece haver muitos pericarpos reclusos em hum pericarpo exterior , este so deve ser considerado como hum receptaculo commum ( a ); mas attendendo aos exemplos que cita (b); (BROTERO, Felix Avellar, 1788)","11","pericarpos","pericarpo","plural","pericarpos","1"
"1651","Compendio1deBrotero.txt",1892,"Linneo naõ admitte pericarpo que conste ou seja recheado de <b>pericarpos</b> menores , e diz que quando parece haver muitos pericarpos reclusos em hum pericarpo exterior , este so deve ser considerado como hum receptaculo commum ( a ); mas attendendo aos exemplos que cita (b); (BROTERO, Felix Avellar, 1788)","21","pericarpos","pericarpo","plural","pericarpos","1"
"1652","Compendio1deBrotero.txt",1892,"Linneo naõ admitte <b>pericarpo</b> que conste ou seja recheado de pericarpos menores , e diz que quando parece haver muitos pericarpos reclusos em hum pericarpo exterior , este so deve ser considerado como hum receptaculo commum ( a ); mas attendendo aos exemplos que cita (b); (BROTERO, Felix Avellar, 1788)","25","pericarpo","pericarpo",NA,"pericarpo","1"
"1653","Compendio1deBrotero.txt",1892,"Linneo naõ admitte pericarpo que conste ou seja recheado de pericarpos menores , e diz que quando parece haver muitos pericarpos reclusos em hum pericarpo exterior , este so deve ser considerado como hum <b>receptaculo</b> commum ( a ); mas attendendo aos exemplos que cita (b); (BROTERO, Felix Avellar, 1788)","35","receptaculo","receptáculo","singular","receptáculo","1"
"1654","Compendio1deBrotero.txt",1894,"Na opiniaõ de alguns modernos naõ implica de sorte alguma com a natureza dos fructos, que haja hum ou mais <b>pericarpos</b> (BROTERO, Felix Avellar, 1788)","24","pericarpos","pericarpo","plural","pericarpos","1"
"1655","Compendio1deBrotero.txt",1896,"Creyo que quer dizer <b>receptaculo</b> commum das sementes; mas as siliquas , vagens , pomos, &c, saõ receptaculos communs das sementes , e ao mesmo tempo naõ deixaõ de ser reconhecidos por pericarpos. (BROTERO, Felix Avellar, 1788)","5","receptaculo","receptáculo","singular","receptáculo","1"
"1656","Compendio1deBrotero.txt",1896,"Creyo que quer dizer receptaculo commum das sementes; mas as <b>siliquas</b> , vagens , pomos, &c, saõ receptaculos communs das sementes , e ao mesmo tempo naõ deixaõ de ser reconhecidos por pericarpos. (BROTERO, Felix Avellar, 1788)","13","siliquas","síliqua","plural","síliquas","1"
"1657","Compendio1deBrotero.txt",1896,"Creyo que quer dizer receptaculo commum das sementes; mas as siliquas , vagens , pomos, &c, saõ <b>receptaculos</b> communs das sementes , e ao mesmo tempo naõ deixaõ de ser reconhecidos por pericarpos. (BROTERO, Felix Avellar, 1788)","22","receptaculos","receptáculo","plural","receptáculos","1"
"1658","Compendio1deBrotero.txt",1896,"Creyo que quer dizer receptaculo commum das sementes; mas as siliquas , vagens , pomos, &c, saõ receptaculos communs das sementes , e ao mesmo tempo naõ deixaõ de ser reconhecidos por <b>pericarpos</b>. (BROTERO, Felix Avellar, 1788)","39","pericarpos","pericarpo","plural","pericarpos","1"
"1659","Compendio1deBrotero.txt",1898,"Os <b>receptaculos</b> da magnolia , michelia , e uvaria. (BROTERO, Felix Avellar, 1788)","2","receptaculos","receptáculo","plural","receptáculos","1"
"1660","Compendio1deBrotero.txt",1901,"Contudo segundo o mesmo Botanico o fructo da sylva, aindaque naõ tenha hum tegumento commum fechado, he huma baga composta, e naõ hum <b>receptaculo</b>. (BROTERO, Felix Avellar, 1788)","28","receptaculo","receptáculo","singular","receptáculo","1"
"1661","Compendio1deBrotero.txt",1904,"dentro de outro externo ; nos pomos por ex. o <b>pericarpo</b> externo (a) he hum tegumento grosso , succulento e alteravel que contem hum segundo pericarpo ou capsula , na qual se achaõ reclusas as cementes , como se vê nas peras, e maçaans; na romaan dentro das cellulas do pomo ha hum grande numero de acinos ou bagas monospermas , as quaes todas saõ verdadeiros pericarpos còrados (b) , succulentos e alteraveis , em tudo semelhantes aos das amoras de syIva, a que Linneo dà o nome de pericarpos (c). (BROTERO, Felix Avellar, 1788)","13","pericarpo","pericarpo",NA,"pericarpo","1"
"1662","Compendio1deBrotero.txt",1904,"dentro de outro externo ; nos pomos por ex. o <b>pericarpo</b> externo (a) he hum tegumento grosso , succulento e alteravel que contem hum segundo pericarpo ou capsula , na qual se achaõ reclusas as cementes , como se vê nas peras, e maçaans; na romaan dentro das cellulas do pomo ha hum grande numero de acinos ou bagas monospermas , as quaes todas saõ verdadeiros pericarpos còrados (b) , succulentos e alteraveis , em tudo semelhantes aos das amoras de syIva, a que Linneo dà o nome de pericarpos (c). (BROTERO, Felix Avellar, 1788)","30","pericarpo","pericarpo",NA,"pericarpo","1"
"1663","Compendio1deBrotero.txt",1904,"dentro de outro externo ; nos pomos por ex. o pericarpo externo (a) he hum tegumento grosso , succulento e alteravel que contem hum segundo pericarpo ou capsula , na qual se achaõ reclusas as cementes , como se vê nas peras, e maçaans; na romaan dentro das cellulas do pomo ha hum grande numero de acinos ou bagas monospermas , as quaes todas saõ verdadeiros <b>pericarpos</b> còrados (b) , succulentos e alteraveis , em tudo semelhantes aos das amoras de syIva, a que Linneo dà o nome de pericarpos (c). (BROTERO, Felix Avellar, 1788)","78","pericarpos","pericarpo","plural","pericarpos","1"
"1664","Compendio1deBrotero.txt",1904,"dentro de outro externo ; nos pomos por ex. o pericarpo externo (a) he hum tegumento grosso , succulento e alteravel que contem hum segundo pericarpo ou capsula , na qual se achaõ reclusas as cementes , como se vê nas peras, e maçaans; na romaan dentro das cellulas do pomo ha hum grande numero de acinos ou bagas monospermas , as quaes todas saõ verdadeiros <b>pericarpos</b> còrados (b) , succulentos e alteraveis , em tudo semelhantes aos das amoras de syIva, a que Linneo dà o nome de pericarpos (c). (BROTERO, Felix Avellar, 1788)","106","pericarpos","pericarpo","plural","pericarpos","1"
"1665","Compendio1deBrotero.txt",1905,"Quando os tegumentos da flor ficaõ depois da madureza das sementes nuas , hum tanto conchegados a ellas, durante algum tempo , como se vè na salva, alface , e outras compostas e labiadas , naõ se deve de sorte alguma dar o nome de <b>pericarpo</b> aos dictos tegumentos ainda que a natureza os empregue para fazerem as vezes de pericarpo , e se dirà taõ somente que o calya ou corolla fomenta as sementes no seu seyo. (BROTERO, Felix Avellar, 1788)","52","pericarpo","pericarpo",NA,"pericarpo","1"
"1666","Compendio1deBrotero.txt",1905,"Quando os tegumentos da flor ficaõ depois da madureza das sementes nuas , hum tanto conchegados a ellas, durante algum tempo , como se vè na salva, alface , e outras compostas e labiadas , naõ se deve de sorte alguma dar o nome de <b>pericarpo</b> aos dictos tegumentos ainda que a natureza os empregue para fazerem as vezes de pericarpo , e se dirà taõ somente que o calya ou corolla fomenta as sementes no seu seyo. (BROTERO, Felix Avellar, 1788)","68","pericarpo","pericarpo",NA,"pericarpo","1"
"1667","Compendio1deBrotero.txt",1907,"Os termos drupa , e baga saõ vulgarmente entendidos pelo fructo total , isto he, pelas sementes e juntamente pelo <b>pericarpo</b> de que saõ guarnecidas, mas no rigor botanico so significaõ o pericarpo ou tegumento externo accessivo , gro so e polposo ; porquanto assim como quando dizemos a vagem do feijoeiro contem sementes reniformes , so rigorosamente se entende o pericarpo, da mesma sorte quando dissermos os pomos d pereira contem sementes pontudas , so devemos entender os dois pericarpos que constituem o pomo , e o mesmo deve ter lugar a respeito das drupas , e bagas. (BROTERO, Felix Avellar, 1788)","25","pericarpo","pericarpo",NA,"pericarpo","1"
"1668","Compendio1deBrotero.txt",1907,"Os termos drupa , e baga saõ vulgarmente entendidos pelo fructo total , isto he, pelas sementes e juntamente pelo <b>pericarpo</b> de que saõ guarnecidas, mas no rigor botanico so significaõ o pericarpo ou tegumento externo accessivo , gro so e polposo ; porquanto assim como quando dizemos a vagem do feijoeiro contem sementes reniformes , so rigorosamente se entende o pericarpo, da mesma sorte quando dissermos os pomos d pereira contem sementes pontudas , so devemos entender os dois pericarpos que constituem o pomo , e o mesmo deve ter lugar a respeito das drupas , e bagas. (BROTERO, Felix Avellar, 1788)","39","pericarpo","pericarpo",NA,"pericarpo","1"
