"","doc_id","sentence_id","sentence","token_id","token","lemma","misc","orth","sensenumber"
"1166","Compendio1deBrotero.txt",990,"Peciolar ou terminal ( petiolaris , s. terminalis ), quando nasce do topo do <b>peciolo</b> prolongado , como nas folhas jungidas. (BROTERO, Felix Avellar, 1788)","18","peciolo","pecíolo","singular","pecíolo","1"
"1167","Compendio1deBrotero.txt",993,"COMPENDIO 88 Peduncular ( peduncularis ) , se nasce do <b>pedunculo</b> ou do pe que sostem a flor. (BROTERO, Felix Avellar, 1788)","12","pedunculo","pedúnculo","singular","pedúnculo","1"
"1168","Compendio1deBrotero.txt",997,"<b>Glandulas</b>. (BROTERO, Felix Avellar, 1788)","1","Glandulas","glândula","plural","Glândulas","1"
"1169","Compendio1deBrotero.txt",998,"Debaxo do nome de <b>glandulas</b> os Botanicos comprehendem em geral ora certas excrescencias ora certas cavidades , que se achaõ no exterior dos vegetaes , e lhes tem dado os nomes de tuberculos, mamillos, verrugas , graõsinhos utriculos , vesiculas , callos , pontos , fossulas , pustulas , cicatrizes , pòros, &c. de que fallarei, quando tractar da glandulaçaõ relativa ao habito externo. (BROTERO, Felix Avellar, 1788)","6","glandulas","glândula","plural","glândulas","1"
"1170","Compendio1deBrotero.txt",999,"As <b>glandulas</b> (glandulae) , de que prezentemente devo fazer mençaõ saõ certos graõsinhos de formas differentes, que se observaõ principalmente nas folhas e producçoẽs analogas a ellas. (BROTERO, Felix Avellar, 1788)","2","glandulas","glândula","plural","glândulas","1"
"1171","Compendio1deBrotero.txt",1003,"As <b>glandulas</b> dizem-se: peciolares ( petiolares ), quando se daõ no peciolo da folha (o martyrio e noveleiro); estipulares (stipulares), quando se daõ nas estipulas; bracteares (bracteares ) , se nas bracteas; pedunculares (pedunculares ) , se nos pedunculos ; capillares (capillares ) , se nascem dos pelos , ou estaõ unidas a elles (b). (BROTERO, Felix Avellar, 1788)","2","glandulas","glândula","plural","glândulas","1"
"1172","Compendio1deBrotero.txt",1003,"As glandulas dizem-se: peciolares ( petiolares ), quando se daõ no <b>peciolo</b> da folha (o martyrio e noveleiro); estipulares (stipulares), quando se daõ nas estipulas; bracteares (bracteares ) , se nas bracteas; pedunculares (pedunculares ) , se nos pedunculos ; capillares (capillares ) , se nascem dos pelos , ou estaõ unidas a elles (b). (BROTERO, Felix Avellar, 1788)","16","peciolo","pecíolo","singular","pecíolo","1"
"1173","Compendio1deBrotero.txt",1003,"As glandulas dizem-se: peciolares ( petiolares ), quando se daõ no peciolo da folha (o martyrio e noveleiro); estipulares (stipulares), quando se daõ nas <b>estipulas</b>; bracteares (bracteares ) , se nas bracteas; pedunculares (pedunculares ) , se nos pedunculos ; capillares (capillares ) , se nascem dos pelos , ou estaõ unidas a elles (b). (BROTERO, Felix Avellar, 1788)","37","estipulas","estípula","plural","estípulas","1"
"1174","Compendio1deBrotero.txt",1003,"As glandulas dizem-se: peciolares ( petiolares ), quando se daõ no peciolo da folha (o martyrio e noveleiro); estipulares (stipulares), quando se daõ nas estipulas; bracteares (bracteares ) , se nas <b>bracteas</b>; pedunculares (pedunculares ) , se nos pedunculos ; capillares (capillares ) , se nascem dos pelos , ou estaõ unidas a elles (b). (BROTERO, Felix Avellar, 1788)","47","bracteas","bráctea","plural","brácteas","1"
"1175","Compendio1deBrotero.txt",1003,"As glandulas dizem-se: peciolares ( petiolares ), quando se daõ no peciolo da folha (o martyrio e noveleiro); estipulares (stipulares), quando se daõ nas estipulas; bracteares (bracteares ) , se nas bracteas; pedunculares (pedunculares ) , se nos <b>pedunculos</b> ; capillares (capillares ) , se nascem dos pelos , ou estaõ unidas a elles (b). (BROTERO, Felix Avellar, 1788)","57","pedunculos","pedúnculo","plural","pedúnculos","1"
"1176","Compendio1deBrotero.txt",1004,"Folheares (foliares , s. <b>foliacea</b> ) , quando se daõ nao folhas; as vezes estaõ na base ( como na abobara cabassa ou carneira) ; outras vezes nos dentes ( como no salgueiro e amendoeira ); outras emfim no dorso da folha, nas nervuras, ou em qualquer das duas faces. (BROTERO, Felix Avellar, 1788)","6","foliacea","foliáceo","feminino singular","foliácea","1"
"1177","Compendio1deBrotero.txt",1005,"Algumas vezes estas <b>glandulas</b> saõ hum tanto concavas (concavae.) (BROTERO, Felix Avellar, 1788)","4","glandulas","glândula","plural","glândulas","1"
"1178","Compendio1deBrotero.txt",1010,"Ellas taõbem se achaõ nos <b>estames</b> e antheras (BROTERO, Felix Avellar, 1788)","7","estames","estame","plural","estames","1"
"1179","Compendio1deBrotero.txt",1010,"Ellas taõbem se achaõ nos estames e <b>antheras</b> (BROTERO, Felix Avellar, 1788)","9","antheras","antera","plural","anteras","1"
"1180","Compendio1deBrotero.txt",1026,"Estas <b>glandulas</b>,saõ differentes dos utriculos internos , e dos externos que se achaõ em certas plantas , como na utricularia , maregravia, &c. (c) Linneo da ao trichismo o nome de pubes , pubescentia e hirsuties ; mas estes termos tem huma significaçaõ menos geral , e equivoca , porisso julgei mais acertado usar do primeiro. (BROTERO, Felix Avellar, 1788)","2","glandulas","glândula","plural","glândulas","1"
"1181","Compendio1deBrotero.txt",1042,"Pegamaços (hami ) saõ arestas , praganas curtas, ou sedas simplez, que tem hum so gancho na ponta, ou que terminaõ em huma ponta aguda e curvada (o fructo da agrimonia , o <b>calyz</b> da bardana). (BROTERO, Felix Avellar, 1788)","41","calyz","cálice","singular","cálice","1"
"1182","Compendio1deBrotero.txt",1045,"As cerdas , segundo,o uso mais geral desta palavra , saõ sedas ora hum tanto planas , ora roliças, e picantes; ellas estabelecem a passagem das sedas menos rijas aos espinhos e aculeos , ou para melhor dizer , saõ espinhos ou aculeos, de menor grandeza e os mais fracos , como se vem nas folhas e <b>pedunculos</b> de algumas sylvas e roseiras , no rubus caesius & hispidus , e taõbem no echinops strigosus. (BROTERO, Felix Avellar, 1788)","67","pedunculos","pedúnculo","plural","pedúnculos","1"
"1183","Compendio1deBrotero.txt",1057,"Abrolhos ou espinhos do lenho (spinae) , saõ producçoẽs lenhosas, e agudas, que nascem do Ienho e naõ meramente da casca , que tem fibras summamente prolongadas de modo que formaõ huma substamcia continuada taõ intimamente , que senaõ podem arrancar sem grande estrago da parte donde nascem; daõ-se no tronco e ramos , como se vê no pirliteiro , restaboi, limoeiro, e abrunheiro bravo; nas folhas, como no zimbro, alcaxofas , e cardos; no <b>calyz</b>, como no cardo sancto; nos fructos, como no abrolho , e datura ferox. (BROTERO, Felix Avellar, 1788)","97","calyz","cálice","singular","cálice","1"
"1184","Compendio1deBrotero.txt",1060,"Os espinhos dizem-se ser : terminaes (terminales ), quando se achaõ nas pontas dos ramos, folhas , &c.; axillares (axillares ) , se nascem nas axillas ; calycinos (calicinae), quando se daõ no <b>calyz</b>, nos seus foliolos ou lacinias ; folheares (foliares ) , se nascem nas folhas; simplices (simplices ) , se naõ saõ divididos; ramosos ou divididos ( divisae , s. ramosae ) (BROTERO, Felix Avellar, 1788)","47","calyz","cálice","singular","cálice","1"
"1185","Compendio1deBrotero.txt",1060,"Os espinhos dizem-se ser : terminaes (terminales ), quando se achaõ nas pontas dos ramos, folhas , &c.; axillares (axillares ) , se nascem nas axillas ; calycinos (calicinae), quando se daõ no calyz, nos seus foliolos ou <b>lacinias</b> ; folheares (foliares ) , se nascem nas folhas; simplices (simplices ) , se naõ saõ divididos; ramosos ou divididos ( divisae , s. ramosae ) (BROTERO, Felix Avellar, 1788)","54","lacinias","lacínia","plural","lacínias","1"
"1186","Compendio1deBrotero.txt",1066,"Algumas flores ou <b>pedunculos</b> saõ guarnecidos de huma so bractéa, outros saõ acompanhados de muitas. (BROTERO, Felix Avellar, 1788)","4","pedunculos","pedúnculo","plural","pedúnculos","1"
"1187","Compendio1deBrotero.txt",1067,"Dizem-se : grandes ou pequenas ( magna aut parvae) , segundo saõ maiores ou menores do que as flores ou seus <b>pedunculos</b>. (BROTERO, Felix Avellar, 1788)","25","pedunculos","pedúnculo","plural","pedúnculos","1"
"1188","Compendio1deBrotero.txt",1075,"Do <b>pedunculo</b>. (BROTERO, Felix Avellar, 1788)","3","pedunculo","pedúnculo","singular","pedúnculo","1"
"1189","Compendio1deBrotero.txt",1076,"O <b>pedunculo</b> ( pedunculus ) he a parte do tronco ou ramos que serve de esteio á flor , e a que chamaõ vulgarmente o pé da fior. (BROTERO, Felix Avellar, 1788)","2","pedunculo","pedúnculo","singular","pedúnculo","1"
"1190","Compendio1deBrotero.txt",1078,"Diz- se ser: commum (communis ) , quando sostem muitas flores ou se divide em <b>pedunculos</b> parciaes. (BROTERO, Felix Avellar, 1788)","19","pedunculos","pedúnculo","plural","pedúnculos","1"
"1191","Compendio1deBrotero.txt",1079,"Parcial ( partialis ) , quando nasce do <b>pedunculo</b> commum ramificado; subdivide-se as vezes ainda em outros menores , a que chamaõ pedicellos ou pedunculos immediatos ( pedicelli ). 1º. Os pedunculos considerados, quanto ao lugar a que estaõ apegados na planta, dizem-se ser: (BROTERO, Felix Avellar, 1788)","10","pedunculo","pedúnculo","singular","pedúnculo","1"
"1192","Compendio1deBrotero.txt",1079,"Parcial ( partialis ) , quando nasce do pedunculo commum ramificado; subdivide-se as vezes ainda em outros menores , a que chamaõ pedicellos ou <b>pedunculos</b> immediatos ( pedicelli ). 1º. Os pedunculos considerados, quanto ao lugar a que estaõ apegados na planta, dizem-se ser: (BROTERO, Felix Avellar, 1788)","28","pedunculos","pedúnculo","plural","pedúnculos","1"
"1193","Compendio1deBrotero.txt",1079,"Parcial ( partialis ) , quando nasce do pedunculo commum ramificado; subdivide-se as vezes ainda em outros menores , a que chamaõ pedicellos ou <b>pedunculos</b> immediatos ( pedicelli ). 1º. Os pedunculos considerados, quanto ao lugar a que estaõ apegados na planta, dizem-se ser: (BROTERO, Felix Avellar, 1788)","37","pedunculos","pedúnculo","plural","pedúnculos","1"
"1194","Compendio1deBrotero.txt",1081,"Estes <b>pedunculos</b> saõ curtos, sem folhas, e ordinariamente uniflòros; saõ a mesma coiza que hasteas simplices ou simplicissimas. (BROTERO, Felix Avellar, 1788)","2","pedunculos","pedúnculo","plural","pedúnculos","1"
"1195","Compendio1deBrotero.txt",1085,", se nascem dos <b>peciolos</b> (o hibiscus moscheutos , e algumas especies de turnera ). (BROTERO, Felix Avellar, 1788)","6","peciolos","pecíolo","plural","pecíolos","1"
"1196","Compendio1deBrotero.txt",1109,"Conglobados (conglobati ) , quando formaõ huma especie de globo; as umbrellas da angelica e algumas flores capitozas tem <b>pedunculos</b> bem visivelmente conglobados. (BROTERO, Felix Avellar, 1788)","23","pedunculos","pedúnculo","plural","pedúnculos","1"
"1197","Compendio1deBrotero.txt",1120,"3º Quanto ao numero, o <b>pedunculo</b> diz-se ser: (BROTERO, Felix Avellar, 1788)","8","pedunculo","pedúnculo","singular","pedúnculo","1"
"1198","Compendio1deBrotero.txt",1121,"Simplez (simplex) , quando se divide em rarissimos pedicellos; simplicissimo (simplicissimus) se he unifloro , naõ se dividindo em <b>pedunculos</b> alguns. (BROTERO, Felix Avellar, 1788)","25","pedunculos","pedúnculo","plural","pedúnculos","1"
"1199","Compendio1deBrotero.txt",1122,"Multifloro ( multiflorus ) , se sostem muitas flores ; unifloro , bifloro , trifloro , quadrifloro , &c se sostem huma , duas, tres, quatro flores, &c. Composto ou ramoso ( compositus , s. ramosus ) , quando se ramifica em muitos <b>pedunculos</b> parciaes. (BROTERO, Felix Avellar, 1788)","47","pedunculos","pedúnculo","plural","pedúnculos","1"
"1200","Compendio1deBrotero.txt",1125,": neste mesmo sentido se dizem ser taõbem: tres a tres, quatro a quatro, &c. ( terni , quaterni, &c.) Numerosos (numerosi, multiplices ), quando saõ em grande numero , ou sejaõ situados nas umbrellas e verticillos , ou ao longo dos ramos , <b>receptaculos</b> communs, &c. 4º Quanto a direcçaõ, dizem-se ser: (BROTERO, Felix Avellar, 1788)","57","receptaculos","receptáculo","plural","receptáculos","1"
"1201","Compendio1deBrotero.txt",1149,"Engrossados (incrassati ) , quando engrossaõ para a ponta ou junto do <b>caliz</b> da flor : se junto da flor engrossaõ á maneira de huma massa , dizem-se: aclavados (clavati). (BROTERO, Felix Avellar, 1788)","15","caliz","cálice","singular","cálice","1"
"1202","Compendio1deBrotero.txt",1151,"Bracteados (bracteati ), se saõ guarnecidos de <b>bracteas</b> : folhosos (foliati ) , se saõ guarnecidos de folhas: escamosos (squamosi) , se tem escamas : segundo as G iij (BROTERO, Felix Avellar, 1788)","10","bracteas","bráctea","plural","brácteas","1"
"1203","Compendio1deBrotero.txt",1151,"Bracteados (bracteati ), se saõ guarnecidos de bracteas : folhosos (foliati ) , se saõ guarnecidos de folhas: <b>escamosos</b> (squamosi) , se tem escamas : segundo as G iij (BROTERO, Felix Avellar, 1788)","23","escamosos","escamoso","masculino plural","escamosos","1"
"1204","Compendio1deBrotero.txt",1154,"Nûs (nudi ) , se naõ tem folhas, <b>bracteas</b>, escamas, membranas , nem pelos alguns: inermes ( inermes ), se naõ tem sorte alguma de armas ou espinhos. (BROTERO, Felix Avellar, 1788)","11","bracteas","bráctea","plural","brácteas","1"
"1205","Compendio1deBrotero.txt",1159,"A disposiçaõ das flores chamada por Linneo inflorescencia (inflorescencia ) , he o modo com que ellas saõ apegadas aos <b>pedunculos</b> ou a qualquer parte do tronco. (BROTERO, Felix Avellar, 1788)","24","pedunculos","pedúnculo","plural","pedúnculos","1"
"1206","Compendio1deBrotero.txt",1160,"As flores em geral ou saõ rentes ou pedunculadas; as rentes ( sessiles ) , saõ as que estaõ apegadas ao tronco ou a qualquer parte da planta, sem terem <b>pedunculo</b> algum ; as pedunculadas ( pedunculati ) (BROTERO, Felix Avellar, 1788)","35","pedunculo","pedúnculo","singular","pedúnculo","1"
"1207","Compendio1deBrotero.txt",1161,", saõ estejadas em hum <b>pedunculo</b>. (BROTERO, Felix Avellar, 1788)","6","pedunculo","pedúnculo","singular","pedúnculo","1"
"1208","Compendio1deBrotero.txt",1162,"A disposiçaõ das flores sendo analoga á dos <b>pedunculos</b> , conhece-se claramente que ellas devem (BROTERO, Felix Avellar, 1788)","11","pedunculos","pedúnculo","plural","pedúnculos","1"
"1209","Compendio1deBrotero.txt",1166,"A flor composta ( compositus ) , he a que contem dentro de hum perianthio commum muitas pequenas flores rentes , pegadas à hum <b>receptaculo</b> commum dilatado lateralmente ; as antheras dos seus flosculos saõ adunadas , e cada flosculo he sobraposto a huma semente ( o gyrasol , a macella; as boninas , &c). (BROTERO, Felix Avellar, 1788)","26","receptaculo","receptáculo","singular","receptáculo","1"
"1210","Compendio1deBrotero.txt",1166,"A flor composta ( compositus ) , he a que contem dentro de hum perianthio commum muitas pequenas flores rentes , pegadas à hum receptaculo commum dilatado lateralmente ; as <b>antheras</b> dos seus flosculos saõ adunadas , e cada flosculo he sobraposto a huma semente ( o gyrasol , a macella; as boninas , &c). (BROTERO, Felix Avellar, 1788)","32","antheras","antera","plural","anteras","1"
"1211","Compendio1deBrotero.txt",1166,"A flor composta ( compositus ) , he a que contem dentro de hum perianthio commum muitas pequenas flores rentes , pegadas à hum receptaculo commum dilatado lateralmente ; as antheras dos seus <b>flosculos</b> saõ adunadas , e cada flosculo he sobraposto a huma semente ( o gyrasol , a macella; as boninas , &c). (BROTERO, Felix Avellar, 1788)","36","flosculos","flósculo","plural","flósculos","1"
"1212","Compendio1deBrotero.txt",1166,"A flor composta ( compositus ) , he a que contem dentro de hum perianthio commum muitas pequenas flores rentes , pegadas à hum receptaculo commum dilatado lateralmente ; as antheras dos seus <b>flosculo</b>s saõ adunadas , e cada flosculo he sobraposto a huma semente ( o gyrasol , a macella; as boninas , &c). (BROTERO, Felix Avellar, 1788)","42","flosculo","flósculo","masculino singular","flósculo","1"
"1213","Compendio1deBrotero.txt",1168,"Aggregada (a) (aggregatus ) he semelhante á composta; mas os seus <b>flosculos</b> naõ tem antheras adunadas , e às vezes saõ sostidos em pedicellos curtissimos ( a saudade, e cardo penteador ). (BROTERO, Felix Avellar, 1788)","16","flosculos","flósculo","plural","flósculos","1"
"1214","Compendio1deBrotero.txt",1168,"Aggregada (a) (aggregatus ) he semelhante á composta; mas os seus flosculos naõ tem <b>antheras</b> adunadas , e às vezes saõ sostidos em pedicellos curtissimos ( a saudade, e cardo penteador ). (BROTERO, Felix Avellar, 1788)","19","antheras","antera","plural","anteras","1"
"1215","Compendio1deBrotero.txt",1169,"Espadicea ou enrocada (spadiceus ) , consta de muitos <b>flosculos</b> rentes ou pedunculados, nascidos de hum receptaculo commum oblongo , contido em huma espatha. (BROTERO, Felix Avellar, 1788)","11","flosculos","flósculo","plural","flósculos","1"
"1216","Compendio1deBrotero.txt",1169,"Espadicea ou enrocada (spadiceus ) , consta de muitos flosculos rentes ou pedunculados, nascidos de hum <b>receptaculo</b> commum oblongo , contido em huma espatha. (BROTERO, Felix Avellar, 1788)","19","receptaculo","receptáculo","singular","receptáculo","1"
"1217","Compendio1deBrotero.txt",1169,"Espadicea ou enrocada (spadiceus ) , consta de muitos flosculos rentes ou pedunculados, nascidos de hum receptaculo commum <b>oblongo</b> , contido em huma espatha. (BROTERO, Felix Avellar, 1788)","21","oblongo","oblongo",NA,"oblongo","1"
"1218","Compendio1deBrotero.txt",1170,"Este <b>receptaculo</b> he chamado roca ou espadice (spadix) ; elle diz-se simplez (simplex ) no pe de bezerro , em razaõ de se naõ ramificar , e ramoso (a) (BROTERO, Felix Avellar, 1788)","2","receptaculo","receptáculo","singular","receptáculo","1"
"1219","Compendio1deBrotero.txt",1174,"O verticillo diz-se : rente (sessilis ) , se as flores que o formaõ naõ tem <b>pedunculo</b>; pedunculado ( pedunculatus ) , se ellas saõ pedunculadas : involucrado ( involucratus ) , se tem hum involucro : bracteado (bracteatus ) , se he acompanhado de alguma bractea : nu ( nudas ) (BROTERO, Felix Avellar, 1788)","19","pedunculo","pedúnculo","singular","pedúnculo","1"
"1220","Compendio1deBrotero.txt",1174,"O verticillo diz-se : rente (sessilis ) , se as flores que o formaõ naõ tem pedunculo; pedunculado ( pedunculatus ) , se ellas saõ pedunculadas : involucrado ( involucratus ) , se tem hum involucro : <b>bractea</b>do (bracteatus ) , se he acompanhado de alguma bractea : nu ( nudas ) (BROTERO, Felix Avellar, 1788)","51","bractea","bráctea","singular","bráctea","1"
"1221","Compendio1deBrotero.txt",1175,", se naõ tem involucro nem <b>bractea</b> alguma : basto ( confertus ) , se os flosculos que o compoem estaõ, approximados densamente: raleado (distans) , se os seus flosculos estaõ hum tanto distantes entre si: semicircular (dimidiatus ) , quando, os seus flosculos naõ formaõ á roda do tronco hum annel completo, mas somente metade delle. (BROTERO, Felix Avellar, 1788)","7","bractea","bráctea","singular","bráctea","1"
"1222","Compendio1deBrotero.txt",1175,", se naõ tem involucro nem bractea alguma : basto ( confertus ) , se os <b>flosculos</b> que o compoem estaõ, approximados densamente: raleado (distans) , se os seus flosculos estaõ hum tanto distantes entre si: semicircular (dimidiatus ) , quando, os seus flosculos naõ formaõ á roda do tronco hum annel completo, mas somente metade delle. (BROTERO, Felix Avellar, 1788)","17","flosculos","flósculo","plural","flósculos","1"
"1223","Compendio1deBrotero.txt",1175,", se naõ tem involucro nem bractea alguma : basto ( confertus ) , se os <b>flosculos</b> que o compoem estaõ, approximados densamente: raleado (distans) , se os seus flosculos estaõ hum tanto distantes entre si: semicircular (dimidiatus ) , quando, os seus flosculos naõ formaõ á roda do tronco hum annel completo, mas somente metade delle. (BROTERO, Felix Avellar, 1788)","34","flosculos","flósculo","plural","flósculos","1"
"1224","Compendio1deBrotero.txt",1175,", se naõ tem involucro nem bractea alguma : basto ( confertus ) , se os <b>flosculos</b> que o compoem estaõ, approximados densamente: raleado (distans) , se os seus flosculos estaõ hum tanto distantes entre si: semicircular (dimidiatus ) , quando, os seus flosculos naõ formaõ á roda do tronco hum annel completo, mas somente metade delle. (BROTERO, Felix Avellar, 1788)","51","flosculos","flósculo","plural","flósculos","1"
"1225","Compendio1deBrotero.txt",1177,"; esta consta de muitos <b>flosculos</b> densamente conchegados em huma forma mais ou menos globular. (BROTERO, Felix Avellar, 1788)","6","flosculos","flósculo","plural","flósculos","1"
"1226","Compendio1deBrotero.txt",1179,", se tende hum tanto à forma espherica : semiglobosa (dimidiatum ) , se presenta meya cabeça , ou huma forma hemispherica, sendo bojuda de huma banda e plana da outra : folhosa (foliosum ), se he acompanhada de folhas : bracteada (bracteatum ), se he guarnecida de <b>bracteas</b> : nua ( nudum ) (BROTERO, Felix Avellar, 1788)","57","bracteas","bráctea","plural","brácteas","1"
"1227","Compendio1deBrotero.txt",1180,", se naõ tem folhas nem <b>bracteas</b>. (BROTERO, Felix Avellar, 1788)","7","bracteas","bráctea","plural","brácteas","1"
"1228","Compendio1deBrotero.txt",1182,"Flor espigosa (spicatus ) , consta de muitos <b>flosculos</b> dispostos em espiga. (BROTERO, Felix Avellar, 1788)","10","flosculos","flósculo","plural","flósculos","1"
"1229","Compendio1deBrotero.txt",1183,"A espiga (spica) he huma flor congregada, que consta de muitos <b>flosculos</b> alternos rentes ou com curtissimos pedicellos levantados. (BROTERO, Felix Avellar, 1788)","15","flosculos","flósculo","plural","flósculos","1"
"1230","Compendio1deBrotero.txt",1184,"Os seus <b>flosculos</b> saõ apegados a hum receptaculo commum oblongo , chamado carolim ou carolo ( rachis ) , como se vê na tanchagem , cevada, trigo, milho, e muitos outros grames. (BROTERO, Felix Avellar, 1788)","3","flosculos","flósculo","plural","flósculos","1"
"1231","Compendio1deBrotero.txt",1184,"Os seus flosculos saõ apegados a hum <b>receptaculo</b> commum oblongo , chamado carolim ou carolo ( rachis ) , como se vê na tanchagem , cevada, trigo, milho, e muitos outros grames. (BROTERO, Felix Avellar, 1788)","8","receptaculo","receptáculo","singular","receptáculo","1"
"1232","Compendio1deBrotero.txt",1184,"Os seus flosculos saõ apegados a hum receptaculo commum <b>oblongo</b> , chamado carolim ou carolo ( rachis ) , como se vê na tanchagem , cevada, trigo, milho, e muitos outros grames. (BROTERO, Felix Avellar, 1788)","10","oblongo","oblongo",NA,"oblongo","1"
"1233","Compendio1deBrotero.txt",1185,"A flor casulosa ( flos glumosus ) , he verdadeiramente huma especie de flor espigosa propria das gramineas, e he assim denominado pela razaõ de ser hum casulo o <b>caliz</b> commum ou particular dos seus flosculos. (BROTERO, Felix Avellar, 1788)","33","caliz","cálice","singular","cálice","1"
"1234","Compendio1deBrotero.txt",1185,"A flor casulosa ( flos glumosus ) , he verdadeiramente huma especie de flor espigosa propria das gramineas, e he assim denominado pela razaõ de ser hum casulo o caliz commum ou particular dos seus <b>flosculos</b>. (BROTERO, Felix Avellar, 1788)","40","flosculos","flósculo","plural","flósculos","1"
"1235","Compendio1deBrotero.txt",1186,"A espiga-diz se ser : simplez (simplex) , quando consta de flores solitarias , e o seu <b>receptaculo</b> commum naõ se divide em pedunculos nem receptaculos menores , que formem pequenas espigas, ( a tanchagem ). (BROTERO, Felix Avellar, 1788)","20","receptaculo","receptáculo","singular","receptáculo","1"
"1236","Compendio1deBrotero.txt",1186,"A espiga-diz se ser : simplez (simplex) , quando consta de flores solitarias , e o seu receptaculo commum naõ se divide em <b>pedunculos</b> nem receptaculos menores , que formem pequenas espigas, ( a tanchagem ). (BROTERO, Felix Avellar, 1788)","26","pedunculos","pedúnculo","plural","pedúnculos","1"
"1237","Compendio1deBrotero.txt",1186,"A espiga-diz se ser : simplez (simplex) , quando consta de flores solitarias , e o seu receptaculo commum naõ se divide em pedunculos nem <b>receptaculos</b> menores , que formem pequenas espigas, ( a tanchagem ). (BROTERO, Felix Avellar, 1788)","28","receptaculos","receptáculo","plural","receptáculos","1"
"1238","Compendio1deBrotero.txt",1187,"Composta ( composita) , quando o <b>receptaculo</b> commum se divide e lança pequenas espiguettas (spiculae, s. spicillae ) , como se vê no joyo. (BROTERO, Felix Avellar, 1788)","8","receptaculo","receptáculo","singular","receptáculo","1"
"1239","Compendio1deBrotero.txt",1189,"Disticada (disticha ) , se os seus <b>flosculos</b> ou espiguettas estaõ em dois renques oppostos (o bolebole ). (BROTERO, Felix Avellar, 1788)","9","flosculos","flósculo","plural","flósculos","1"
"1240","Compendio1deBrotero.txt",1190,"Segundina (secunda ) , quando os seus <b>flosculos</b> estaõ apegados, e virados todos para shuma so e mesma banda (nardus stricta ). (BROTERO, Felix Avellar, 1788)","9","flosculos","flósculo","plural","flósculos","1"
"1241","Compendio1deBrotero.txt",1194,"Interrompida (interrupta ) , quando o <b>pedunculo</b> commum ou receptaculo commum tem (BROTERO, Felix Avellar, 1788)","8","pedunculo","pedúnculo","singular","pedúnculo","1"
