"";"doc_id";"sentence_id";"sentence";"token_id";"token";"lemma";"misc";"orth";"sensenumber"
"99025";"DiccionariodeVandelli.txt";9796;"Estando o <b>disco</b> cheio de espinhos rijos, e picantes. (VANDELLI, Domingos, 1788)";"3";"disco";"disco";NA;"disco";"2"
"99067";"DiccionariodeVandelli.txt";9802;"Sendo a folha chéa de <b>glandulas</b>. (VANDELLI, Domingos, 1788)";"6";"glandulas";"glândula";"SpaceAfter=No";"glândulas";"1"
"99170";"DiccionariodeVandelli.txt";9813;"Esta deve observar-se em quanto ao numero, côr, duraçaõ e outros mais attributos, em que pode desferir, vg. quando a <b>bractea</b> pela sua grandeza termina o caule exprimem-se os Botanicos pelo termo de folium connatum, e naõ bracteatum. (VANDELLI, Domingos, 1788)";"27";"bractea";"bráctea";NA;"bráctea";"1"
"99274";"DiccionariodeVandelli.txt";9826;"A margem ou lado mais restricto obriga o <b>disco</b> da folha a ser concavo. (VANDELLI, Domingos, 1788)";"9";"disco";"disco";NA;"disco";"2"
"99291";"DiccionariodeVandelli.txt";9829;"Sendo o <b>disco</b> superior da folha mais elevado, ou convexo. (VANDELLI, Domingos, 1788)";"3";"disco";"disco";NA;"disco";"2"
"99340";"DiccionariodeVandelli.txt";9836;"O <b>disco</b> da folha sobe, e desce para a margem formando assim varios angulos, e muitas pregas. (VANDELLI, Domingos, 1788)";"2";"disco";"disco";NA;"disco";"2"
"99372";"DiccionariodeVandelli.txt";9839;"Subindo, e descendo o <b>disco</b> da folha convexamente até a margem. (VANDELLI, Domingos, 1788)";"6";"disco";"disco";NA;"disco";"2"
"99392";"DiccionariodeVandelli.txt";9842;"O <b>disco</b> da folha forma varias dobras obtusas, e alternadas. (VANDELLI, Domingos, 1788)";"2";"disco";"disco";NA;"disco";"2"
"99430";"DiccionariodeVandelli.txt";9845;"Folha monstruosa, pois he quando a margem da folha sahe maior do que o <b>disco</b> admitte, de maneira que a margem he as ondas. (VANDELLI, Domingos, 1788)";"18";"disco";"disco";NA;"disco";"2"
"99617";"DiccionariodeVandelli.txt";9876;"A folha he mais funda no <b>disco</b>, que nos lados. (VANDELLI, Domingos, 1788)";"8";"disco";"disco";"SpaceAfter=No";"disco";"2"
"99672";"DiccionariodeVandelli.txt";9883;"A superficie interior ou <b>disco</b> da folha elevada longitudinalmente á mesma maneira de quilha. (VANDELLI, Domingos, 1788)";"5";"disco";"disco";NA;"disco";"2"
"99829";"DiccionariodeVandelli.txt";9905;"Huma folha á maneira de sovela, cujos tres lados <b>longitudinaes</b> saõ planos. (VANDELLI, Domingos, 1788)";"11";"longitudinaes";"longitudinal";NA;"longitudinais";"1"
"99850";"DiccionariodeVandelli.txt";9909;"Tendo dous angulos <b>longitudinaes</b>, prominentes, oppostos, e o disco mais convexo. (VANDELLI, Domingos, 1788)";"4";"longitudinaes";"longitudinal";"SpaceAfter=No";"longitudinais";"1"
"99858";"DiccionariodeVandelli.txt";9909;"Tendo dous angulos longitudinaes, prominentes, oppostos, e o <b>disco</b> mais convexo. (VANDELLI, Domingos, 1788)";"12";"disco";"disco";NA;"disco";"2"
"99891";"DiccionariodeVandelli.txt";9912;"Folha linear, carnosa, obtusa, convexa pela parte infernior, e a sua margem muitas vezes he <b>cartilaginea</b>. (VANDELLI, Domingos, 1788)";"21";"cartilaginea";"cartilagíneo";"SpaceAfter=No";"cartilagínea";"1"
"100159";"DiccionariodeVandelli.txt";9948;"— 4. <b>Perenne</b>. (VANDELLI, Domingos, 1788)";"4";"Perenne";"perene";"SpaceAfter=No";"Perene";"1"
"100223";"DiccionariodeVandelli.txt";9956;"Nesta parte deve-se attender a muitas folhas postas em hum só <b>peciolo</b> conforme a sua estructura, ou gráos. (VANDELLI, Domingos, 1788)";"14";"peciolo";"pecíolo";NA;"pecíolo";"1"
"100252";"DiccionariodeVandelli.txt";9959;"Quando o <b>peciolo</b> simples, e sem ser dividido sustenta huma só folha. (VANDELLI, Domingos, 1788)";"3";"peciolo";"pecíolo";NA;"pecíolo";"1"
"100281";"DiccionariodeVandelli.txt";9962;"Folha composta de outras tantas pequenas folhas postas no <b>peciolo</b> commum, ou simples. (VANDELLI, Domingos, 1788)";"11";"peciolo";"pecíolo";NA;"pecíolo";"1"
"100363";"DiccionariodeVandelli.txt";9970;"As partes da folha das folhas compostas, saõ as pequenas folhas, e pinnas, e os <b>peciolos</b> maiores, ou principaes. (VANDELLI, Domingos, 1788)";"21";"peciolos";"pecíolo";NA;"pecíolos";"1"
"100376";"DiccionariodeVandelli.txt";9973;"O <b>peciolo</b> simples une de hum, e outro lado huma unica, e pequena folha pinnata. (VANDELLI, Domingos, 1788)";"2";"peciolo";"pecíolo";NA;"pecíolo";"1"
"100407";"DiccionariodeVandelli.txt";9978;"O <b>peciolo</b> simples une no seu apice muitas pequenas folhas distintas entre si. (VANDELLI, Domingos, 1788)";"2";"peciolo";"pecíolo";NA;"pecíolo";"1"
"100462";"DiccionariodeVandelli.txt";9985;"Fig. 64. 65. com pequenas folhas, postas na extremidade do <b>peciolo</b>. (VANDELLI, Domingos, 1788)";"15";"peciolo";"pecíolo";"SpaceAfter=No";"pecíolo";"1"
"100495";"DiccionariodeVandelli.txt";9992;"O <b>peciolo</b> se divide em duas partes, e sustenta no lado interior muito pequenas folhas. (VANDELLI, Domingos, 1788)";"2";"peciolo";"pecíolo";NA;"pecíolo";"1"
"100563";"DiccionariodeVandelli.txt";10000;"Hum <b>peciolo</b> simples une em cada lado muitas folhas pequenas á maneira de penna. (VANDELLI, Domingos, 1788)";"2";"peciolo";"pecíolo";NA;"pecíolo";"1"
"100689";"DiccionariodeVandelli.txt";10019;"As pequenas folha se achaõ oppostas em cada lado do <b>peciolo</b>. (VANDELLI, Domingos, 1788)";"12";"peciolo";"pecíolo";"SpaceAfter=No";"pecíolo";"1"
"100729";"DiccionariodeVandelli.txt";10025;"O <b>peciolo</b> consta de pequenas folhas interrompidas com outras menores, que alternaõ as maiores. (VANDELLI, Domingos, 1788)";"2";"peciolo";"pecíolo";NA;"pecíolo";"1"
"100762";"DiccionariodeVandelli.txt";10028;"As pequenas folhas descem com a sua base pelo <b>peciolo</b>. (VANDELLI, Domingos, 1788)";"11";"peciolo";"pecíolo";"SpaceAfter=No";"pecíolo";"1"
"100781";"DiccionariodeVandelli.txt";10031;"Varias folhas pequenas nascem de algumas articulaçoens do <b>peciolo</b>. (VANDELLI, Domingos, 1788)";"10";"peciolo";"pecíolo";"SpaceAfter=No";"pecíolo";"1"
"100793";"DiccionariodeVandelli.txt";10035;"O <b>peciolo</b> commum dividi-se em dous, e sustenta muitas folhas. (VANDELLI, Domingos, 1788)";"2";"peciolo";"pecíolo";NA;"pecíolo";"1"
"100815";"DiccionariodeVandelli.txt";10038;"Sendo o <b>peciolo</b> chêo de varias excrescencias de folhas que parecem azas. (VANDELLI, Domingos, 1788)";"3";"peciolo";"pecíolo";NA;"pecíolo";"1"
"100838";"DiccionariodeVandelli.txt";10040;"Considerada a folha em quanto á subdivisaõ do <b>peciolo</b>, ou pésinho commum. (VANDELLI, Domingos, 1788)";"10";"peciolo";"pecíolo";"SpaceAfter=No";"pecíolo";"1"
"100848";"DiccionariodeVandelli.txt";10042;"O <b>peciolo</b> commum huma vez dividido une varias pequenas folhas. (VANDELLI, Domingos, 1788)";"2";"peciolo";"pecíolo";NA;"pecíolo";"1"
"100867";"DiccionariodeVandelli.txt";10045;"O <b>peciolo</b> dividido em dous une nas suas pontas quatro pequenas folhas. (VANDELLI, Domingos, 1788)";"2";"peciolo";"pecíolo";NA;"pecíolo";"1"
"100890";"DiccionariodeVandelli.txt";10048;"O <b>peciolo</b>, ou pésinho sustenta tres pequenas folhas, e cada huma dividida em tres. (VANDELLI, Domingos, 1788)";"2";"peciolo";"pecíolo";"SpaceAfter=No";"pecíolo";"1"
"100922";"DiccionariodeVandelli.txt";10053;"O <b>peciolo</b> nos seus lados une pequenas folhas pinnatas. (VANDELLI, Domingos, 1788)";"2";"peciolo";"pecíolo";NA;"pecíolo";"1"
"100947";"DiccionariodeVandelli.txt";10058;"O <b>peciolo</b> dividido varias vezes mais, que duas, contem muitas pequenas folhas. (VANDELLI, Domingos, 1788)";"2";"peciolo";"pecíolo";NA;"pecíolo";"1"
"101001";"DiccionariodeVandelli.txt";10061;"Dividido o pésinho em tres partes sustenta nos apices quatro pequenas folhas, em cada lado do apice duras, e na divisaõ do <b>peciolo</b> commum outras duas. (VANDELLI, Domingos, 1788)";"29";"peciolo";"pecíolo";NA;"pecíolo";"1"
"101018";"DiccionariodeVandelli.txt";10064;"Dividindo-se o <b>peciolo</b> em tres, subdivide-se ainda cada divisaõ em outras tres partes, e cada huma tem tres pequenas folhas. (VANDELLI, Domingos, 1788)";"4";"peciolo";"pecíolo";NA;"pecíolo";"1"
"101054";"DiccionariodeVandelli.txt";10068;"Sustentando o <b>peciolo</b> varias pequenas folhas bipinnatas. (VANDELLI, Domingos, 1788)";"3";"peciolo";"pecíolo";NA;"pecíolo";"1"
"101061";"DiccionariodeVandelli.txt";10069;"O <b>peciolo</b> se divide em tres antes, que receba as pequenas folhas. (VANDELLI, Domingos, 1788)";"2";"peciolo";"pecíolo";NA;"pecíolo";"1"
"101083";"DiccionariodeVandelli.txt";10073;"Sustentando <b>peciolo</b> folhas tripinnatas no numero porém desiguaes. (VANDELLI, Domingos, 1788)";"2";"peciolo";"pecíolo";NA;"pecíolo";"1"
"101139";"DiccionariodeVandelli.txt";10078;"Petiolus, Stipulae, Cirrhus, Pubes, Arma, <b>Bractea</b>, Penduculus. (VANDELLI, Domingos, 1788)";"11";"Bractea";"bráctea";"SpaceAfter=No";"Bráctea";"1"
"101148";"DiccionariodeVandelli.txt";10080;"Pésinho, ou <b>peciolo</b> he huma especie de tronco, que une, e eleva a folha, e naõ a fructificaçaõ. (VANDELLI, Domingos, 1788)";"4";"peciolo";"pecíolo";NA;"pecíolo";"1"
"101166";"DiccionariodeVandelli.txt";10080;"Pésinho, ou peciolo he huma especie de tronco, que une, e eleva a folha, e naõ a <b>fructificaçaõ</b>. (VANDELLI, Domingos, 1788)";"22";"fructificaçaõ";"frutificação";"SpaceAfter=No";"frutificação";"1"
"101290";"DiccionariodeVandelli.txt";10098;"Com tres lados, excavando com regos <b>longitudinaes</b>. (VANDELLI, Domingos, 1788)";"8";"longitudinaes";"longitudinal";"SpaceAfter=No";"longitudinais";"1"
"101327";"DiccionariodeVandelli.txt";10102;"O comprimento da folha excede muitas vezes o do <b>peciolo</b>, ou que o peciolo está muito longe para chegar ao comprimento da folha. (VANDELLI, Domingos, 1788)";"12";"peciolo";"pecíolo";"SpaceAfter=No";"pecíolo";"1"
"101332";"DiccionariodeVandelli.txt";10102;"O comprimento da folha excede muitas vezes o do <b>peciolo</b>, ou que o peciolo está muito longe para chegar ao comprimento da folha. (VANDELLI, Domingos, 1788)";"17";"peciolo";"pecíolo";NA;"pecíolo";"1"
"101478";"DiccionariodeVandelli.txt";10119;"Quando está unido com a sua base mais larga; de tal modo, que sem se quebrar, ou dilacerar a <b>epiderme</b> do caule naõ se possa dividir. (VANDELLI, Domingos, 1788)";"23";"epiderme";"epiderme";NA;"epiderme";"1"
"101511";"DiccionariodeVandelli.txt";10125;"Sendo o <b>peciolo</b> acrescentado com alguma cousa, ou com folhos de folhas na base. (VANDELLI, Domingos, 1788)";"3";"peciolo";"pecíolo";NA;"pecíolo";"1"
"101614";"DiccionariodeVandelli.txt";10146;"b. Saõ humas escamas, que nascem nas bases dos <b>peciolos</b>, ou pedunculos em hum, e outro lado. (VANDELLI, Domingos, 1788)";"14";"peciolos";"pecíolo";"SpaceAfter=No";"pecíolos";"1"
"101617";"DiccionariodeVandelli.txt";10146;"b. Saõ humas escamas, que nascem nas bases dos peciolos, ou <b>pedunculos</b> em hum, e outro lado. (VANDELLI, Domingos, 1788)";"17";"pedunculos";"pedúnculo";NA;"pedúnculos";"1"
"101695";"DiccionariodeVandelli.txt";10160;"Que estaõ nas <b>Papilionaceas</b>, e na Icosandria. (VANDELLI, Domingos, 1788)";"5";"Papilionaceas";"papilionáceo";"SpaceAfter=No";"Papilionáceas";"1"
"101710";"DiccionariodeVandelli.txt";10163;"As <b>estipulas</b> nascem nos lados do peciolo, ou pedunculo. (VANDELLI, Domingos, 1788)";"2";"estipulas";"estípula";NA;"estípulas";"1"
"101719";"DiccionariodeVandelli.txt";10163;"As estipulas nascem nos lados do <b>peciolo</b>, ou pedunculo. (VANDELLI, Domingos, 1788)";"9";"peciolo";"pecíolo";"SpaceAfter=No";"pecíolo";"1"
"101722";"DiccionariodeVandelli.txt";10163;"As estipulas nascem nos lados do peciolo, ou <b>pedunculo</b>. (VANDELLI, Domingos, 1788)";"12";"pedunculo";"pedúnculo";"SpaceAfter=No";"pedúnculo";"1"
"101729";"DiccionariodeVandelli.txt";10165;"Existindo as <b>estipulas</b> no principio da folha, entre o peciolo, e a mesma folha. (VANDELLI, Domingos, 1788)";"3";"estipulas";"estípula";NA;"estípulas";"1"
"101741";"DiccionariodeVandelli.txt";10165;"Existindo as estipulas no principio da folha, entre o <b>peciolo</b>, e a mesma folha. (VANDELLI, Domingos, 1788)";"13";"peciolo";"pecíolo";"SpaceAfter=No";"pecíolo";"1"
"101783";"DiccionariodeVandelli.txt";10171;"Sendo unidas aos <b>peciolos</b> das folhas oppostas á situaçaõ das folhas. (VANDELLI, Domingos, 1788)";"5";"peciolos";"pecíolo";NA;"pecíolos";"1"
"101983";"DiccionariodeVandelli.txt";10218;"Respectivamente ao <b>peciolo</b>, ou á folha: ou ao pedunculo, faltando o peciolo. (64). (VANDELLI, Domingos, 1788)";"4";"peciolo";"pecíolo";"SpaceAfter=No";"pecíolo";"1"
"101993";"DiccionariodeVandelli.txt";10218;"Respectivamente ao peciolo, ou á folha: ou ao <b>pedunculo</b>, faltando o peciolo. (64). (VANDELLI, Domingos, 1788)";"13";"pedunculo";"pedúnculo";"SpaceAfter=No";"pedúnculo";"1"
"101997";"DiccionariodeVandelli.txt";10218;"Respectivamente ao <b>peciolo</b>, ou á folha: ou ao pedunculo, faltando o peciolo. (64). (VANDELLI, Domingos, 1788)";"17";"peciolo";"pecíolo";"SpaceAfter=No";"pecíolo";"1"
"102114";"DiccionariodeVandelli.txt";10234;"No <b>peciolo</b>. (VANDELLI, Domingos, 1788)";"3";"peciolo";"pecíolo";"SpaceAfter=No";"pecíolo";"1"
"102122";"DiccionariodeVandelli.txt";10236;"No <b>pedunculo</b>. (VANDELLI, Domingos, 1788)";"3";"pedunculo";"pedúnculo";"SpaceAfter=No";"pedúnculo";"1"
"102318";"DiccionariodeVandelli.txt";10262;"Excrescencia <b>pillosa</b>, parallela, comprida; unida em feixe á maneira de barba de cabra; os pellos saõ estendidos rectamente. (VANDELLI, Domingos, 1788)";"2";"pillosa";"piloso";"SpaceAfter=No";"pilosa";"1"
"102345";"DiccionariodeVandelli.txt";10264;"Excrescencia formada de <b>villos</b> entretecidos, e que apenas apparecem; serve para defender as plantas dos ventos. (VANDELLI, Domingos, 1788)";"4";"villos";"vilo";NA;"vilos";"1"
"102381";"DiccionariodeVandelli.txt";10268;"<b>Villo</b> he huma excrescencia pillosa, porém muito mais tenra. (VANDELLI, Domingos, 1788)";"1";"Villo";"vilo";NA;"Vilo";"1"
"102385";"DiccionariodeVandelli.txt";10268;"Villo he huma excrescencia <b>pillosa</b>, porém muito mais tenra. (VANDELLI, Domingos, 1788)";"5";"pillosa";"piloso";"SpaceAfter=No";"pilosa";"1"
"102675";"DiccionariodeVandelli.txt";10304;"Na base dos <b>estames</b> ou filamentos. (VANDELLI, Domingos, 1788)";"6";"estames";"estame";NA;"estames";"1"
"102677";"DiccionariodeVandelli.txt";10304;"Na base dos estames ou <b>filamentos</b>. (VANDELLI, Domingos, 1788)";"8";"filamentos";"filamento";"SpaceAfter=No";"filamentos";"1"
"102736";"DiccionariodeVandelli.txt";10319;"c. <b>Glandulas</b> postas nas folhas: nas incisoens Salix, na base Amygdalus communis, na superficie superior da folha, Tamarix, na superficie inferior, Pinguicula. (VANDELLI, Domingos, 1788)";"2";"Glandulas";"glândula";NA;"Glândulas";"1"
"102794";"DiccionariodeVandelli.txt";10325;"Nos <b>peciolos</b>. (VANDELLI, Domingos, 1788)";"3";"peciolos";"pecíolo";"SpaceAfter=No";"pecíolos";"1"
"102805";"DiccionariodeVandelli.txt";10328;"Nos <b>pedunculos</b>. (VANDELLI, Domingos, 1788)";"3";"pedunculos";"pedúnculo";"SpaceAfter=No";"pedúnculos";"1"
"102813";"DiccionariodeVandelli.txt";10330;"Nas <b>estipulas</b>. (VANDELLI, Domingos, 1788)";"3";"estipulas";"estípula";"SpaceAfter=No";"estípulas";"1"
"102889";"DiccionariodeVandelli.txt";10341;"Gemmae os <b>gomos</b>, ou gemas das folhas principalmente das plantas rezinosas. (VANDELLI, Domingos, 1788)";"3";"gomos";"gomo";"SpaceAfter=No";"gomos";"1"
"102892";"DiccionariodeVandelli.txt";10341;"Gemmae os gomos, ou <b>gemas</b> das folhas principalmente das plantas rezinosas. (VANDELLI, Domingos, 1788)";"6";"gemas";"gema";NA;"gemas";"1"
"102902";"DiccionariodeVandelli.txt";10341;"Gemmae os gomos, ou gemas das folhas principalmente das plantas <b>rezinosas</b>. (VANDELLI, Domingos, 1788)";"14";"rezinosas";"resinoso";"SpaceAfter=No";"resinosas";"1"
"102907";"DiccionariodeVandelli.txt";10343;"<b>Resina</b>. (VANDELLI, Domingos, 1788)";"1";"Resina";"resina";"SpaceAfter=No";"Resina";"1"
"102910";"DiccionariodeVandelli.txt";10344;"A <b>rezina</b> he dissoluvel no espirito de vinho, arde no fogo. (VANDELLI, Domingos, 1788)";"2";"rezina";"resina";NA;"resina";"1"
"102972";"DiccionariodeVandelli.txt";10350;"He huma mistura de goma, e <b>rezina</b>, e assim parte della dissolve-se em agua, e parte no espirito de vinho. (VANDELLI, Domingos, 1788)";"8";"rezina";"resina";"SpaceAfter=No";"resina";"1"
"103202";"DiccionariodeVandelli.txt";10383;"Calycis do <b>caliz</b>. (VANDELLI, Domingos, 1788)";"4";"caliz";"cálice";"SpaceAfter=No";"cálice";"1"
"103246";"DiccionariodeVandelli.txt";10391;"No <b>caliz</b>, nas suas lacinias, ou pequenas folhas. (VANDELLI, Domingos, 1788)";"3";"caliz";"cálice";"SpaceAfter=No";"cálice";"1"
"103252";"DiccionariodeVandelli.txt";10391;"No caliz, nas suas <b>lacinias</b>, ou pequenas folhas. (VANDELLI, Domingos, 1788)";"8";"lacinias";"lacínia";"SpaceAfter=No";"lacínias";"1"
"103351";"DiccionariodeVandelli.txt";10407;"Tilia europaea, Salvis, Fumaria <b>bulbosa</b>, Horminium. (VANDELLI, Domingos, 1788)";"7";"bulbosa";"bulboso";"SpaceAfter=No";"bulbosa";"1"
"103464";"DiccionariodeVandelli.txt";10425;"He hum tronco parcial, que levanta a <b>frutificaçaõ</b>, e naõ as folhas. (VANDELLI, Domingos, 1788)";"9";"frutificaçaõ";"frutificação";"SpaceAfter=No";"frutificação";"1"
"103489";"DiccionariodeVandelli.txt";10428;"Que sustenta quasi sempre huma só <b>frutificação</b>. (VANDELLI, Domingos, 1788)";"7";"frutificação";"frutificação";"SpaceAfter=No";"frutificação";"1"
"103501";"DiccionariodeVandelli.txt";10430;"b. ou que sahe de outro <b>pedunculo</b> comum. (VANDELLI, Domingos, 1788)";"8";"pedunculo";"pedúnculo";NA;"pedúnculo";"1"
"103506";"DiccionariodeVandelli.txt";10432;"<b>Pedunculo</b>, que sahe immediatamente da (VANDELLI, Domingos, 1788)";"1";"Pedunculo";"pedúnculo";"SpaceAfter=No";"Pedúnculo";"1"
"103537";"DiccionariodeVandelli.txt";10438;"<b>Pedunculo</b>, que sustenta muitas frutificações, que he commum a muitas flores. (VANDELLI, Domingos, 1788)";"1";"Pedunculo";"pedúnculo";"SpaceAfter=No";"Pedúnculo";"1"
"103542";"DiccionariodeVandelli.txt";10438;"Pedunculo, que sustenta muitas <b>frutificações</b>, que he commum a muitas flores. (VANDELLI, Domingos, 1788)";"6";"frutificações";"frutificação";"SpaceAfter=No";"frutificações";"1"
"103592";"DiccionariodeVandelli.txt";10448;"Sahe do <b>peciolo</b>. (VANDELLI, Domingos, 1788)";"4";"peciolo";"pecíolo";"SpaceAfter=No";"pecíolo";"1"
"103841";"DiccionariodeVandelli.txt";10495;"Muitos <b>pedunculos</b> sahem do mesmo ponto sem intermedio algum, e formaõ huma circunferencia igual. (VANDELLI, Domingos, 1788)";"2";"pedunculos";"pedúnculo";NA;"pedúnculos";"1"
"103880";"DiccionariodeVandelli.txt";10501;"Estando varios <b>pedunculos</b> pouco distantes entre si na base, e quasi parallelos. (VANDELLI, Domingos, 1788)";"3";"pedunculos";"pedúnculo";NA;"pedúnculos";"1"
"103898";"DiccionariodeVandelli.txt";10503;"Muitos <b>pedunculos</b>, que sahem do mesmo lugar, estaõ muito desunidos entre si, ou saõ divergentes. (VANDELLI, Domingos, 1788)";"2";"pedunculos";"pedúnculo";"SpaceAfter=No";"pedúnculos";"1"
"103953";"DiccionariodeVandelli.txt";10505;"O apice se arquea de maneira que a flor está como cahindo, ou pendente para hum lado, nem se póde elevar por causa da curvatura do <b>pedunculo</b>. (VANDELLI, Domingos, 1788)";"31";"pedunculo";"pedúnculo";"SpaceAfter=No";"pedúnculo";"1"
"104206";"DiccionariodeVandelli.txt";10551;"Sem <b>bracteas</b>, folhas, escamas, ou buço. (VANDELLI, Domingos, 1788)";"2";"bracteas";"bráctea";"SpaceAfter=No";"brácteas";"1"
"104238";"DiccionariodeVandelli.txt";10558;"(81) Com <b>bracteas</b>. (VANDELLI, Domingos, 1788)";"5";"bracteas";"bráctea";"SpaceAfter=No";"brácteas";"1"
"104281";"DiccionariodeVandelli.txt";10568;"He o modo com que as flores estaõ unidas á planta por meio do <b>pedunculo</b>. (VANDELLI, Domingos, 1788)";"16";"pedunculo";"pedúnculo";"SpaceAfter=No";"pedúnculo";"1"
"104289";"DiccionariodeVandelli.txt";10570;"Parte filamentosa, e <b>membranacea</b>, primeira que o fruto, e conhecida pela elegancia das suas cores. (VANDELLI, Domingos, 1788)";"5";"membranacea";"membranáceo";"SpaceAfter=No";"membranácea";"1"
"104314";"DiccionariodeVandelli.txt";10571;"Consta de Calix, Corolla, <b>Estames</b>, Pistillo, Pericarpio, Semente, Receptaculo. (VANDELLI, Domingos, 1788)";"7";"Estames";"estame";"SpaceAfter=No";"Estames";"1"
"104316";"DiccionariodeVandelli.txt";10571;"Consta de Calix, Corolla, Estames, <b>Pistillo</b>, Pericarpio, Semente, Receptaculo. (VANDELLI, Domingos, 1788)";"9";"Pistillo";"pistilo";"SpaceAfter=No";"Pistilo";"1"
"104322";"DiccionariodeVandelli.txt";10571;"Consta de Calix, Corolla, Estames, Pistillo, Pericarpio, Semente, <b>Receptaculo</b>. (VANDELLI, Domingos, 1788)";"15";"Receptaculo";"receptáculo";"SpaceAfter=No";"Receptáculo";"1"
"104358";"DiccionariodeVandelli.txt";10574;"A essencia da <b>frutificaçaõ</b> consiste na flor, e fruto. (VANDELLI, Domingos, 1788)";"5";"frutificaçaõ";"frutificação";NA;"frutificação";"1"
"104378";"DiccionariodeVandelli.txt";10575;"A essencia dos vegetaes consiste na <b>frutificaçaõ</b>. (VANDELLI, Domingos, 1788)";"9";"frutificaçaõ";"frutificação";"SpaceAfter=No";"frutificação";"1"
"104381";"DiccionariodeVandelli.txt";10576;"A <b>frutificaçaõ</b> inclue-se na <i>Anthera</i>, <i>Estigma</i>, e <i>Semente</i>. (VANDELLI, Domingos, 1788)";"2";"frutificaçaõ";"frutificação";NA;"frutificação";"1"
"104459";"DiccionariodeVandelli.txt";10591;"Sem <b>pedunculo</b>. (VANDELLI, Domingos, 1788)";"2";"pedunculo";"pedúnculo";"SpaceAfter=No";"pedúnculo";"1"
"104610";"DiccionariodeVandelli.txt";10617;"He formada de muitas flores quasi sesseis, ou quasi sem <b>pedunculos</b>: he huma coroa, que cerca o caule á maneira de anel. (VANDELLI, Domingos, 1788)";"12";"pedunculos";"pedúnculo";"SpaceAfter=No";"pedúnculos";"1"
"104636";"DiccionariodeVandelli.txt";10619;"Sendo as pequenas flores sem <b>pedunculos</b> visiveis. (VANDELLI, Domingos, 1788)";"6";"pedunculos";"pedúnculo";NA;"pedúnculos";"1"
"104648";"DiccionariodeVandelli.txt";10622;"Tendo as flores <b>pedunculos</b>. (VANDELLI, Domingos, 1788)";"4";"pedunculos";"pedúnculo";"SpaceAfter=No";"pedúnculos";"1"
"104659";"DiccionariodeVandelli.txt";10624;"Sem involucros: ou <b>bracteas</b>. (VANDELLI, Domingos, 1788)";"5";"bracteas";"bráctea";"SpaceAfter=No";"brácteas";"1"
"104666";"DiccionariodeVandelli.txt";10627;"Com <b>bracteas</b>. (VANDELLI, Domingos, 1788)";"2";"bracteas";"bráctea";"SpaceAfter=No";"brácteas";"1"
"104701";"DiccionariodeVandelli.txt";10633;"Formado de muitas pequenas flore espessas, e muito unidas, ou com <b>pedunculos</b> muito visinhos. (VANDELLI, Domingos, 1788)";"14";"pedunculos";"pedúnculo";NA;"pedúnculos";"1"
"104710";"DiccionariodeVandelli.txt";10635;"Com os <b>pedunculos</b> distantes. (VANDELLI, Domingos, 1788)";"3";"pedunculos";"pedúnculo";NA;"pedúnculos";"1"
"104836";"DiccionariodeVandelli.txt";10656;"He formada de flores Sessiles, ou sem <b>pedunculo</b> commum simples. (VANDELLI, Domingos, 1788)";"9";"pedunculo";"pedúnculo";NA;"pedúnculo";"1"
"104904";"DiccionariodeVandelli.txt";10665;"Flores solitarias estaõ pegadas em hum, e mesmo <b>pedunculo</b>, e assim a espiga naõ está dividida. (VANDELLI, Domingos, 1788)";"10";"pedunculo";"pedúnculo";"SpaceAfter=No";"pedúnculo";"1"
"104928";"DiccionariodeVandelli.txt";10667;"Formada de muitas espigas pequenas pegadas por meio de hum pequeno <b>pedunculo</b> (VANDELLI, Domingos, 1788)";"12";"pedunculo";"pedúnculo";"SpacesAfter=\n";"pedúnculo";"1"
"104936";"DiccionariodeVandelli.txt";10669;"ao <b>pedunculo</b> commum, que está dividido em varias partes. (VANDELLI, Domingos, 1788)";"3";"pedunculo";"pedúnculo";NA;"pedúnculo";"1"
"105124";"DiccionariodeVandelli.txt";10694;"— <b>Foliacea</b>. (VANDELLI, Domingos, 1788)";"2";"Foliacea";"foliáceo";"SpaceAfter=No";"Foliácea";"1"
"105169";"DiccionariodeVandelli.txt";10701;"Faz-se da espiga, quando cada huma das flores tem <b>pedunculos</b> proprios compridos, mas elevados com proporçaõ fazendo a figura de maça. (VANDELLI, Domingos, 1788)";"14";"pedunculos";"pedúnculo";NA;"pedúnculos";"1"
"105194";"DiccionariodeVandelli.txt";10705;"Os <b>pedunculos</b> são inteiros, sem divisaõ. (VANDELLI, Domingos, 1788)";"2";"pedunculos";"pedúnculo";NA;"pedúnculos";"1"
"105206";"DiccionariodeVandelli.txt";10707;"Os primeiros <b>pedunculos</b> estão (VANDELLI, Domingos, 1788)";"3";"pedunculos";"pedúnculo";NA;"pedúnculos";"1"
"105268";"DiccionariodeVandelli.txt";10721;"Cacho, he formado de hum <b>pedunculo</b>, que tem ramos lateraes pequenos. (VANDELLI, Domingos, 1788)";"7";"pedunculo";"pedúnculo";"SpaceAfter=No";"pedúnculo";"1"
"105291";"DiccionariodeVandelli.txt";10724;"Com o <b>pedunculo</b>, e os ramos, que naõ estaõ divididos. (VANDELLI, Domingos, 1788)";"3";"pedunculo";"pedúnculo";"SpaceAfter=No";"pedúnculo";"1"
"105307";"DiccionariodeVandelli.txt";10726;"Com o <b>pedunculo</b>, e os ramos divididos em muitas partes. (VANDELLI, Domingos, 1788)";"3";"pedunculo";"pedúnculo";"SpaceAfter=No";"pedúnculo";"1"
"105331";"DiccionariodeVandelli.txt";10730;"Com os pequenos <b>pedunculos</b>, ou com as flores pegadas sómente em hum lado (VANDELLI, Domingos, 1788)";"4";"pedunculos";"pedúnculo";"SpaceAfter=No";"pedúnculos";"1"
"105352";"DiccionariodeVandelli.txt";10732;"Os pesinhos, pedicelli, ou pequenos <b>pedunculos</b> revirados todos para hum lado. (VANDELLI, Domingos, 1788)";"8";"pedunculos";"pedúnculo";NA;"pedúnculos";"1"
"105362";"DiccionariodeVandelli.txt";10734;"<b>Pedunculo</b> commum sustenta racemos pequenos como o folium pedatum. (VANDELLI, Domingos, 1788)";"1";"Pedunculo";"pedúnculo";NA;"Pedúnculo";"1"
