"","doc_id","sentence_id","sentence","token_id","token","lemma","misc","orth","sensenumber"
"721","DiccionariodeVandelli.txt",12171,"De substancia callosa, ou <b>cartilaginea</b>. (VANDELLI, Domingos, 1788)","6","cartilaginea","cartilagíneo","feminino singular","cartilagínea","1"
"722","DiccionariodeVandelli.txt",12175,"He o <b>caliz</b> pegado á summidade da semente, cujo caliz he o da flor, por meio do qual o vento a faz voar. (VANDELLI, Domingos, 1788)","3","caliz","cálice","singular","cálice","1"
"723","DiccionariodeVandelli.txt",12175,"He o <b>caliz</b> pegado á summidade da semente, cujo caliz he o da flor, por meio do qual o vento a faz voar. (VANDELLI, Domingos, 1788)","12","caliz","cálice","singular","cálice","1"
"724","DiccionariodeVandelli.txt",12233,"No <b>caliz</b>. (VANDELLI, Domingos, 1788)","3","caliz","cálice","singular","cálice","1"
"725","DiccionariodeVandelli.txt",12260,"He a semente dos musgos sem arillo, e sem <b>cotyledones</b>. (VANDELLI, Domingos, 1788)","12","cotyledones","cotilédone","plural","cotilédones","1"
"726","DiccionariodeVandelli.txt",12263,"He o leito, ou placenta, ou base, em que estaõ pegadas as partes da <b>frutificaçaõ</b> (104). (VANDELLI, Domingos, 1788)","19","frutificaçaõ","frutificação","singular","frutificação","1"
"727","DiccionariodeVandelli.txt",12264,"O <b>receptaculo</b> cerca internamente as paredes do caliz na classe Icosandria, e em algumas outras plantas; e assim a corolla, e os filamentos estaõ pegados ao caliz. (VANDELLI, Domingos, 1788)","2","receptaculo","receptáculo","singular","receptáculo","1"
"728","DiccionariodeVandelli.txt",12264,"O receptaculo cerca internamente as paredes do <b>caliz</b> na classe Icosandria, e em algumas outras plantas; e assim a corolla, e os filamentos estaõ pegados ao caliz. (VANDELLI, Domingos, 1788)","9","caliz","cálice","singular","cálice","1"
"729","DiccionariodeVandelli.txt",12264,"O receptaculo cerca internamente as paredes do caliz na classe Icosandria, e em algumas outras plantas; e assim a corolla, e os <b>filamentos</b> estaõ pegados ao caliz. (VANDELLI, Domingos, 1788)","28","filamentos","filamento","plural","filamentos","1"
"730","DiccionariodeVandelli.txt",12264,"O receptaculo cerca internamente as paredes do <b>caliz</b> na classe Icosandria, e em algumas outras plantas; e assim a corolla, e os filamentos estaõ pegados ao caliz. (VANDELLI, Domingos, 1788)","33","caliz","cálice","singular","cálice","1"
"731","DiccionariodeVandelli.txt",12268,"He o <b>receptaculo</b> nas flores compostas. (VANDELLI, Domingos, 1788)","3","receptaculo","receptáculo","singular","receptáculo","1"
"732","DiccionariodeVandelli.txt",12270,"Particular a huma só <b>frutificaçaõ</b>. (VANDELLI, Domingos, 1788)","5","frutificaçaõ","frutificação","singular","frutificação","1"
"733","DiccionariodeVandelli.txt",12272,"<b>Receptaculo</b> commum á flor, e ao fruto. (VANDELLI, Domingos, 1788)","1","Receptaculo","receptáculo","singular","Receptáculo","1"
"734","DiccionariodeVandelli.txt",12276,"A base do fruto distante da base, ou <b>receptaculo</b> da for. (VANDELLI, Domingos, 1788)","12","receptaculo","receptáculo","singular","receptáculo","1"
"735","DiccionariodeVandelli.txt",12287,"Quando sustenta, e une muitos <b>flosculos</b>, e os seus frutos de tal modo, que tirados alguns se produz irregularidade. (VANDELLI, Domingos, 1788)","7","flosculos","flósculo","plural","flósculos","1"
"736","DiccionariodeVandelli.txt",12290,"Sem pellos, sedas, <b>villos</b>, palhas &c. Leontodon. (VANDELLI, Domingos, 1788)","6","villos","vilo","plural","vilos","1"
"737","DiccionariodeVandelli.txt",12301,"Cuberto de <b>villos</b> (79). (VANDELLI, Domingos, 1788)","3","villos","vilo","plural","vilos","1"
"738","DiccionariodeVandelli.txt",12313,"b. Com palhas, ou lamellas postas perpendicularmente, que dividem os <b>flosculos</b> entre si. (VANDELLI, Domingos, 1788)","14","flosculos","flósculo","plural","flósculos","1"
"739","DiccionariodeVandelli.txt",12332,"<b>Receptaculo</b> estendido, convexo, commum a muitas pequenas flores monopetatas, com as antheras unidas em cylindro. (VANDELLI, Domingos, 1788)","1","Receptaculo","receptáculo","singular","Receptáculo","1"
"740","DiccionariodeVandelli.txt",12332,"Receptaculo estendido, convexo, commum a muitas pequenas flores monopetatas, com as <b>antheras</b> unidas em cylindro. (VANDELLI, Domingos, 1788)","15","antheras","antera","plural","anteras","1"
"741","DiccionariodeVandelli.txt",12340,"As pequenas corollas do <b>disco</b> saõ tubulosas, e as da circunferencia liguladas, ou com o limbo desigual, e sahido muito para fora. (VANDELLI, Domingos, 1788)","6","disco","disco",NA,"disco","1"
"742","DiccionariodeVandelli.txt",12343,"A flor composta radiada consta de <b>disco</b> e raio. (VANDELLI, Domingos, 1788)","7","disco","disco",NA,"disco","1"
"743","DiccionariodeVandelli.txt",12347,"A superficie, ou centro da flor, consta de pequenas corollas quasi sempre regulares: na fior composta he a parte do meio, que acaba, ou que vem cercada com a margem do <b>caliz</b>. (VANDELLI, Domingos, 1788)","41","caliz","cálice","singular","cálice","1"
"744","DiccionariodeVandelli.txt",12349,"Flor composta de flores compostas; contem em hum <b>caliz</b> commum calices menores, que saõ communs a muitas flores. (VANDELLI, Domingos, 1788)","10","caliz","cálice","singular","cálice","1"
"745","DiccionariodeVandelli.txt",12349,"Flor composta de flores compostas; contem em hum caliz commum <b>calices</b> menores, que saõ communs a muitas flores. (VANDELLI, Domingos, 1788)","12","calices","cálice","plural","cálices","1"
"746","DiccionariodeVandelli.txt",12352,"Flor completa, ou perfeita, consta de corolla, e <b>caliz</b>. (VANDELLI, Domingos, 1788)","12","caliz","cálice","singular","cálice","1"
"747","DiccionariodeVandelli.txt",12354,"Faltando na flor a corolla, ou o <b>caliz</b>. (VANDELLI, Domingos, 1788)","10","caliz","cálice","singular","cálice","1"
"748","DiccionariodeVandelli.txt",12358,"Flor sem <b>caliz</b>. (VANDELLI, Domingos, 1788)","3","caliz","cálice","singular","cálice","1"
"749","DiccionariodeVandelli.txt",12361,"Flor, cujo <b>receptaculo</b>, ou base larga, inteira, contem muitas pequenas flores com pequenos peciolos; porem as antheras naõ estaõ unidas entre si. (VANDELLI, Domingos, 1788)","4","receptaculo","receptáculo","singular","receptáculo","1"
"750","DiccionariodeVandelli.txt",12361,"Flor, cujo receptaculo, ou base larga, inteira, contem muitas pequenas flores com pequenos <b>peciolos</b>; porem as antheras naõ estaõ unidas entre si. (VANDELLI, Domingos, 1788)","18","peciolos","pecíolo","plural","pecíolos","1"
"751","DiccionariodeVandelli.txt",12361,"Flor, cujo receptaculo, ou base larga, inteira, contem muitas pequenas flores com pequenos peciolos; porem as <b>antheras</b> naõ estaõ unidas entre si. (VANDELLI, Domingos, 1788)","22","antheras","antera","plural","anteras","1"
"752","DiccionariodeVandelli.txt",12364,"O <b>receptaculo</b>, ou base desta fior he comprida, e delgada, e da mesma largura em todo o comprimento, e dividido com escamas (VANDELLI, Domingos, 1788)","2","receptaculo","receptáculo","singular","receptáculo","1"
"753","DiccionariodeVandelli.txt",12371,"O <b>receptaculo</b> delgado, comprido, de igual grossura; porém a sua base he huma gluma, ou especie de caliz commum. (VANDELLI, Domingos, 1788)","2","receptaculo","receptáculo","singular","receptáculo","1"
"754","DiccionariodeVandelli.txt",12371,"O receptaculo delgado, comprido, de igual grossura; porém a sua base he huma gluma, ou especie de <b>caliz</b> commum. (VANDELLI, Domingos, 1788)","22","caliz","cálice","singular","cálice","1"
"755","DiccionariodeVandelli.txt",12374,"Especie de flor, cujo <b>receptaculo</b> está dentro da Spata, e he commum a muitas pequenas flores. (VANDELLI, Domingos, 1788)","6","receptaculo","receptáculo","singular","receptáculo","1"
"756","DiccionariodeVandelli.txt",12378,"As flores dispostas em forma de umbella, o que succede, quando todos os <b>pedunculos</b> das flores sahem do mesmo centro fazendo assim huma circunferencia igual. (VANDELLI, Domingos, 1788)","16","pedunculos","pedúnculo","plural","pedúnculos","1"
"757","DiccionariodeVandelli.txt",12382,"Hum <b>receptaculo</b>, ou base commua dividida, e allongada, ou estendida em pedunculos á maneira de fios proporcionaes, os quaes todos sahem do mesmo centro, ou que sahindo todos do mesmo ponto formaõ huma circunferencia igual. (VANDELLI, Domingos, 1788)","2","receptaculo","receptáculo","singular","receptáculo","1"
"758","DiccionariodeVandelli.txt",12382,"Hum receptaculo, ou base commua dividida, e allongada, ou estendida em <b>pedunculos</b> á maneira de fios proporcionaes, os quaes todos sahem do mesmo centro, ou que sahindo todos do mesmo ponto formaõ huma circunferencia igual. (VANDELLI, Domingos, 1788)","15","pedunculos","pedúnculo","plural","pedúnculos","1"
"759","DiccionariodeVandelli.txt",12383,"Cada flor contém cinco <b>estames</b> desunidos, que cahem depois de fecundado o germe, o qual está posto debaixo da corolla: o pistillo he bifido, as sementes saõ duas, unidas entre si pela summidade. (VANDELLI, Domingos, 1788)","5","estames","estame","plural","estames","1"
"760","DiccionariodeVandelli.txt",12383,"Cada flor contém cinco estames desunidos, que cahem depois de fecundado o germe, o qual está posto debaixo da corolla: o <b>pistillo</b> he bifido, as sementes saõ duas, unidas entre si pela summidade. (VANDELLI, Domingos, 1788)","26","pistillo","pistilo","singular","pistilo","1"
"761","DiccionariodeVandelli.txt",12390,"He simples, quando o <b>receptaculo</b> he dividido em pedunculos huma só vez. (VANDELLI, Domingos, 1788)","6","receptaculo","receptáculo","singular","receptáculo","1"
"762","DiccionariodeVandelli.txt",12390,"He simples, quando o receptaculo he dividido em <b>pedunculos</b> huma só vez. (VANDELLI, Domingos, 1788)","10","pedunculos","pedúnculo","plural","pedúnculos","1"
"763","DiccionariodeVandelli.txt",12394,"Todos os <b>pedunculos</b> se subdividem no apice em outros pequenos pedunculos, ou em pequenas umbellas. (VANDELLI, Domingos, 1788)","3","pedunculos","pedúnculo","plural","pedúnculos","1"
"764","DiccionariodeVandelli.txt",12394,"Todos os <b>pedunculos</b> se subdividem no apice em outros pequenos pedunculos, ou em pequenas umbellas. (VANDELLI, Domingos, 1788)","12","pedunculos","pedúnculo","plural","pedúnculos","1"
"765","DiccionariodeVandelli.txt",12399,"a. Umbella universal, consta de <b>pedunculos</b> elevados (90), os quaes sustentaõ no apice outras pequenas umbellas. (VANDELLI, Domingos, 1788)","8","pedunculos","pedúnculo","plural","pedúnculos","1"
"766","DiccionariodeVandelli.txt",12403,"b. A pequena umbella, que está posta sobre o apice do <b>pedunculo</b> universal, ou primario. (VANDELLI, Domingos, 1788)","15","pedunculo","pedúnculo","singular","pedúnculo","1"
"767","DiccionariodeVandelli.txt",12405,"Em huma umbella simples hum ou outro <b>pedunculo</b> sahe sostendo outra pequena umbella. (VANDELLI, Domingos, 1788)","8","pedunculo","pedúnculo","singular","pedúnculo","1"
"768","DiccionariodeVandelli.txt",12410,"O <b>disco</b> ou a superficie he comprimida nos lados de maneira, que fica o meio concavo. (VANDELLI, Domingos, 1788)","2","disco","disco",NA,"disco","1"
"769","DiccionariodeVandelli.txt",12414,"Sendo o <b>disco</b>, ou a superficie elevada, formando hum segmento de esfera. (VANDELLI, Domingos, 1788)","3","disco","disco","SpaceAfter=No","disco","1"
"770","DiccionariodeVandelli.txt",12416,"Cujo <b>disco</b>, ou superficie he plana. (VANDELLI, Domingos, 1788)","2","disco","disco","SpaceAfter=No","disco","1"
"771","DiccionariodeVandelli.txt",12431,"He hum <b>receptaculo</b>, ou huma base dividida em pedunculos, dos quaes todos os primeiros sahem como na umbella da o mesmo centro; mas os segundos, ou os mais pequenos naõ sahem do mesmo centro, mas sahem sem ordem. (VANDELLI, Domingos, 1788)","3","receptaculo","receptáculo","singular","receptáculo","1"
"772","DiccionariodeVandelli.txt",12431,"He hum receptaculo, ou huma base dividida em <b>pedunculos</b>, dos quaes todos os primeiros sahem como na umbella da o mesmo centro; mas os segundos, ou os mais pequenos naõ sahem do mesmo centro, mas sahem sem ordem. (VANDELLI, Domingos, 1788)","10","pedunculos","pedúnculo","plural","pedúnculos","1"
"773","DiccionariodeVandelli.txt",12434,"Sem involucro, ou <b>bracteas</b>. (VANDELLI, Domingos, 1788)","5","bracteas","bráctea","plural","brácteas","1"
"774","DiccionariodeVandelli.txt",12437,"Com <b>bracteas</b>. (VANDELLI, Domingos, 1788)","2","bracteas","bráctea","plural","brácteas","1"
"775","DiccionariodeVandelli.txt",12452,"de o <b>receptaculo</b> da palmeira, que está nascido na spata (117), dividido em pequenos ramos, que sustentaõ a frutificaçaõ; contem huma colunna florifera, quando a corolla por meio de compridos pedunculos está pegada no receptaculo commum filiforme, o qual quasi sempre he dividido em ramos. (VANDELLI, Domingos, 1788)","3","receptaculo","receptáculo","singular","receptáculo","1"
"776","DiccionariodeVandelli.txt",12452,"de o receptaculo da palmeira, que está nascido na spata (117), dividido em pequenos ramos, que sustentaõ a <b>frutificaçaõ</b>; contem huma colunna florifera, quando a corolla por meio de compridos pedunculos está pegada no receptaculo commum filiforme, o qual quasi sempre he dividido em ramos. (VANDELLI, Domingos, 1788)","26","frutificaçaõ","frutificação","singular","frutificação","1"
"777","DiccionariodeVandelli.txt",12452,"de o receptaculo da palmeira, que está nascido na spata (117), dividido em pequenos ramos, que sustentaõ a frutificaçaõ; contem huma colunna florifera, quando a corolla por meio de compridos <b>pedunculos</b> está pegada no receptaculo commum filiforme, o qual quasi sempre he dividido em ramos. (VANDELLI, Domingos, 1788)","40","pedunculos","pedúnculo","plural","pedúnculos","1"
"778","DiccionariodeVandelli.txt",12452,"de o <b>receptaculo</b> da palmeira, que está nascido na spata (117), dividido em pequenos ramos, que sustentaõ a frutificaçaõ; contem huma colunna florifera, quando a corolla por meio de compridos pedunculos está pegada no receptaculo commum filiforme, o qual quasi sempre he dividido em ramos. (VANDELLI, Domingos, 1788)","45","receptaculo","receptáculo","singular","receptáculo","1"
"779","DiccionariodeVandelli.txt",12462,"He huma flor aggregada, cujo <b>receptaculo</b> commum das flores está incluido em huma bainha, ou spata. (VANDELLI, Domingos, 1788)","7","receptaculo","receptáculo","singular","receptáculo","1"
"780","DiccionariodeVandelli.txt",12464,"He o <b>receptaculo</b> comprido da mesma largura em todo o comprimento, o qual pelo seu comprimento sustenta as flores em forma de espiga. (VANDELLI, Domingos, 1788)","3","receptaculo","receptáculo","singular","receptáculo","1"
"781","DiccionariodeVandelli.txt",12647,"MEMÓRIA SOBRE A UTILIDADE DOS <b>JARDINS BOTANICOS</b> (VANDELLI, Domingos, 1788)","7","JARDINS BOTANICOS","jardim botânico","plural","JARDINS BOTÂNICOS","1"
"782","DiccionariodeVandelli.txt",12658,"O primeiro conhecimento adquire-se com o estudo da botanica, o segundo com experiencias e reflexões fisicas, o terceiro, e quarto com hum <b>jardim botanico</b>, no qual he necessario cultivar os vegetaes de todos os climas, e terrenos. (VANDELLI, Domingos, 1788)","28","jardim botanico","jardim botânico",NA,"jardim botânico","1"
"783","DiccionariodeVandelli.txt",12670,"A respeito de sua grande utilidade ja foraõ estabelecidos em França doze <b>Jardins Botanicos</b>, em Hespanha dous, em Saboia hum, em Italia treze: em Alemanha vinte, em Inglaterra tres, na Prussia quatro, em Hollanda oito, em Dinamarca hum, em Suecia tres, na polonia hum, na Russia hum; alem de muitos jardins particulares. (VANDELLI, Domingos, 1788)","13","Jardins Botanicos","jardim botânico","plural","Jardins Botânicos","1"
"784","DiccionariodeVandelli.txt",12686,"Nos <b>Jardins Botanicos</b> como se cultivaõ as differentes plantas de todos os climas, e terrenos, conhecem-se, e escolhem-se as mais proprias, e adequadas ao Paiz. (VANDELLI, Domingos, 1788)","3","Jardins Botanicos","jardim botânico","plural","Jardins Botânicos","1"
"785","DiccionariodeVandelli.txt",12721,"Alem das plantas da Asia, Affrica, e America; com a instituiçaõ dos <b>Jardins Botanicos</b> em varias partes sabe-se, que plantas uteis de varios climas da mesma Europa se podem transplantar para cada Paiz. (VANDELLI, Domingos, 1788)","19","Jardins Botanicos","jardim botânico","plural","Jardins Botânicos","1"
"786","AnatomiadeSantucci.txt",66,"A Fibras <b>Longitudinaes</b>, e rectas. (SANTUCCI, Bernardo, 1739)","3","Longitudinaes","longitudinal","plural","Longitudinais","1"
"787","AnatomiadeSantucci.txt",84,"Figura sexta, demostra huma porçaõ de cute com sua <b>Epidermi</b>, como apparece debaixo do microscôpio. (SANTUCCI, Bernardo, 1739)","11","Epidermi","epiderme","singular","Epiderme","1"
"788","AnatomiadeSantucci.txt",122,"Segundo a diversa tecedura, e entresamento das fibras, e a diversa natureza dos humores, e dos succos, que exteriormente circulaõ, ou que entraõ nas taes fibras, nasce a varia composição das partes; mas principalmente das fibrasinhas variamente dispostas, e unidas humas com outras, se fazem as membranas, as quaes ou se estendem, e se alargaõ para defensa das outras partes, ou se estreitaõ formando huns canaes, o vasos para a circulação dos humores, ou finalmente se fazem redondos, convertendo-se em folliculos, e <b>glandulas</b> para a separaçaõ dos mesmos humores. (SANTUCCI, Bernardo, 1739)","108","glandulas","glândula","plural","glândulas","1"
"789","AnatomiadeSantucci.txt",125,"Pelo que, todo o corpo do animal assim como remotamente se pode resolver em fibras pequeninas, se resolvem aproximadamente nas fibras mayores, que fazem mayor corpo, como saõ as que vemos nos musculos, e também se resolvem em membranas, vasos, e <b>glandulas</b>. (SANTUCCI, Bernardo, 1739)","53","glandulas","glândula","plural","glândulas","1"
"790","AnatomiadeSantucci.txt",150,"O thorax he aquella cavidade entre as claviculas, e o <b>diaphragma</b>, que contèm o coraçaõ, os bofes, o mediastino, e parte do isophago, e aspera arteria com os seus vasos. (SANTUCCI, Bernardo, 1739)","12","diaphragma","diafragma","singular","diafragma","1"
"791","AnatomiadeSantucci.txt",150,"O thorax he aquella cavidade entre as claviculas, e o diaphragma, que contèm o coraçaõ, os bofes, o mediastino, e parte do <b>isophago</b>, e aspera arteria com os seus vasos. (SANTUCCI, Bernardo, 1739)","29","isophago","esôfago","singular","esôfago","1"
"792","AnatomiadeSantucci.txt",152,"O abdomen he a cavidade, que principia desde o <b>diaphragma</b> até as partes pudendas, ou osso, que chamaõ pubes, e o osso a que chamaõ coccyx; comprehende o ventriculo, ou estomago, os intestinos, o figado, o baço, os rins, e outras partes. (SANTUCCI, Bernardo, 1739)","11","diaphragma","diafragma","singular","diafragma","1"
"793","AnatomiadeSantucci.txt",155,"A parte superior da cabeça he a molleira, ou synciput, a posterior, e inferior he o toutiço, ou <b>occiput</b>. (SANTUCCI, Bernardo, 1739)","24","occiput","ócciput","singular","ócciput","1"
"794","AnatomiadeSantucci.txt",165,"A terceira, e inferior às outras, he a que chamaõ <b>Hypogastrio</b>. (SANTUCCI, Bernardo, 1739)","14","Hypogastrio","hipogástrio","singular","Hipogástrio","1"
"795","AnatomiadeSantucci.txt",168,"As partes do <b>Epigastrio</b> lateraes, e superiores, saõ os hypocondrios, ou vasios, hum da parte direita, e outro da parte esquerda. (SANTUCCI, Bernardo, 1739)","5","Epigastrio","epigástrio","singular","Epigástrio","1"
"796","AnatomiadeSantucci.txt",170,"As partes lateraes superiores do <b>Hypogastrio</b> saõ os vasios, que em Latim chamaõ Ilia; e em Portuguez tambem ilhargas. (SANTUCCI, Bernardo, 1739)","7","Hypogastrio","hipogástrio","singular","Hipogástrio","1"
"797","AnatomiadeSantucci.txt",206,"Tres saõ as partes, que servem de cubrir todo o corpo, a <b>cuticula</b>, a cute, ou pelle, e a membrana, que chamaõ Adiposa. (SANTUCCI, Bernardo, 1739)","15","cuticula","cutícula","singular","cutícula","1"
"798","AnatomiadeSantucci.txt",208,"A <b>cuticula</b>, a que os Gregos chamaõ Epidermis, he huma membrana muy tenue, e transparente, mas muito densa, que naõ tem sensaçaõ, e cobre exteriormente toda a pelle, ou cute, a qual està taõ pegada, que difficultosamente della se pode separar. (SANTUCCI, Bernardo, 1739)","2","cuticula","cutícula","singular","cutícula","1"
"799","AnatomiadeSantucci.txt",208,"A cuticula, a que os Gregos chamaõ <b>Epidermis</b>, he huma membrana muy tenue, e transparente, mas muito densa, que naõ tem sensaçaõ, e cobre exteriormente toda a pelle, ou cute, a qual està taõ pegada, que difficultosamente della se pode separar. (SANTUCCI, Bernardo, 1739)","9","Epidermis","epiderme","singular","Epiderme","1"
"800","AnatomiadeSantucci.txt",212,"A <b>cuticula</b> tem muitos buraquinhos, que correspondem aos poros da cute, ou pelle. (SANTUCCI, Bernardo, 1739)","2","cuticula","cutícula","singular","cutícula","1"
"801","AnatomiadeSantucci.txt",213,"Tirada a <b>cuticula</b>, logo se vê huma parte da pelle, que foy descuberta pella industria do Doutor Marcello Malpighio, e se chama corpo reticular. (SANTUCCI, Bernardo, 1739)","3","cuticula","cutícula","singular","cutícula","1"
"802","AnatomiadeSantucci.txt",221,"Estes corpos passando pelos poros do corpo reticular, vem a terminar na <b>cuticula</b> em fórma de cabecinhas, quasi redondas, as quaes diversamente dispostas fórmaõ huns regos, que se vem principalmente nas pontas dos dedos, e muito mais nas palmas das mãos, e nas plantas dos pès, &c. (SANTUCCI, Bernardo, 1739)","17","cuticula","cutícula","singular","cutícula","1"
"803","AnatomiadeSantucci.txt",223,"Debaixo da cute, quasi por todo o corpo, estaõ as <b>glandulas</b>, que pela grandeza, e figura se chamaõ miliares, cheyas de nervos, e vasos de sangue, e com os seus canos, ou ductos excretorios, os quaes passando o corpo reticular, vem acabar na superficie exterior do mesmo corpo reticular. (SANTUCCI, Bernardo, 1739)","14","glandulas","glândula","plural","glândulas","1"
"804","AnatomiadeSantucci.txt",226,"Além destas <b>glandulas</b>, foraõ descubertas outras pelo dito Malpighio, Valsalva, (SANTUCCI, Bernardo, 1739)","4","glandulas","glândula","plural","glândulas","1"
"805","AnatomiadeSantucci.txt",229,"As unhas saõ laminas moderadamente duras, flexiveis, transparentes, mais brandas, e tenues junto à raiz, onde se vê huma porçaõ branca, que pela sua figura se chama Lunula: a parte anterior nao està pegada à outra cousa, a posterior està pegada à <b>cuticula</b>, donde nascem. (SANTUCCI, Bernardo, 1739)","55","cuticula","cutícula","singular","cutícula","1"
"806","AnatomiadeSantucci.txt",232,"Nenhuma outra cousa sao as unhas, senaõ muitos canosinhos, dispostos com certa ordem, pelos quaes, como por humas bainhas, passaõ os <b>filamentos</b> das papillas cutaneas. (SANTUCCI, Bernardo, 1739)","28","filamentos","filamento","plural","filamentos","1"
"807","AnatomiadeSantucci.txt",254,"Primeiramente o uso da <b>cuticula</b> he defender as partes, que estaõ debaixo, e saõ muito sensitivas, de qualquer cousa externa, que lhes possa fazer mal, e causar molestia, e moderar as impressoens dos objectos, para que se naõ façaõ com dor. (SANTUCCI, Bernardo, 1739)","6","cuticula","cutícula","singular","cutícula","1"
"808","AnatomiadeSantucci.txt",258,"Porque o humor seroso pelas <b>glandulas</b> cutaneas se separa do sangue, e sahe fóra, a qual evacuaçaõ, se he moderada, se chama insensivel transpiraçao; se he mayor, e o humor sahe sensivelmente pelos (SANTUCCI, Bernardo, 1739)","7","glandulas","glândula","plural","glândulas","1"
"809","AnatomiadeSantucci.txt",279,"O Peritôneo tem dous processos, que vaõ atè às virilhas, os quaes nas mulheres incluem os ligamentos do utero, que chamaõ redondos, e nos homens os vasos espermaticos, que passando pelos musculos obliquos, e transversos do abdomen, vaõ até o escroto, onde os mesmos processos estendendo-se mais, constituem hum, e outro envoltorio, ou <b>tunica</b> vaginal dos testiculos. (SANTUCCI, Bernardo, 1739)","72","tunica","túnica","singular","túnica","1"
"810","AnatomiadeSantucci.txt",281,"O Peritôneo na parte superior tem tres buracos, pelos quaes passaõ o <b>isophago</b>, a arteria magna, e a vea cava. (SANTUCCI, Bernardo, 1739)","16","isophago","esôfago","singular","esôfago","1"
"811","AnatomiadeSantucci.txt",308,"Tambem se achaõ no redenho vasos lymphaticos, os quaes pòde ser que tenhaō communicação com as <b>glandulas</b> pequenas, que estao em varias partes do mesmo redenho, e cubertas de gordura. (SANTUCCI, Bernardo, 1739)","19","glandulas","glândula","plural","glândulas","1"
"812","AnatomiadeSantucci.txt",322,"O <b>isophago</b>, o ventriculo, e os intestinos. (SANTUCCI, Bernardo, 1739)","2","isophago","esôfago","singular","esôfago","1"
"813","AnatomiadeSantucci.txt",327,"O <b>isophago</b> principia na pharinge, donde nasce, e descendo pelas vertebras, passa o diaphragma, onde alargando-se, fórma mayor cavidade, a qual se chama ventriculo. (SANTUCCI, Bernardo, 1739)","2","isophago","esôfago","singular","esôfago","1"
"814","AnatomiadeSantucci.txt",327,"O isophago principia na pharinge, donde nasce, e descendo pelas vertebras, passa o <b>diaphragma</b>, onde alargando-se, fórma mayor cavidade, a qual se chama ventriculo. (SANTUCCI, Bernardo, 1739)","19","diaphragma","diafragma","singular","diafragma","1"
