"";"doc_id";"sentence_id";"sentence";"token_id";"token";"lemma";"misc";"orth";"sensenumber"
"511";"AnatomiadeSantucci.txt";66;"A Fibras <b>Longitudinaes</b>, e rectas. (SANTUCCI, Bernardo, 1739)";"3";"Longitudinaes";"longitudinal";"SpaceAfter=No";"Longitudinais";"1"
"1682";"AnatomiadeSantucci.txt";122;"Segundo a diversa tecedura, e entresamento das fibras, e a diversa natureza dos humores, e dos succos, que exteriormente circulaõ, ou que entraõ nas taes fibras, nasce a varia composição das partes; mas principalmente das fibrasinhas variamente dispostas, e unidas humas com outras, se fazem as membranas, as quaes ou se estendem, e se alargaõ para defensa das outras partes, ou se estreitaõ formando huns canaes, o vasos para a circulação dos humores, ou finalmente se fazem redondos, convertendo-se em folliculos, e <b>glandulas</b> para a separaçaõ dos mesmos humores. (SANTUCCI, Bernardo, 1739)";"108";"glandulas";"glândula";NA;"glândulas";"1"
"1753";"AnatomiadeSantucci.txt";125;"Pelo que, todo o corpo do animal assim como remotamente se pode resolver em fibras pequeninas, se resolvem aproximadamente nas fibras mayores, que fazem mayor corpo, como saõ as que vemos nos musculos, e também se resolvem em membranas, vasos, e <b>glandulas</b>. (SANTUCCI, Bernardo, 1739)";"53";"glandulas";"glândula";"SpaceAfter=No";"glândulas";"1"
"1861";"AnatomiadeSantucci.txt";130;"Assim como as arterias, veas, nervos, ossos, cartilagens, membranas, ligamentos, <b>tunicas</b>, carne, &c. (SANTUCCI, Bernardo, 1739)";"18";"tunicas";"túnica";"SpaceAfter=No";"túnicas";"1"
"2073";"AnatomiadeSantucci.txt";150;"O thorax he aquella cavidade entre as claviculas, e o <b>diaphragma</b>, que contèm o coraçaõ, os bofes, o mediastino, e parte do isophago, e aspera arteria com os seus vasos. (SANTUCCI, Bernardo, 1739)";"12";"diaphragma";"diafragma";"SpaceAfter=No";"diafragma";"1"
"2091";"AnatomiadeSantucci.txt";150;"O thorax he aquella cavidade entre as claviculas, e o diaphragma, que contèm o coraçaõ, os bofes, o mediastino, e parte do <b>isophago</b>, e aspera arteria com os seus vasos. (SANTUCCI, Bernardo, 1739)";"29";"isophago";"esôfago";"SpaceAfter=No";"esôfago";"1"
"2112";"AnatomiadeSantucci.txt";152;"O abdomen he a cavidade, que principia desde o <b>diaphragma</b> até as partes pudendas, ou osso, que chamaõ pubes, e o osso a que chamaõ coccyx; comprehende o ventriculo, ou estomago, os intestinos, o figado, o baço, os rins, e outras partes. (SANTUCCI, Bernardo, 1739)";"11";"diaphragma";"diafragma";NA;"diafragma";"1"
"2212";"AnatomiadeSantucci.txt";155;"A parte superior da cabeça he a molleira, ou synciput, a posterior, e inferior he o toutiço, ou <b>occiput</b>. (SANTUCCI, Bernardo, 1739)";"24";"occiput";"ócciput";"SpaceAfter=No";"ócciput";"1"
"2393";"AnatomiadeSantucci.txt";165;"A terceira, e inferior às outras, he a que chamaõ <b>Hypogastrio</b>. (SANTUCCI, Bernardo, 1739)";"14";"Hypogastrio";"hipogástrio";"SpaceAfter=No";"Hipogástrio";"1"
"2405";"AnatomiadeSantucci.txt";168;"As partes do <b>Epigastrio</b> lateraes, e superiores, saõ os hypocondrios, ou vasios, hum da parte direita, e outro da parte esquerda. (SANTUCCI, Bernardo, 1739)";"5";"Epigastrio";"epigástrio";NA;"Epigástrio";"1"
"2441";"AnatomiadeSantucci.txt";170;"As partes lateraes superiores do <b>Hypogastrio</b> saõ os vasios, que em Latim chamaõ Ilia; e em Portuguez tambem ilhargas. (SANTUCCI, Bernardo, 1739)";"7";"Hypogastrio";"hipogástrio";NA;"Hipogástrio";"1"
"3031";"AnatomiadeSantucci.txt";206;"Tres saõ as partes, que servem de cubrir todo o corpo, a <b>cuticula</b>, a cute, ou pelle, e a membrana, que chamaõ Adiposa. (SANTUCCI, Bernardo, 1739)";"15";"cuticula";"cutícula";"SpaceAfter=No";"cutícula";"1"
"3049";"AnatomiadeSantucci.txt";208;"A <b>cuticula</b>, a que os Gregos chamaõ Epidermis, he huma membrana muy tenue, e transparente, mas muito densa, que naõ tem sensaçaõ, e cobre exteriormente toda a pelle, ou cute, a qual està taõ pegada, que difficultosamente della se pode separar. (SANTUCCI, Bernardo, 1739)";"2";"cuticula";"cutícula";"SpaceAfter=No";"cutícula";"1"
"3165";"AnatomiadeSantucci.txt";212;"A <b>cuticula</b> tem muitos buraquinhos, que correspondem aos poros da cute, ou pelle. (SANTUCCI, Bernardo, 1739)";"2";"cuticula";"cutícula";NA;"cutícula";"1"
"3186";"AnatomiadeSantucci.txt";213;"Tirada a <b>cuticula</b>, logo se vê huma parte da pelle, que foy descuberta pella industria do Doutor Marcello Malpighio, e se chama corpo reticular. (SANTUCCI, Bernardo, 1739)";"3";"cuticula";"cutícula";"SpaceAfter=No";"cutícula";"1"
"3451";"AnatomiadeSantucci.txt";221;"Estes corpos passando pelos poros do corpo reticular, vem a terminar na <b>cuticula</b> em fórma de cabecinhas, quasi redondas, as quaes diversamente dispostas fórmaõ huns regos, que se vem principalmente nas pontas dos dedos, e muito mais nas palmas das mãos, e nas plantas dos pès, &c. (SANTUCCI, Bernardo, 1739)";"17";"cuticula";"cutícula";NA;"cutícula";"1"
"3519";"AnatomiadeSantucci.txt";223;"Debaixo da cute, quasi por todo o corpo, estaõ as <b>glandulas</b>, que pela grandeza, e figura se chamaõ miliares, cheyas de nervos, e vasos de sangue, e com os seus canos, ou ductos excretorios, os quaes passando o corpo reticular, vem acabar na superficie exterior do mesmo corpo reticular. (SANTUCCI, Bernardo, 1739)";"14";"glandulas";"glândula";"SpaceAfter=No";"glândulas";"1"
"3624";"AnatomiadeSantucci.txt";226;"Além destas <b>glandulas</b>, foraõ descubertas outras pelo dito Malpighio, Valsalva, (SANTUCCI, Bernardo, 1739)";"4";"glandulas";"glândula";"SpaceAfter=No";"glândulas";"1"
"3756";"AnatomiadeSantucci.txt";229;"As unhas saõ laminas moderadamente duras, flexiveis, transparentes, mais brandas, e tenues junto à raiz, onde se vê huma porçaõ branca, que pela sua figura se chama Lunula: a parte anterior nao està pegada à outra cousa, a posterior està pegada à <b>cuticula</b>, donde nascem. (SANTUCCI, Bernardo, 1739)";"55";"cuticula";"cutícula";"SpaceAfter=No";"cutícula";"1"
"3794";"AnatomiadeSantucci.txt";232;"Nenhuma outra cousa sao as unhas, senaõ muitos canosinhos, dispostos com certa ordem, pelos quaes, como por humas bainhas, passaõ os <b>filamentos</b> das papillas cutaneas. (SANTUCCI, Bernardo, 1739)";"28";"filamentos";"filamento";NA;"filamentos";"1"
"4425";"AnatomiadeSantucci.txt";254;"Primeiramente o uso da <b>cuticula</b> he defender as partes, que estaõ debaixo, e saõ muito sensitivas, de qualquer cousa externa, que lhes possa fazer mal, e causar molestia, e moderar as impressoens dos objectos, para que se naõ façaõ com dor. (SANTUCCI, Bernardo, 1739)";"6";"cuticula";"cutícula";NA;"cutícula";"1"
"4555";"AnatomiadeSantucci.txt";258;"Porque o humor seroso pelas <b>glandulas</b> cutaneas se separa do sangue, e sahe fóra, a qual evacuaçaõ, se he moderada, se chama insensivel transpiraçao; se he mayor, e o humor sahe sensivelmente pelos (SANTUCCI, Bernardo, 1739)";"7";"glandulas";"glândula";NA;"glândulas";"1"
"4798";"AnatomiadeSantucci.txt";268;"Este he como hum sacco, com figura oval, nasce das <b>tunicas</b>, que cobrem os (SANTUCCI, Bernardo, 1739)";"14";"tunicas";"túnica";"SpaceAfter=No";"túnicas";"1"
"5061";"AnatomiadeSantucci.txt";279;"O Peritôneo tem dous processos, que vaõ atè às virilhas, os quaes nas mulheres incluem os ligamentos do utero, que chamaõ redondos, e nos homens os vasos espermaticos, que passando pelos musculos obliquos, e transversos do abdomen, vaõ até o escroto, onde os mesmos processos estendendo-se mais, constituem hum, e outro envoltorio, ou <b>tunica</b> vaginal dos testiculos. (SANTUCCI, Bernardo, 1739)";"72";"tunica";"túnica";NA;"túnica";"1"
"5086";"AnatomiadeSantucci.txt";281;"O Peritôneo na parte superior tem tres buracos, pelos quaes passaõ o <b>isophago</b>, a arteria magna, e a vea cava. (SANTUCCI, Bernardo, 1739)";"16";"isophago";"esôfago";"SpaceAfter=No";"esôfago";"1"
"5691";"AnatomiadeSantucci.txt";308;"Tambem se achaõ no redenho vasos lymphaticos, os quaes pòde ser que tenhao communicação com as <b>glandulas</b> pequenas, que estao em varias partes do mesmo redenho, e cubertas de gordura. (SANTUCCI, Bernardo, 1739)";"19";"glandulas";"glândula";NA;"glândulas";"1"
"5956";"AnatomiadeSantucci.txt";322;"O <b>isophago</b>, o ventriculo, e os intestinos. (SANTUCCI, Bernardo, 1739)";"2";"isophago";"esôfago";"SpaceAfter=No";"esôfago";"1"
"5988";"AnatomiadeSantucci.txt";323;"Todas estas partes, e pelo conseguinte todo o cano he da mesma substancia, e consta de três <b>tunicas</b>. (SANTUCCI, Bernardo, 1739)";"22";"tunicas";"túnica";"SpaceAfter=No";"túnicas";"1"
"6032";"AnatomiadeSantucci.txt";327;"O <b>isophago</b> principia na pharinge, donde nasce, e descendo pelas vertebras, passa o diaphragma, onde alargando-se, fórma mayor cavidade, a qual se chama ventriculo. (SANTUCCI, Bernardo, 1739)";"2";"isophago";"esôfago";NA;"esôfago";"1"
"6051";"AnatomiadeSantucci.txt";327;"O isophago principia na pharinge, donde nasce, e descendo pelas vertebras, passa o <b>diaphragma</b>, onde alargando-se, fórma mayor cavidade, a qual se chama ventriculo. (SANTUCCI, Bernardo, 1739)";"19";"diaphragma";"diafragma";"SpaceAfter=No";"diafragma";"1"
"6070";"AnatomiadeSantucci.txt";329;"A <b>tunica</b> exterior do isophago nasce da pleura, a media he composta de duas ordens de fibras carnosas, das quaes, humas vaõ direitas pelo comprimento do issophago, e outras estaõ á roda delle. (SANTUCCI, Bernardo, 1739)";"2";"tunica";"túnica";NA;"túnica";"1"
"6075";"AnatomiadeSantucci.txt";329;"A tunica exterior do <b>isophago</b> nasce da pleura, a media he composta de duas ordens de fibras carnosas, das quaes, humas vaõ direitas pelo comprimento do issophago, e outras estaõ á roda delle. (SANTUCCI, Bernardo, 1739)";"6";"isophago";"esôfago";NA;"esôfago";"1"
"6136";"AnatomiadeSantucci.txt";331;"A <b>tunica</b> interior he nervosa, como dissemos; tem humas glandulas pequenas, as quaes deitaõ pelos seus canos excretorios hum humor tenue na cavidade do canal Sobredito. (SANTUCCI, Bernardo, 1739)";"2";"tunica";"túnica";NA;"túnica";"1"
"6146";"AnatomiadeSantucci.txt";331;"A tunica interior he nervosa, como dissemos; tem humas <b>glandulas</b> pequenas, as quaes deitaõ pelos seus canos excretorios hum humor tenue na cavidade do canal Sobredito. (SANTUCCI, Bernardo, 1739)";"12";"glandulas";"glândula";NA;"glândulas";"1"
"6173";"AnatomiadeSantucci.txt";333;"Esta <b>tunica</b> interior alli naõ tem rugas transversas, como tem no ventriculo, mas continua direitamente pelo mesmo ilophago, para naõ impedir que caya o comer (SANTUCCI, Bernardo, 1739)";"2";"tunica";"túnica";NA;"túnica";"1"
"6234";"AnatomiadeSantucci.txt";336;"Perto da quinta vertebra do thorax,exteriormente, estaõ na parte posterior do ifophago humas <b>glandulas</b>, as quaes ordinariamente saõ duas, e com os seus ductos, a pòde ser que cheguem à cavidade do mêsmo isophago, lançando hum succo, talvez para humedecer a mesma cavidade. (SANTUCCI, Bernardo, 1739)";"21";"glandulas";"glândula";"SpaceAfter=No";"glândulas";"1"
"6261";"AnatomiadeSantucci.txt";336;"Perto da quinta vertebra do thorax,exteriormente, estaõ na parte posterior do ifophago humas glandulas, as quaes ordinariamente saõ duas, e com os seus ductos, a pòde ser que cheguem à cavidade do mêsmo <b>isophago</b>, lançando hum succo, talvez para humedecer a mesma cavidade. (SANTUCCI, Bernardo, 1739)";"46";"isophago";"esôfago";"SpaceAfter=No";"esôfago";"1"
"6275";"AnatomiadeSantucci.txt";337;"Essas <b>glandulas</b> fazendo-se mayores por alguma doença, causaõ hum fastio mortal, e impedem a passagem aos alimentos, ainda que sejaõ liquidos. (SANTUCCI, Bernardo, 1739)";"2";"glandulas";"glândula";NA;"glândulas";"1"
"6326";"AnatomiadeSantucci.txt";339;"O ventriculo he hum facco, que tem , figura de odre, e està no meyo do <b>epigastrio</b>, e tem da parte direita o figado, o qual està acima do ventriculo, cobrindo o algum tanto com a parte concava; da parte esquerda está o baço. (SANTUCCI, Bernardo, 1739)";"21";"epigastrio";"epigástrio";"SpaceAfter=No";"epigástrio";"1"
"6683";"AnatomiadeSantucci.txt";352;"Tambem para este fim, tem o mesmo orificio huma cousa como anel, que chamaõ spincter; este se compoem de fibras carnosas, as quaes sahem da parte, onde se dobra a <b>tunica</b> interior. (SANTUCCI, Bernardo, 1739)";"37";"tunica";"túnica";NA;"túnica";"1"
"6688";"AnatomiadeSantucci.txt";354;"A <b>tunica</b> exterior do ventriculo principia do Peritôneo, e se compoem de fibras, que vaõ direitamente pelo comprimento do ventriculo, e saõ mais grossas estas fibras perto dos orificios, e tambem no fundo, onde he necessario serem mais fortes. (SANTUCCI, Bernardo, 1739)";"2";"tunica";"túnica";NA;"túnica";"1"
"6746";"AnatomiadeSantucci.txt";356;"A <b>tunica</b> do meyo he composta de duas ordens de fibras carnosas. (SANTUCCI, Bernardo, 1739)";"2";"tunica";"túnica";NA;"túnica";"1"
"6886";"AnatomiadeSantucci.txt";362;"Por toda a <b>tunica</b> interior, a qual, como dissemos, he nervosa, se distribuem huns ramos muy delgados, que saõ vasos de sangue. (SANTUCCI, Bernardo, 1739)";"4";"tunica";"túnica";NA;"túnica";"1"
"6912";"AnatomiadeSantucci.txt";363;"Esta <b>tunica</b> està cheya de rugas, as quaes se desfazem com cousas cheirosas. (SANTUCCI, Bernardo, 1739)";"2";"tunica";"túnica";NA;"túnica";"1"
"6930";"AnatomiadeSantucci.txt";364;"Tambem està cheya de <b>glandulas</b> pequenas. (SANTUCCI, Bernardo, 1739)";"5";"glandulas";"glândula";NA;"glândulas";"1"
"6940";"AnatomiadeSantucci.txt";365;"A superficie interior da mesma <b>tunica</b> està cuberta de huma crusta, a qual tem canosinhos, que os Anatomicos chamaõ villos, como observou Malpighio: as extremidades destes canosinhos, humas eftao na parte mais profunda da mesma tunica, as outras estaõ na cavidade do ventriculo, e sobem perpendicularmente, e deitaõ no mesmo, ventriculo hum succo separado do sangue. (SANTUCCI, Bernardo, 1739)";"7";"tunica";"túnica";NA;"túnica";"1"
"6956";"AnatomiadeSantucci.txt";365;"A superficie interior da mesma tunica està cuberta de huma crusta, a qual tem canosinhos, que os Anatomicos chamaõ <b>villos</b>, como observou Malpighio: as extremidades destes canosinhos, humas eftao na parte mais profunda da mesma tunica, as outras estaõ na cavidade do ventriculo, e sobem perpendicularmente, e deitaõ no mesmo, ventriculo hum succo separado do sangue. (SANTUCCI, Bernardo, 1739)";"23";"villos";"vilo";"SpaceAfter=No";"vilos";"1"
"6981";"AnatomiadeSantucci.txt";365;"A superficie interior da mesma <b>tunica</b> està cuberta de huma crusta, a qual tem canosinhos, que os Anatomicos chamaõ villos, como observou Malpighio: as extremidades destes canosinhos, humas eftao na parte mais profunda da mesma tunica, as outras estaõ na cavidade do ventriculo, e sobem perpendicularmente, e deitaõ no mesmo, ventriculo hum succo separado do sangue. (SANTUCCI, Bernardo, 1739)";"45";"tunica";"túnica";"SpaceAfter=No";"túnica";"1"
"7966";"AnatomiadeSantucci.txt";401;"Compoem-se todos os intestinos de tres membranas, huma he exterior, e sahe do Peritôneo, outra está no meyo, e he composta de duas ordens de fibras carnosas, das quaes as exteriores saõ direitas, as interiores circulares; a terceira membrana he interior, e nervosa, e tem muitos vasos de sangue, e tambem muitos <b>villos</b>; esta membrana, principalmente no intestino jejuno contraindo-se, faz muitas rugas transversas, e a estas rugas alguns lhe daõ o nome de valvulas. (SANTUCCI, Bernardo, 1739)";"67";"villos";"vilo";"SpaceAfter=No";"vilos";"1"
"8086";"AnatomiadeSantucci.txt";405;"Nesta cavidade observou Brunero muitas <b>glandulas</b>, que tambem nos outros intestinos se achaõ, as quaes foraõ primeiro observadas por Peieiro, humas destas glandulas se achaõ unidas como cachos de uvas, nos intestinos delgados, e outras ainda mais nos intestinos grossos. (SANTUCCI, Bernardo, 1739)";"7";"glandulas";"glândula";"SpaceAfter=No";"glândulas";"1"
"8110";"AnatomiadeSantucci.txt";405;"Nesta cavidade observou Brunero muitas <b>glandulas</b>, que tambem nos outros intestinos se achaõ, as quaes foraõ primeiro observadas por Peieiro, humas destas glandulas se achaõ unidas como cachos de uvas, nos intestinos delgados, e outras ainda mais nos intestinos grossos. (SANTUCCI, Bernardo, 1739)";"29";"glandulas";"glândula";NA;"glândulas";"1"
"8982";"AnatomiadeSantucci.txt";456;"pela mesma <b>tunica</b>. (SANTUCCI, Bernardo, 1739)";"4";"tunica";"túnica";"SpaceAfter=No";"túnica";"1"
"9336";"AnatomiadeSantucci.txt";470;"Desta substancia oleosa, e <b>medullar</b> necessitaõ os ossos, porque saindo dos seus pòros, tempéra com sua untuosidade as particulas do sangue, que devem nutrir os mesmos ossos, e tambem serve para os conservar no seu temperamento, lubrificando, e impedindo, que pela muita sequidaõ não se quebrem facilmente. (SANTUCCI, Bernardo, 1739)";"7";"medullar";"medular";NA;"medular";"1"
"10627";"AnatomiadeSantucci.txt";552;"Principîa esta na parte posterior da cabeça de huma parte, e outra do osso chamado <b>occiput</b>, ou toutiço, e obliquamente vay subindo ate o meyo da cabeça, e fórma hum ângulo, e por isso se chama angular: une o osso do toutiço aos ossos do synciput, ou molleira, e das fontes. (SANTUCCI, Bernardo, 1739)";"20";"occiput";"ócciput";"SpaceAfter=No";"ócciput";"1"
"10837";"AnatomiadeSantucci.txt";562;"Estas suturas saõ duas, e se chamaõ <b>escamosas</b>, ou temporaes, servem para unir os ossos das fontes com os ossos da molleira com as suas escamas, que tem na borda. (SANTUCCI, Bernardo, 1739)";"9";"escamosas";"escamoso";"SpaceAfter=No";"escamosas";"1"
"11060";"AnatomiadeSantucci.txt";573;"Suturas <b>escamosas</b> ou temporaes (SANTUCCI, Bernardo, 1739)";"2";"escamosas";"escamoso";NA;"escamosas";"1"
"11462";"AnatomiadeSantucci.txt";597;"Aquelles que pertecem ao craneo saõ os seguintes: o osso da testa, dous do synciput, ou moleira; hum do <b>occiput</b>, ou toutiço; e dous das fontes. (SANTUCCI, Bernardo, 1739)";"28";"occiput";"ócciput";"SpaceAfter=No";"ócciput";"1"
"11642";"AnatomiadeSantucci.txt";607;"As Apophisis, ou processos deste osso, saõ quatro, e estaõ nos quatro cantos dos olhos, os quaes servem para fazer na parte da <b>orbita</b> superior o assento, ou base aos musculos, que fechaõ as capellas. (SANTUCCI, Bernardo, 1739)";"33";"orbita";"órbita";NA;"órbita";"1"
"11773";"AnatomiadeSantucci.txt";612;"O osso da testa tem tambem certas cavidades, humas são externas, e saõ aquellas, que ajudaõ a formar a cavidade das <b>orbitas</b>; outras saõ internas, e se chamaõ Lyras, servem estas de commodidade aos lobos dos miollos. (SANTUCCI, Bernardo, 1739)";"27";"orbitas";"órbita";"SpaceAfter=No";"órbitas";"1"
"12017";"AnatomiadeSantucci.txt";625;"A figura destes he quadrilatra, mas na grossura saõ desiguaes, unem-se estes ossos com o osso da testa por meyo da sutura coronal, e com o osso da molleira por meyo da sutura lambdoidea; finalmente com os ossos das fontes, onde saõ muy delgados, unem-se por meyo da sutura <b>escamosa</b>, e entre si se unem pela sutura sagittal. (SANTUCCI, Bernardo, 1739)";"66";"escamosa";"escamoso";"SpaceAfter=No";"escamosa";"1"
"12217";"AnatomiadeSantucci.txt";638;"O osso do toutiço chamado tambem <b>Occiput</b> osso Proræ, e o osso da memoria tem figura triangular, a grossura naõ he igual em todo o osso; porém he muy grosso, exceptuado na parte, que està perto do buraco grande, por onde passa a medulla espinhal. (SANTUCCI, Bernardo, 1739)";"8";"Occiput";"ócciput";NA;"Ócciput";"1"
"12443";"AnatomiadeSantucci.txt";644;"O osso do toutiço, ou <b>Occiput</b> (SANTUCCI, Bernardo, 1739)";"8";"Occiput";"ócciput";"SpacesAfter=\n";"Ócciput";"1"
"12680";"AnatomiadeSantucci.txt";655;"O osso das fontes, que tambem se chamaõ Lapidosos, Petrosos, <b>Escamosos</b>, e Mendosos, saõ de figura na parte superior quasi semicircular, e a sua superficie he igual: por baixo internamente a (SANTUCCI, Bernardo, 1739)";"15";"Escamosos";"escamoso";"SpaceAfter=No";"Escamosos";"1"
"12789";"AnatomiadeSantucci.txt";663;"Unem-se com os ossos da molleira por meyo sutura <b>escamosa</b>, e com o osso da testa, e com o do toutiço, pelas suturas acima ditas. (SANTUCCI, Bernardo, 1739)";"12";"escamosa";"escamoso";"SpaceAfter=No";"escamosa";"1"
"13077";"AnatomiadeSantucci.txt";678;"O processo Zigomatico serve de passagem ao tendaõ do musculo temporal, e em parte serve de lugar donde nasce o musculo <b>maceter</b>. (SANTUCCI, Bernardo, 1739)";"25";"maceter";"masseter";"SpaceAfter=No";"masseter";"1"
"13586";"AnatomiadeSantucci.txt";704;"está a <b>glandula</b> Pituitaria. (SANTUCCI, Bernardo, 1739)";"3";"glandula";"glândula";NA;"glândula";"1"
"13638";"AnatomiadeSantucci.txt";709;"O primeiro he transcolatorio da <b>glandula</b> Pituitaria, o segundo he por onde passaõ os nervos opticos. (SANTUCCI, Bernardo, 1739)";"7";"glandula";"glândula";NA;"glândula";"1"
"13724";"AnatomiadeSantucci.txt";712;"Tres saõ as cavidades, ou covas, huma he interna, e he aquella, que serve de base à <b>glandula</b> pituitaria, duas saõ externas, que estaõ no principio dos processos Aliformes. (SANTUCCI, Bernardo, 1739)";"23";"glandula";"glândula";NA;"glândula";"1"
"13959";"AnatomiadeSantucci.txt";722;"Divide-se este osso em tres partes; a primeira, e superior por ter muitos buracos, se chama crivrosa; a interna he esponjosa, com a qual se divide a cavidade do nariz em duas partes; a terceira parte occupa os lados, onde he liso, e plano, e constitue a parte da <b>orbita</b>. (SANTUCCI, Bernardo, 1739)";"62";"orbita";"órbita";"SpaceAfter=No";"órbita";"1"
"14071";"AnatomiadeSantucci.txt";725;"Dous saõ os usos, que se assinaõ aos buracos crivriformes; hum he que serve de passagem a muitas fibrinhas dos nervos olfactorios, que nascem, e se vaõ espalhando pelas <b>tunicas</b>, que vestem as cavidades do nariz. (SANTUCCI, Bernardo, 1739)";"37";"tunicas";"túnica";"SpaceAfter=No";"túnicas";"1"
"14382";"AnatomiadeSantucci.txt";770;"<b>orbitas</b>, saõ, defensa, pyramidal, deixaõ, huma, vay, atè, estaõ, donde, passaõ, opticos (SANTUCCI, Bernardo, 1739)";"1";"orbitas";"órbita";"SpaceAfter=No";"órbitas";"1"
"14439";"AnatomiadeSantucci.txt";776;"DA <b>MYOLOGIA</b>, OU DOS MUSCULOS, e dos movimentos, ou acçaõ dos musculos. (SANTUCCI, Bernardo, 1739)";"3";"MYOLOGIA";"miologia";"SpaceAfter=No";"MIOLOGIA";"1"
"14605";"AnatomiadeSantucci.txt";784;"A estas partes se pódem ajuntar as <b>glandulas</b> adiposas, e mucilaginosas, e os vasos lymphaticos. (SANTUCCI, Bernardo, 1739)";"8";"glandulas";"glândula";NA;"glândulas";"1"
"14696";"AnatomiadeSantucci.txt";790;"As <b>glandulas</b> adiposas, e mucilaginosas, e os vasos lymphaticos administraõ, huma materia untuosa às fibras, com que se facilíta mais (SANTUCCI, Bernardo, 1739)";"2";"glandulas";"glândula";NA;"glândulas";"1"
"15507";"AnatomiadeSantucci.txt";819;"Do segundo genero saõ os chamados <b>masseter</b>, e Deltoydes, dos quaes o primeiro serve para mover o queixo inferior, o outro para levantar o hombro. (SANTUCCI, Bernardo, 1739)";"8";"masseter";"masseter";"SpaceAfter=No";"masseter";"1"
"15687";"AnatomiadeSantucci.txt";824;"estaõ compostas as paredes de cada hum dos canosinhos carnosos, saõ <b>filamentos</b> minimos dos nervos. (SANTUCCI, Bernardo, 1739)";"14";"filamentos";"filamento";NA;"filamentos";"1"
"16001";"AnatomiadeSantucci.txt";834;"Pelos canosinhos carnosos livremente vay correndo o sangue antes que passe das arterias para as veas; e em quanto corre, as fibras se conservaõ extensas, e compridas, mas pelos <b>filamentos</b> nervosos, que compoem as paredes dos canosinhos, correm os espiritos animaes, que provém dos nervos. (SANTUCCI, Bernardo, 1739)";"37";"filamentos";"filamento";NA;"filamentos";"1"
"16039";"AnatomiadeSantucci.txt";835;"Com tudo naõ havemos de conceber, que os mesmos espiritos correm por aquelles <b>filamentos</b>, como por canos livres, e totalmente iguaes, mas como por huns corpos esponjosos, e que tem varias cavidades desiguaes; e ainda que tenhaõ communicaçaõ entre si, com tudo pòdem ahi mesmo deter os espiritos, e impedir, que corraõ livremente. (SANTUCCI, Bernardo, 1739)";"15";"filamentos";"filamento";"SpaceAfter=No";"filamentos";"1"
"16388";"AnatomiadeSantucci.txt";845;"Para se entender mais facilmente esta contracçaõ, e relaxaçaõ do musculo, havemos de conceber os segmentos, ou partes das fibras, que constituem os canosinhos carnosos, como huns minimos articulos, os quaes dispostos direitamente, compoem o <b>filamento</b> inteiro. (SANTUCCI, Bernardo, 1739)";"45";"filamento";"filamento";NA;"filamento";"1"
"17425";"AnatomiadeSantucci.txt";883;"O commum se chama Orbicular, porque vay rodeando externamente a circumferencia da <b>Orbita</b>, apegandose à dita Orbita com as suas fibras. (SANTUCCI, Bernardo, 1739)";"15";"Orbita";"órbita";"SpaceAfter=No";"Órbita";"1"
"17432";"AnatomiadeSantucci.txt";883;"O commum se chama Orbicular, porque vay rodeando externamente a circumferencia da <b>Orbita</b>, apegandose à dita Orbita com as suas fibras. (SANTUCCI, Bernardo, 1739)";"21";"Orbita";"órbita";NA;"Órbita";"1"
"17738";"AnatomiadeSantucci.txt";912;"6 os Obliquos chamaõ-se Amatorios, e saõ dous, hum superior, e mayor, chamado Troclear, porque passa por huma Troclea; nasce do fundo da <b>Orbita</b>, e termina no globo do olho, entre o musculo proprio da capella. (SANTUCCI, Bernardo, 1739)";"33";"Orbita";"órbita";"SpaceAfter=No";"Órbita";"1"
"17793";"AnatomiadeSantucci.txt";915;"O obliquo segundo, e inferior menos, nasce perto a margem da <b>Orbita</b>, e termina no olho, onde os musculos rectos acabaõ. (SANTUCCI, Bernardo, 1739)";"15";"Orbita";"órbita";"SpaceAfter=No";"Órbita";"1"
